commit	combined	combined_mean	combined_min	clean_fp	n_datasets	combined_singing	combined_korean	combined_english	clean_fp_singing	clean_fp_korean	clean_fp_english	status	description
0cdd87e	0.507837	0.552589	0.295455	7	3	0.295455	0.537313	0.825000	5	2	0	discard	add voiced_unvoiced_zcr_asymmetry (FEATURE_NAMES 80->81) -- STRUCTURAL pivot onto TIME-DOMAIN content axis. Apply proven voiced/unvoiced paired-difference template (1eda8e3 NEAR MFCC kept +0.054 biggest win, 7972a98 NEAR spec_contrast kept +0.005) to zero-crossing rate (ZCR) rather than any spectral/cepstral/pitch/energy axis. pre[t-2,t] post[t,t+2]: voiced_delta=mean(zcr[voiced in post])-mean(zcr[voiced in pre]), unvoiced_delta=mean(zcr[unvoiced in post])-mean(zcr[unvoiced in pre]), feature=unvoiced_delta-voiced_delta. Reuses cached feat_zcr (librosa ZCR hop 512) + feat_vp (voicing probability hop 512 -- same frame rate, trivial alignment). ZERO new librosa calls, ZERO new caches. Sentinel 0.0 when any mask empty. FEATURE_NAMES 80->81 forces wrapper auto-retrain via US-505 sha gate. Last 18+ iterations exhausted spectral/cepstral content axes (MFCC/spec_contrast/chroma/spec_flatness at NEAR/MID/WIDE/FAR/narrow-gap/balanced-span), energy-level (c006d52 RMS dB -> 0.491), F0 distribution shape+location (27ddbf7 IQR -> 0.524, 1d1144d median cents -> 0.508), and detector post-filter (60196aa peak-width -> 0.491). CLAUDE.md mandates structural change after 5+ same-axis failures. Block 6 has zcr_pre/zcr_post/zcr_delta (all-frame, no voicing split) but GBM has never seen ZCR paired-differenced on a voicing mask. ZCR is genuinely TIME-DOMAIN (count of sign crossings per frame) -- orthogonal to every prior content axis, all of which are spectral/cepstral/pitch-shape/energy. Mic+preamp high-frequency response and codec quantization drive ZCR baseline on unvoiced frames; vocal-tract resonance drives voiced ZCR baseline. Cross-song splice crosses mic+preamp (and often codec in tier1/tier2 mixed-format chunks) -> ZCR baseline shifts DIFFERENTLY on voiced (stable vocal-tract signal) vs unvoiced (noise-dominated, tracks mic). Mechanism on 3 singing chord-cycle FPs: within one song mic/preamp/codec frozen -> voiced ZCR stays at singer baseline (~4-8/frame), unvoiced ZCR stays at mic noise-floor baseline (~15-25/frame); chord transition does NOT change mic/preamp/codec -> voiced_delta and unvoiced_delta both ~0 -> asymmetry ~0 silent, FP not boosted. Same-singer cross-song: voiced_delta small (similar formants -> similar ZCR on vowels), unvoiced_delta LARGE because new mic noise floor + new codec quantization -> asymmetry POSITIVE, real TP boosted. Different-singer cross-song: both shift; 1eda8e3 MFCC asymmetry already fires. Speech self-gating via paired differencing (reproduces 1eda8e3 mechanism): on english/korean voiced ZCR and unvoiced ZCR both vary with phoneme density but within SAME recording mic/preamp continuous -> voiced+unvoiced baselines shift together with phoneme context -> DIFFERENCE zero-mean noise -> GBM low per-domain SHAP on english/korean. Why ZCR over remaining 1D scalar candidates (spec_bandwidth/centroid/rolloff): spectral moments already seen via all-frame deltas (block 2 top-SHAP) and failed to bite 3 chord-cycle FPs; ZCR is the one time-domain scalar in cached context absent from any paired-diff feature. Why NOT another 1D scalar failure mode: c006d52 RMS dB failed (auto-leveling flattens mastering), F0 IQR/median failed (within-speaker range overlaps cross-song at 2s), spec_flatness failed (Wiener entropy tracks chord-cycle). ZCR structurally different -- COUNT signal, integer-like, dominated by high-freq+codec not loudness/pitch/tonality. Orthogonal: NOT 1eda8e3 (cepstral cosine), NOT 7972a98+variants (spec_contrast), NOT f4148cc (chroma), NOT 0c3bf76 (flatness abs-delta), NOT c006d52 (RMS dB), NOT 27ddbf7/1d1144d (F0), NOT block-6 zcr_delta (all-frame no mask), NOT 60196aa peak-width (detector), NOT any percussive/harmonic/tonnetz/geometry variant. FIRST TIME-DOMAIN voiced/unvoiced paired-diff feature in 80-feature set, FIRST mask-split ZCR. Pure features.py change -- 1 new block (~40 lines cloned from _block_voiced_unvoiced_mfcc_asymmetry with 1D scalar mean replacing 13-dim cosine) + 1 FEATURE_NAMES append + 2 assert bumps (80->81) + 1 call in extract_features. ZERO new caches, ZERO new librosa calls. Per-t cost: 4 slices + 4 masked means + 2 subtractions, sub-ms. Smoke-verified: len(FEATURE_NAMES)==81, last name 'voiced_unvoiced_zcr_asymmetry', real train/singing/tier1 audio t=5s yields asym=+0.00151 (finite non-trivial), sentinel 0.0 on all-voiced 2s windows (common -- feature fires sparsely on mixed-voicing content), all 81 features finite on synthetic + real audio, idempotent on repeated calls.
7a170b0	0.542324	0.581057	0.323810	4	3	0.323810	0.604545	0.814815	3	1	0	discard	add voiced_unvoiced_spec_bandwidth_asymmetry (FEATURE_NAMES 80->81) -- cited fallback from 0cdd87e(c)(1). Voicing-masked paired-diff on the 1D spectral-bandwidth second-order moment (std around centroid), the only untried 1D spectral moment on the proven voiced/unvoiced template (1eda8e3 MFCC +0.054 biggest keep, 7972a98 spec_contrast +0.005). pre[t-2,t] post[t,t+2]: voiced_delta=mean(bw[voiced post])-mean(bw[voiced pre]); unvoiced_delta=mean(bw[unvoiced post])-mean(bw[unvoiced pre]); feature=unvoiced_delta-voiced_delta. Reuses cached feat_bandwidth (hop=512 (1,n)) + feat_vp (hop=512 (n,)), ZERO new librosa calls, ZERO new caches. Sentinel 0.0 on empty mask. FEATURE_NAMES 80->81 forces wrapper auto-retrain via US-505 sha gate. Last 20+ iterations exhausted voiced/unvoiced paired-diff across MFCC/spec_contrast/chroma/spec_flatness/RMS-dB/ZCR + every geometry + F0 distribution shape+location + detector post-filter. CLAUDE.md mandates structural change after 5+ same-axis failures; bandwidth is the ONE untried 1D spectral moment on the paired-diff template. Block 2 carries spec_bandwidth_delta ALL-FRAME only. GBM max_depth=3 cannot synthesize voicing-conditional bandwidth from (bandwidth_delta, voicing_prob_pre, voicing_prob_post) via independent threshold splits; paired-diff is a subtraction interaction trees cannot express. Mechanism on 3 singing chord-cycle FPs: within-song mic+EQ+compression frozen, voiced bandwidth at singer-formant baseline ~500-1200Hz spread, unvoiced at drums+noise-floor ~2000-4000Hz spread, chord transition does NOT change mic/EQ -> voiced_delta~0 AND unvoiced_delta~0 -> asymmetry~0 silent. Same-singer cross-song: voiced_delta small (similar formant spread), unvoiced_delta LARGE (new drum-bus EQ + different mastering limiter shapes post-vowel-tail spread) -> asymmetry POSITIVE, TP boosted. Different-singer: both shift; existing 1eda8e3 MFCC asymmetry fires. Speech self-gating (1eda8e3 mechanism): voiced bandwidth varies with vowel identity (i/a/u spread) but within same recording mic+EQ continuous -> voiced+unvoiced deltas both respond to phoneme context correlated -> DIFFERENCE is zero-mean noise -> GBM low per-domain SHAP on english/korean. Why bandwidth over remaining 1D moments: spec_centroid (F0-correlated on voiced, partial dup of F0_mean_delta); spec_rolloff (percentile, coarser proxy for same EQ info); spec_flatness already tried (0c3bf76 0.539). Bandwidth is second-order spectral moment (std around centroid), more directly mastering-EQ-signature than centroid, NOT duplicated by any existing paired-diff feature. Classifier hyperparam axis verifiably broken (5+ iterations IDENTICAL 0.490700); only features.py-sha bumps force retrain. Orthogonal: NOT 1eda8e3 (MFCC cosine); NOT 7972a98/d290101/177d641/88adb49/6c6c254/347c0ac (spec_contrast); NOT f4148cc (chroma); NOT 0c3bf76 (spec_flatness abs-delta asym); NOT c006d52 (RMS dB); NOT 0cdd87e (ZCR); NOT 27ddbf7/1d1144d (F0); NOT block-2 spec_bandwidth_delta (all-frame no mask); NOT 60196aa peak-width. FIRST spec_bandwidth voicing-masked paired-diff, SECOND-ORDER spectral moment axis. Pure features.py change -- 1 new block (~35 lines cloned from _block_voiced_unvoiced_mfcc_asymmetry with 1D scalar mean replacing 13-dim cosine) + 1 FEATURE_NAMES append + 2 assert bumps (80->81) + 1 call in extract_features. Per-t cost 4 slices + 4 masked means + 2 subtractions, sub-ms. Smoke-verified: len(FEATURE_NAMES)==81, last name 'voiced_unvoiced_spec_bandwidth_asymmetry', mixed-voicing synthetic audio with EQ-shifted noise-floor yields -228.8 at splice boundary vs +42.3/-18.2 within-source (~5x discrimination), empty-mask sentinel 0.0, all 81 features finite, idempotent on repeated calls.
8fc7169	0.471813	0.519750	0.268657	8	3	0.268657	0.485714	0.804878	5	3	0	discard	add voicing_transition_rate_delta (FEATURE_NAMES 80->81) -- STRUCTURAL pivot onto VOICING-MASK TEMPORAL STRUCTURE itself, not content of voiced/unvoiced split. feature = |post_rate - pre_rate| where rate = count of voiced<->unvoiced transitions per second on binary mask (feat_vp > 0.5) in pre[t-2,t] vs post[t,t+2]. Reuses feat_vp only, ZERO new librosa calls, ZERO new caches. FEATURE_NAMES 80->81 forces wrapper auto-retrain via US-505 sha gate. 20+ iterations exhausted voiced/unvoiced paired-diff template across MFCC/spec_contrast/chroma/spec_flatness/RMS-dB/ZCR/spec_bandwidth content axes + F0 distribution shape+location + detector peak-width. CLAUDE.md mandates structural change after 5+ same-axis failures. Every prior voiced/unvoiced asymmetry uses the voicing mask to SELECT FRAMES for content computation; the VOICING MASK ITSELF as a signal (its TEMPORAL PATTERN) is genuinely untried. Block 5 has voicing_prob_pre/post/delta but these are MEANS (duty cycle), NOT RATE of transitions. GBM max_depth=3 cannot synthesize transition count from mean alone; vp_mean=0.7 can arise from one long voiced run (0 transitions) or 5 alternating runs (8 transitions) and mean collapses them identically. Mechanism on 3 surviving singing chord-cycle FPs: singer's phrasing rhythm (syllables/s, breath pattern, consonant density) is a habitual style held constant across verse/chorus; chord transitions do NOT change phrasing rhythm -> pre_rate ~ post_rate -> |delta| ~ 0 silent, FP not boosted. Cross-song: different tempos/styles (ballad 80 BPM legato vs up-tempo 140 BPM staccato) -> transitions/s shifts meaningfully 2.0 -> 3.5, feature POSITIVE, TP boosted. Speech self-gating: within-recording speaker speech rate consistent, pre/post rates within +-0.5/s -> feature small -> GBM low per-domain SHAP on english/korean. Cross-speaker splice (TP) crosses different speech rates -> feature fires contributing to discrimination. Why rate over alternatives: duty cycle (mean vp) already in-set; longest-run inversely proportional to rate for fixed mean; run-length variance noisy on 2s (few runs). Transition count/s is simplest robust rhythm signature absent from feature set. Orthogonal: NOT 1eda8e3 (MFCC content cosine); NOT 7972a98/d290101/177d641/88adb49/6c6c254/347c0ac (spec_contrast content variants); NOT f4148cc (chroma content); NOT 0c3bf76 (spec_flatness content); NOT c006d52 (RMS dB content); NOT 0cdd87e (ZCR content); NOT 7a170b0 (spec_bandwidth content); NOT 27ddbf7/1d1144d (F0 distribution); NOT block-5 voicing_prob_pre/post/delta (voicing MEAN not RATE); NOT 60196aa detector peak-width; NOT block-1 dsp_pairwise_proximity. FIRST voicing-mask-TEMPORAL-STRUCTURE feature, FIRST rhythm feature derived from voicing mask itself. Pure features.py change -- 1 new block (~20 lines) + 1 FEATURE_NAMES append + 2 assert bumps (80->81) + 1 call in extract_features. Per-t cost 2 slices + 2 boolean casts + 2 diff+sum ops on ~172-frame arrays + 2 divisions, sub-ms. Smoke-verified: len(FEATURE_NAMES)==81, last name 'voicing_transition_rate_delta', synthetic alternating voiced/unvoiced 0.5s segments yields delta=1.0 finite non-trivial, stationary all-voiced returns 0.0, all 81 features finite on synthetic mixed audio, idempotent on repeated calls, voicing_prob_pre~0.99 vs voicing_transition_rate_delta=1.0 confirm they measure distinct aspects of voicing mask.
e234649	0.507418	0.553413	0.295385	6	3	0.295385	0.529412	0.835443	4	2	0	discard	add voiced_unvoiced_spec_rolloff_asymmetry (FEATURE_NAMES 80->81) -- last untried 1D spectral moment on the proven voiced/unvoiced paired-diff template (1eda8e3 NEAR MFCC kept +0.054 biggest win, 7972a98 NEAR spec_contrast kept +0.005). pre[t-2,t] post[t,t+2]: voiced_delta=mean(rolloff[voiced post])-mean(rolloff[voiced pre]); unvoiced_delta=mean(rolloff[unvoiced post])-mean(rolloff[unvoiced pre]); feature=unvoiced_delta-voiced_delta. Reuses cached feat_rolloff (librosa.spectral_rolloff, hop 512, shape (1,n)) + feat_vp, ZERO new librosa calls, ZERO new caches. Sentinel 0.0 on any empty mask. FEATURE_NAMES 80->81 forces wrapper auto-retrain via US-505 sha gate. Cited fallback from 7a170b0(c)(1). Last 22+ iterations exhausted voiced/unvoiced paired-diff across MFCC (kept), spec_contrast (kept), chroma (f4148cc), spec_flatness (0c3bf76 -> 0.539), RMS dB (c006d52 -> 0.491), ZCR (0cdd87e -> 0.508), spec_bandwidth (7a170b0 -> 0.542), every geometry (NEAR/MID/WIDE/FAR/narrow-gap/balanced-span), F0 distribution (IQR 27ddbf7, median-cents 1d1144d), voicing-mask temporal structure (8fc7169 -> 0.472), and two detector post-filters (60196aa peak-width -> 0.491). spec_rolloff is the ONE remaining 1D spectral descriptor on this template. Block 2 carries spec_rolloff_delta all-frame only; GBM has never seen rolloff voicing-split. GBM max_depth=3 cannot synthesize voicing-conditional rolloff from (rolloff_delta, voicing_prob_pre, voicing_prob_post) via independent threshold splits; paired-diff is a subtraction interaction trees cannot express. Why rolloff distinct from bandwidth/centroid/flatness: centroid=1st moment (F0-correlated); bandwidth=2nd moment (std); flatness=Wiener entropy (already tried 0c3bf76). Rolloff=85th-percentile HF cutoff directly measures mastering chain LP behavior (master limiter + EQ + codec; Opus rolls off ~20 kHz, MP3-128 ~16 kHz). Percentile statistic robust to spectral-shape outliers that drive bandwidth jitter. Mechanism on 3 singing chord-cycle FPs: within-song limiter+EQ+codec frozen, voiced rolloff at vowel HF baseline ~3-5 kHz, unvoiced rolloff at drum-bus HF baseline ~7-10 kHz; chord transition doesn't change limiter/codec/drum kit -> voiced_delta~0 AND unvoiced_delta~0 -> asymmetry~0 silent, FP not boosted. Same-singer cross-song: voiced_delta small (similar vowel HF), unvoiced_delta LARGE (new drum kit + new cymbal + possibly new codec, rolloff shift 500-2000 Hz) -> asymmetry POSITIVE, TP boosted. Different-singer cross-song: both shift; existing 1eda8e3 MFCC asymmetry fires. Speech self-gating via paired differencing (1eda8e3 mechanism): voiced rolloff on speech varies with vowel identity (/i,u/ lower than /a/); unvoiced rolloff varies with consonant type (fricatives ~8 kHz, plosives moderate); but within same recording mic+preamp+codec constant so voiced+unvoiced deltas both track phoneme context correlated -> DIFFERENCE is zero-mean noise -> GBM low per-domain SHAP on english/korean. Orthogonal: NOT 1eda8e3 (MFCC 13-dim cosine); NOT 7972a98 + every spec_contrast variant (7-dim cosine); NOT f4148cc (chroma 12-dim cosine); NOT 0c3bf76 (spec_flatness Wiener entropy); NOT c006d52 (RMS dB energy); NOT 0cdd87e (ZCR time-domain); NOT 7a170b0 (spec_bandwidth 2nd-moment std -- this is 85th-percentile); NOT 27ddbf7/1d1144d (F0 distribution); NOT block-2 spec_rolloff_delta (all-frame no mask); NOT 8fc7169 voicing_transition_rate_delta (mask structure); NOT 60196aa peak-width (detector); NOT any percussive/harmonic/tonnetz/geometry variant. FIRST percentile-based 1D spectral moment on voicing-masked paired-diff template. Pure features.py change -- 1 new block (~40 lines cloned from _block_voiced_unvoiced_spec_contrast_asymmetry with 1D scalar mean replacing 7-dim cosine) + 1 FEATURE_NAMES append + 2 assert bumps (80->81) + 1 call. Per-t cost 4 slices + 4 masked means + 2 subtractions, sub-ms. Smoke-verified: len(FEATURE_NAMES)==81, last name 'voiced_unvoiced_spec_rolloff_asymmetry', synthetic mixed voiced+noise audio yields finite -91.39 on noise region vs 0.0 sentinel on pure-voiced regions (expected -- synthetic pure-tone lacks unvoiced frames so mask-empty path fires), all 81 features finite, idempotent on repeated calls, edge-clamped t=1 returns sentinel via empty-mask path.
9064eec	0.544129	0.594880	0.300000	5	3	0.300000	0.623881	0.860759	4	1	0	discard	add mfcc_cross_intra_contrast (FEATURE_NAMES 80->81) -- SECOND-ORDER MFCC consistency feature. cross_dist - 0.5*(intra_pre + intra_post) over +-4s span (clipped to [t-4,t+4]; edge guard t-4<0 or t+4>duration -> 0.0). intra_pre=cos_dist(mean_mfcc(t-4,t-2), mean_mfcc(t-2,t)); intra_post=cos_dist(mean_mfcc(t,t+2), mean_mfcc(t+2,t+4)); cross=cos_dist(mean_mfcc(t-4,t), mean_mfcc(t,t+4)). Reuses cached feat_mfcc, ZERO new librosa calls, ZERO new caches. FEATURE_NAMES 80->81 forces auto-retrain via US-505 sha gate. 25+ iterations exhausted the 1D voiced/unvoiced paired-diff template on every content axis (MFCC/spec_contrast/chroma/spec_flatness/RMS-dB/ZCR/spec_bandwidth/spec_rolloff), every geometry (NEAR/MID/WIDE/FAR/narrow-gap/balanced-span), F0 distribution (IQR, median-cents), voicing-mask temporal structure (transition-rate), detector post-filter (peak-width) -- CLAUDE.md mandates structural change after 5+ same-axis failures. Untried dimension is SECOND-ORDER: comparing cross-boundary distance to intra-side self-distances on the same span. Every prior feature computes ONE distance (or one paired subtraction of masked distances on the SAME window). This feature computes THREE distances on distinct time windows and combines them. GBM max_depth=4/max_leaf=16 cannot synthesize via threshold splits on existing block-2 MFCC deltas because those are all single-cross-boundary. Mechanism on 3 singing chord-cycle FPs: singer+mastering+drum-bus continuous within one song so MFCC drifts steadily both BEFORE and AFTER t; intra_pre ~0.10 (one chord transition each side), intra_post ~0.10, cross averaging 2-3 chords bounded ~0.10 -> feature ~0 silent, FP not boosted. Real cross-song splice: intra_pre small ~0.04 (song A self-consistent), intra_post small ~0.04 (song B self-consistent), cross LARGE ~0.30 (A->B mastering+drum+singer jump) -> feature +0.26 STRONGLY POSITIVE, TP boosted. Sign-and-magnitude separation chord cycle (~0) vs real splice (+0.25+) is binary discriminator. Speech self-gating: 4s pre samples ~6-8 syllables -> intra_pre 0.08-0.15 phoneme drift; 4s post same -> intra_post 0.08-0.15; 4s-mean vs 4s-mean cross smooths phoneme variation -> cross 0.08-0.15 tracking intra -> feature ~0 across non-splice positions on english/korean. Speech splices TP handled by existing 1eda8e3 voiced_unvoiced_mfcc_asymmetry (+0.054 biggest keep). Why subtraction (not ratio): ratio amplifies near-zero-intra noise; subtraction zero-mean-balanced; 0.5*(intra_pre+intra_post) average smoother than max-over-intras. Why MFCC axis: 1eda8e3 proved MFCC carries singer/instrument timbre continuity signal (+0.054 biggest keep); intra-side baseline captures within-song timbre drift precisely where chord-cycle FPs sit. Orthogonal: NOT 1eda8e3 / any voiced_unvoiced_mfcc geometry (all 1st-order voicing-masked cross-boundary); NOT block-2 MFCC deltas (1st-order single distance no intra baseline); NOT 7972a98/spec_contrast variants; NOT f4148cc chroma; NOT 0c3bf76 spec_flatness; NOT c006d52 RMS dB; NOT 0cdd87e ZCR; NOT 7a170b0 spec_bandwidth; NOT e234649 spec_rolloff; NOT 27ddbf7/1d1144d F0; NOT 8fc7169 voicing transition rate; NOT 60196aa peak-width detector. FIRST SECOND-ORDER consistency feature in the 80-feature set. Pure features.py change -- 1 new block (~55 lines) + FEATURE_NAMES append + 2 assert bumps (80->81) + 1 call. Per-t cost: 6 slices + 6 means on 13-dim vectors + 3 cosines + 2 subtractions + 1 average, sub-ms. Smoke-verified: len(FEATURE_NAMES)==81, last name 'mfcc_cross_intra_contrast', synthetic A/B splice at t=10 yields 1.68 LARGE, within-source t=5 yields -8e-5 sentinel-near-zero (~20000x discrimination), edge guard t=1 (t-4<0) returns 0.0, edge guard t=17 with 20s audio (t+4>20) returns 0.0, all 81 features finite, idempotent on repeated calls.
