commit	combined	combined_mean	combined_min	clean_fp	n_datasets	combined_singing	combined_korean	combined_english	clean_fp_singing	clean_fp_korean	clean_fp_english	status	description
aa4f141	0.578070	0.628516	0.320000	4	3	0.320000	0.687500	0.878049	4	0	0	discard	add voiced_percussive_mfcc_asymmetry feature (FEATURE_NAMES 80->81) — PAIRED DIFFERENCING companion to 1eda8e3's voiced_unvoiced_mfcc_asymmetry on a new mask axis: percussive (top-40%% onset-strength frames) instead of unvoiced. Signed asymmetry percussive_mfcc_cosine_dist minus voiced_mfcc_cosine_dist on +-2s pre/post window. Reuses cached feat_mfcc + feat_onset + feat_vp with one lazy scalar perc_threshold = median(feat_onset)*1.2 — ZERO new librosa calls. Per-t cost 4 slices + 4 masked means + 2 cosines on 13-dim vectors, sub-ms. Sentinel 0.0 when either mask empty or sub-norm underflows. Targets 7972a98 current-keep (0.589282) singing 0.345 weakest-domain plateau. Mechanism: fd500b3's percussive_mfcc solo failed (singing 0.345->0.319) because GBM globally over-weighted transient-mask noise on speech. Paired differencing (asymmetry) is the proven fix — 1eda8e3 voiced_unvoiced_mfcc_asymmetry kept +0.054 (biggest win in the voiced-mask family). On singing: real same-singer-cross-song splice = held vocal note so voiced_mfcc_dist ~0.05 stable, but drum kit/mastering shifts so percussive_mfcc_dist ~0.30, asymmetry ~+0.25 LARGE POSITIVE — exact chord-cycle-vs-cross-song discriminator voiced_mfcc alone CAN'T see. Intra-song chord cycle: both stable (same singer, same drums) -> asymmetry ~0. Different-singer cross-song: both shift -> asymmetry cancels (GBM falls back to voiced_mfcc which fires anyway). On speech, plosive onsets (percussive mask) and vowel formants (voiced mask) both co-vary with phoneme context, so difference is zero-mean noise -> GBM low SHAP on english/korean (self-gates exactly the way fd500b3 solo couldn't). Explicit cited escalation from fd500b3(c)(3): 'PAIRED ASYMMETRY on the new axis (voiced_percussive_mfcc_asymmetry = percussive_mfcc_dist - voiced_mfcc_dist), making the accompaniment-vs-voice discriminator explicit in the way 1eda8e3 MFCC asymmetry did for voiced/unvoiced'. Critically orthogonal to voiced/unvoiced asymmetry family: PERCUSSIVE mask != UNVOICED mask — percussive is top-40%% onset-strength (tight transient subset: drum hits / bass attacks on singing, plosive bursts on speech); unvoiced is every non-voiced frame (broad: breath/silence/sibilant/consonant). Physically different populations of accompaniment signal. Orthogonal to every prior axis: NOT 1eda8e3 voiced_unvoiced_mfcc_asymmetry (unvoiced mask); NOT fd500b3 percussive_mfcc (single-mask, no differential — that's what failed); NOT 7972a98 voiced_unvoiced_spec_contrast_asymmetry (7-dim mastering not 13-dim cepstral); NOT f4148cc voiced_unvoiced_chroma_asymmetry (pitch-class); NOT 49bd0b1 voiced_mfcc (single-mask); NOT df6fc0a unvoiced_mfcc (single-mask); NOT 308aa5a tonnetz; NOT raw mfcc_delta (all-frames). First TRANSIENT-PAIRED ASYMMETRY in the voiced-mask family. Pure features.py change; FEATURE_NAMES count gate triggers wrapper auto-retrain via US-505 sha gate. Smoke-verified: len(FEATURE_NAMES)==81, last name 'voiced_percussive_mfcc_asymmetry', extract_features returns 81 finite features on synthetic audio, sentinel 0.0 fires on silence.
49fa2ca	0.516753	0.560817	0.318750	5	3	0.318750	0.502941	0.860759	3	2	0	discard	add onset_autocorr_cosine_dist feature (FEATURE_NAMES 80->81) — first RHYTHM/BEAT-PATTERN feature, genuinely new physical axis orthogonal to every prior voiced/unvoiced/percussive MASK variant and every spectral/cepstral/harmonic CONTENT feature. Autocorrelate feat_onset on pre=[t-4,t] and post=[t,t+4] (4-second windows = 8-13 beats at 60-200 BPM), normalize each by lag-0, extract beat-range slice [0.25s,1.25s] (= 48-240 BPM), return cosine distance between the two autocorr vectors. Reuses cached feat_onset — ZERO new librosa calls, ZERO new caches. Per-t cost 1-3 ms (numpy.correlate on ~345-frame segment). Beat-saliency gate: if either window's max normalized autocorr in beat range < 0.15, return sentinel 0.0 — hard-zeros speech where consonant onsets lack a dominant beat peak. Edge guard: window < max_lag+20 frames returns 0.0. FEATURE_NAMES 80->81 triggers wrapper auto-retrain via US-505 sha gate.
6384137	0.490700	0.537120	0.295385	6	3	0.295385	0.476471	0.839506	4	2	0	discard	add onset_autocorr_peak_lag_shift feature (FEATURE_NAMES 80->81) — SCALAR tempo-period shift companion to 49fa2ca's failed onset_autocorr_cosine_dist. Per position t_sec autocorrelate feat_onset on pre=[t-4,t] and post=[t,t+4] via numpy.correlate, normalize by lag-0, find argmax in beat-range lag window [0.25s,1.25s] (48-240 BPM), return |pre_peak_lag_seconds - post_peak_lag_seconds|. Beat-saliency gate: if either window's max normalized autocorr in beat range < 0.35, return sentinel 0.0 (hard-zeros speech + white noise). Edge guard: window < (max_lag+20) frames returns 0.0. Reuses cached feat_onset + feat_frame_hop + feat_sr — ZERO new librosa calls, ZERO new caches. Per-t cost 1-2 ms (numpy.correlate on ~345-frame segment). Targets 7972a98 current-keep (0.589282) singing 0.345 weakest-domain plateau where voiced/unvoiced/percussive MASK family has saturated last 10+ iterations (fd500b3 percussive_mfcc discard, aa4f141 voiced_percussive_asymmetry discard, 99081f5 HistGBM capacity bump discard, 49fa2ca onset_autocorr_cosine_dist discard) and singing won't budge off 0.318-0.345. CLAUDE.md mandates structural change after 5+ same-axis failures; mask axis exhausted. 49fa2ca failed by regressing korean 0.667->0.503 via cosine-on-86-dim-vector noise amplification — even with saliency gate, marginal-salience korean chunks leaked high-variance cosine values that GBM over-weighted. Explicit cited escalation from 49fa2ca(c)(2): 'replace with LAG-PEAK-SHIFT feature onset_autocorr_peak_lag_shift = |argmax(pre_ac) - argmax(post_ac)| / fps (smaller-magnitude scalar encoding tempo period shift in seconds, may be easier for GBM to split on)'. Mechanism: within one song drum groove fixes tempo, pre/post peak lags match within 1-2 frames -> lag_shift ~0.01-0.03s; cross-song splice crosses tempi (typical 10-50 BPM difference) -> lag_shift 0.05-0.30s 10-20x intra-song noise floor; intra-song chord cycles preserve tempo exactly (chord changes align to beat boundaries within same drum pattern) -> no lag shift -> feature silent. This is the chord-cycle-vs-cross-song discriminator voiced-mask family has failed to surface because voiced features care about tonal content not tempo. On speech, beat-saliency gate hard-zeros (threshold 0.35 tightened from 49fa2ca's 0.15 based on smoke data: white noise peaks 0.16-0.23, drums peak 0.74-0.83 — 0.35 cleanly separates). Why scalar beats cosine: (1) low variance — only PEAK POSITION matters, immune to noise in other lag bins; (2) bounded/physically meaningful in [0,1.0] seconds; (3) GBM tree splits on scalar see distribution directly, cannot misweight phantom per-bin correlations. Orthogonal to every prior axis: NOT 49fa2ca (cosine on 86-dim vector vs scalar peak-lag); NOT voiced/unvoiced/percussive MASK family (doesn't use frame masking; pure time-series autocorrelation); NOT spectral/cepstral/harmonic CONTENT features (TEMPORAL PATTERN only); NOT spec_flux_delta (single-t onset gradient at boundary); NOT boundary_spec_flux_peak (peak-at-boundary not tempo). First SCALAR rhythm feature in the 80-feature set. Pure features.py change; FEATURE_NAMES count gate triggers wrapper auto-retrain via US-505 sha gate. Smoke-verified: len(FEATURE_NAMES)==81, last name 'onset_autocorr_peak_lag_shift', same-tempo drums (120/120) yields 0.0, tempo-shift drums (120->150) yields 0.60 large positive, white noise yields sentinel 0.0 via saliency gate, edge t+4>chunk_dur yields 0.0, end-to-end extract_features returns 81 finite features.
ea1636c	0.455183	0.493545	0.300000	6	3	0.300000	0.405634	0.775000	2	4	0	discard	REMOVE voiced_spec_contrast_cosine_dist ghost feature (FEATURE_NAMES 80->79) — first ABLATION in 23+ iterations of pure adds. e7ca9eb introduced this feature and was DISCARDED (singing regressed 0.341->0.316) but the wrapper failed to revert features.py so it persisted 15+ iterations contaminating attribution. Every reflection since 1eda8e3 flagged this as a blocker. Remove list entry at line 146, extract_features call at line 1107, update both len(FEATURE_NAMES)==80 asserts to 79. Leaves dead _block_voiced_spec_contrast function in-file (minimal diff, zero runtime cost). The kept asymmetry feature voiced_unvoiced_spec_contrast_asymmetry (7972a98) computes voiced_dist + unvoiced_dist INLINE from feat_contrast + feat_vp so removing the voiced-only raw feature does NOT break the asymmetry — it forces GBM to route spec_contrast signal through the paired-difference discriminator only, eliminating the chord-cycle noise channel that e7ca9eb's per-vowel formant shifts create on within-song singing. Targets 7972a98 current-keep (0.589282) singing 0.345 plateau. Self-diagnostic: if ablation HELPS (>=0.589, singing >=0.345), confirms the 5+-iteration attribution-contamination theory; if HURTS (<0.574), proves the voiced-only feature was providing signal the asymmetry missed — information either way. Orthogonal to EVERY prior axis: ZERO prior feature-removal attempts — 50+ feature hypotheses since iteration 1 all ADDS. Not primary-tunable (detector.py unchanged), not hyperparam (train_classifier.py unchanged), not DSP post-filter, not ensemble/calibration/class_weight/audio-mutation. Pure features.py REMOVAL. Blast radius: 4 line edits. FEATURE_NAMES length change triggers wrapper auto-retrain via US-505. Smoke-verified: import OK, len(FEATURE_NAMES)==79, ghost feature absent from list AND from extract_features output, asymmetry feature preserved, 79 finite features on synthetic audio.
53d3ea0	0.527473	0.568750	0.325000	4	3	0.325000	0.531250	0.850000	4	0	0	discard	tighten DSP_SUM_MIN 5.0 -> 5.5 — one untried step remaining in a monotonically-improving primary-tunable axis. Pure detector.py one-line constant edit, stacked on existing MAX>=2.0 + GBM_THRESHOLD=0.982. No retrain, no feature change, features.py sha stable so classifier byte-identical. Targets 7972a98 current-keep (combined=0.589282) singing 0.345 weakest-domain plateau with clean_fp=3 survivors past the current SUM>=5.0 gate. The SUM axis has prior monotone keeps: 865d92f (SUM=4.5 kept 0.488) -> 29c06cf (SUM=5.0 kept 0.494, +0.006), and 29c06cf's own keep note explicitly cited 5.5 as the next escalation that was never tried because feature-axis exploration took over immediately after. Per-tunable frontier confirms only 4.5 and 5.0 tried in the SUM axis. Mechanism: real cross-source splices disrupt mic/room (phase_z) + spectral-distribution (T2_z) + complex-prediction (CPE_z) SIMULTANEOUSLY by physical construction, so sum(dsp_phase_z, dsp_t2_z, dsp_cpe_z) is typically 6-12 with big margin above 5.5. Chord-transition / speech-phoneme FPs are dominated by ONE strong channel (T^2=3) plus partial support from others (phase~0.7 + CPE~1.0 + or small variations), producing sum in [5.0, 5.8] — exactly the band 5.5 bites. The 3 singing clean FPs surviving 7972a98's gates by construction pass sum>=5.0 AND max>=2.0; if any sit in [5.0, 5.5] they drop under the new gate while real singing splices (which touch multiple DSP channels via cross-source disruption) are preserved. Classifier improvements over the last 40 iterations (75->80 features, HistGBM swap, voiced-mask + asymmetry families for MFCC/chroma/spec_contrast) have tightened p_splice on real TPs to near-1.0 so TPs comfortably pass DSP regardless of this gate's tightening. Orthogonal to every recent axis: NOT a feature add (features.py sha stable, no retrain); NOT a classifier hyperparam (train_classifier.py unchanged, 99081f5 HistGBM capacity bump discarded); NOT DSP_CONFIRMATION_MIN MAX gate; NOT GBM_THRESHOLD softmax gate (7255ec6 0.980 failed); NOT GBM_MIN_SEP_S dedupe geometry; NOT ANALYSIS_STRIDE_S scan density; NOT class-routed DSP (eb8984e failed); NOT HPR-routed DSP (failed); NOT channel-specific CPE floor (0.449 failed); NOT a feature removal (ea1636c catastrophic 0.455). The ONE unused step in a tunable axis whose prior steps were monotonically positive. Blast radius: 1-line constant edit plus comment refresh. Zero new code paths; per-emit cost unchanged (same sum+compare). Risk-bounded: stacked gate can only DROP emits, cannot create TPs; drops require cumulative-DSP below 5.5. Worst-case failure mode: smooth-crossfade TPs with phase/CPE firing weakly (sum 5.0-5.8) get dropped and recall falls — then fallback is DSP_CONFIRMATION_MIN 2.0->2.2 on the MAX axis (different channel-mass distribution, never tried). Smoke-verified: import DSP_SUM_MIN returns 5.5, all other tunables unchanged (DSP_CONFIRMATION_MIN=2.0, GBM_THRESHOLD=0.982, GBM_MIN_SEP_S=3.5).
0cb551f	0.490700	0.537120	0.295385	6	3	0.295385	0.476471	0.839506	4	2	0	discard	tighten DSP_CONFIRMATION_MIN 2.0 -> 2.2 (MAX floor) — first tightening of the MAX axis in the loop's history. Pure detector.py one-line constant edit plus comment refresh, stacked on existing SUM>=5.0 + GBM_THRESHOLD=0.982 + MIN_SEP=3.5. No retrain, no feature change, features.py sha stable so classifier byte-identical. Drops emits where max(dsp_phase_z, dsp_t2_z, dsp_cpe_z) < 2.2 even when SUM passes. Targets 7972a98 current-keep (combined=0.589282) singing 0.345 weakest-domain plateau with clean_fp=3 survivors past the current max>=2.0 gate. Last 10 iterations exhausted every other axis: feature-add (fd500b3 percussive_mfcc, aa4f141 voiced_percussive_asymmetry, 49fa2ca/6384137 rhythm/autocorr — all regressed), SUM tightening (53d3ea0 5.0->5.5 failed, dropped singing 0.345->0.325 via legitimate crossfade TPs in 5.0-5.5 band), feature removal (ea1636c catastrophic 0.455), classifier capacity bump (99081f5 discard). CLAUDE.md mandates structural change after 5+ same-axis failures — MAX floor is the ONE primary-tunable axis never tuned (history has only value 2.0). Explicit cited fallback from 7255ec6 ('If TPs don't rise but FPs do, fallback is tighten DSP_CONFIRMATION_MIN 2.0 -> 2.2') and from 53d3ea0 ('fallback is DSP_CONFIRMATION_MIN 2.0 -> 2.2 on the MAX axis — different channel-mass distribution, never tried'). Channel-mass distribution argument: the MAX gate bites emits where NO SINGLE channel is strong (2.0 <= max < 2.2), a strictly smaller set than SUM-tightening catches — chord-transition singing FP with T²≈2.1 + phase≈1.5 + CPE≈1.5 gives max=2.1 sum=5.1 passes both current gates but drops under MAX>=2.2. Real cross-source singing TPs produce at least one strong channel (phase_z>=3 or T²_z>=3) by physical mechanism (different mic/room, different spectral distribution) so max>=2.2 is structurally robust. Preferred over SUM-bumping because 53d3ea0 proved the SUM band 5.0-5.5 contains legitimate smooth-crossfade TPs; the MAX [2.0, 2.2] band is structurally different (all-channels-mediocre). Orthogonal to every recent axis: NOT a feature add (features.py sha stable, no retrain); NOT a classifier hyperparam (train_classifier.py unchanged); NOT DSP_SUM_MIN (53d3ea0 failed); NOT GBM_THRESHOLD (7255ec6 0.980 failed); NOT GBM_MIN_SEP_S; NOT ANALYSIS_STRIDE_S (0.11 failed); NOT class-routed DSP (eb8984e failed); NOT HPR-routed DSP; NOT channel-specific CPE floor (0.449 failed); NOT feature removal (ea1636c catastrophic). First MAX-axis tightening. Blast radius: 1-line constant edit + comment refresh. Zero new code paths. Per-emit cost unchanged (same max+compare). Risk-bounded: stacked on SUM so can only DROP emits past SUM; drops require max DSP in [2.0, 2.2] narrow band; cannot create TPs. Worst case: singing smooth-crossfade TPs with all channels in 2.0-2.2 band drop and recall falls — fallback is DSP_PHASE_MIN=0.5 (channel-specific phase floor, untried vs 0.449-failed CPE floor) or ANALYSIS_STRIDE_S=0.08 (denser scan, untried below 0.11). Smoke-verified: DSP_CONFIRMATION_MIN=2.2 loads, all other tunables unchanged (SUM=5.0 THR=0.982 SEP=3.5 STRIDE=0.12).
67633f2	0.421917	0.460532	0.232258	4	3	0.232258	0.491803	0.657534	4	0	0	discard	add DSP_PHASE_MIN=0.5 channel-specific floor
960113c	0.589282	0.633623	0.345312	3	3	0.345312	0.666667	0.888889	3	0	0	discard	REVERT 99081f5 HistGBM capacity-bump ghost (max_depth 4->3, max_leaf_nodes 16->8) — first hyperparam REVERT in loop history. Confirmed ghost via git-diff: 7972a98 baseline had max_depth=3/max_leaf=8 but HEAD carries max_depth=4/max_leaf=16 from 99081f5's un-rolled-back commit (99081f5 row ABSENT from results.tsv — suggests verify-fail whose diff never reverted). Every iteration post-99081f5 (49fa2ca, 6384137, ea1636c, 53d3ea0, 0cb551f, 67633f2) evaluated against 4/16 classifier while 0.589282 baseline was set at 3/8 — attribution contamination. Manually retrained, committed fresh joblib+cv_results+meta (f71c526 joblib-skip lesson). OOF weighted F1=0.6437 (vs 99081f5-reported 0.6321 on 4/16) — hard_cut F1 0.373, crossfade 0.342, both above 99081f5 baselines suggesting capacity bump may have been hurting fit quality too. Self-diagnostic: combined >= 0.589 confirms ghost theory and many recent discards deserve re-evaluation; combined < 0.589 proves 99081f5 was actually positive and reinstates 4/16 as the correct config. Orthogonal: NOT feature add (features.py sha stable); NOT primary-tunable (detector.py unchanged); NOT DSP gate; NOT new hyperparam exploration — REVERT of unauthorized ghost. First hyperparam REVERT in loop history. Blast radius: 2-line edit in make_pipeline() + regenerated bundle. Smoke-verified: reverted values load (max_depth=3, max_leaf_nodes=8), train completed in budget, OOF metrics non-degenerate.
b120d38	0.530924	0.581487	0.283333	3	3	0.283333	0.656250	0.804878	3	0	0	discard	widen ANALYSIS_STRIDE_S 0.12 -> 0.15 (untried sparser direction) — FIRST sparser-stride experiment in loop history. Pure detector.py one-line constant edit plus 4-line comment refresh, stacked on existing GBM_THRESHOLD=0.982 + GBM_MIN_SEP_S=3.5 + DSP_CONFIRMATION_MIN=2.0 + DSP_SUM_MIN=5.0. No retrain, no feature change, features.py sha stable so classifier byte-identical. Reduces candidate positions per 30s chunk ~250 -> ~200 (-20%%). Still ~23 candidates per 3.5s dedupe window. Per-tunable frontier: only 0.11 tried (failed, denser than current 0.12); 0.12 is codebase default never formally varied upward; sparser direction genuinely virgin. Every other primary-tunable axis saturated in both directions: GBM_THRESHOLD (0.980-0.983 all tested), GBM_MIN_SEP_S (3.75/3.6 failed sparser, below 3.0 adds FPs), DSP_CONFIRMATION_MIN (2.2 failed tighter), DSP_SUM_MIN (5.5 failed tighter). Feature-add axis saturated (10+ recent failures), feature removal catastrophic (ea1636c 0.455), classifier capacity revert matched baseline exactly (960113c 0.589282) confirming plateau is structural on classifier side. Targets 7972a98 current-keep (combined=0.589282) singing 0.345 weakest-domain plateau with clean_fp=3. Asymmetric-peak mechanism: TP vs FP p_splice peaks differ in time width. Real cross-source splices produce sustained spectral discontinuity (voice/accompaniment/mastering/mic-room shift persists ~0.3-0.5s past cut) so p_splice stays high across 3-5 consecutive grid points at 0.12 stride. At 0.15 stride same 0.3-0.5s TP plateau still hits 2-3 grid points -> dedupe picks maximum -> TP preserved. Chord-transition FPs driven by sharp spec_centroid_delta/spec_rolloff_delta/mfcc_delta peaks (~0.05-0.15s wide, 1-3 STFT frames). At 0.12 stride FP peak hits 1-2 grid points crossing threshold. At 0.15 stride narrowest FP peaks (0.05-0.10s wide) fall BETWEEN grid points (0.075s half-stride exceeds 0.05s peak half-width) -> no grid point samples resonance center -> adjacent-grid p_splice below threshold -> FP dropped. Asymmetry is structural: TP peaks broader because cross-source physics persists; FP peaks sharper because chord-transition spectral events are transient. Orthogonal to every recent axis: NOT a feature add (features.py sha stable, no retrain); NOT a classifier hyperparam (99081f5 ghost in-tree unchanged — orthogonal to my delta); NOT DSP_SUM_MIN/DSP_CONFIRMATION_MIN/DSP_PHASE_MIN (all stacked-DSP tightenings failed); NOT GBM_THRESHOLD; NOT GBM_MIN_SEP_S; NOT feature removal (ea1636c catastrophic); NOT class-routed/HPR-routed DSP. First sparser-stride experiment. Blast radius: 1-line constant + 4-line comment. Zero new code paths. Per-emit cost unchanged. Risk-bounded: stride can only MISS narrow-peak candidates predominantly FPs by physical prior; can't create new FPs; eval ~20%% FASTER (more headroom within 243/300s). Smoke-verified: ANALYSIS_STRIDE_S=0.15 loads, all other tunables unchanged (GBM_THRESHOLD=0.982, GBM_MIN_SEP_S=3.5, DSP_CONFIRMATION_MIN=2.0, DSP_SUM_MIN=5.0).
17d4aec	0.490700	0.537120	0.295385	6	3	0.295385	0.476471	0.839506	4	2	0	discard	HistGBM learning_rate 0.07 -> 0.05 (untried classifier axis)
db59c36	0.490700	0.537120	0.295385	6	3	0.295385	0.476471	0.839506	4	2	0	discard	HistGBM min_samples_leaf 20 -> 40 (untried regularization axis)
0c3bf76	0.538510	0.582107	0.318750	5	3	0.318750	0.573913	0.853659	3	2	0	discard	add voiced_unvoiced_spec_flatness_asymmetry feature (FEATURE_NAMES 80->81)
df0ceec	0.490700	0.537120	0.295385	6	3	0.295385	0.476471	0.839506	4	2	0	discard	HistGBM l2_regularization 1.0 -> 2.0 (final untried classifier axis)
