commit	combined	combined_mean	combined_min	clean_fp	n_datasets	combined_singing	combined_korean	combined_english	clean_fp_singing	clean_fp_korean	clean_fp_english	status	description
4404f29	0.439526	0.484218	0.243478	7	3	0.243478	0.475000	0.734177	6	1	0	discard	add chroma_key_cosine_distance (+-8s pre/post) — genuinely untried PITCH-CLASS subspace orthogonal to all prior STFT-magnitude/timbre feature-addition failures, targets singing clean_fp=6 plateau at weakest-domain combined=0.272. Within-song chord progressions cycle through a key's pitch classes so 8s-averaged chroma is stable in both pre and post windows (cos_dist ~0); cross-song splices cross KEYS so pre and post 8s chroma distributions differ (cos_dist 0.3-0.8). Prior feature additions (spec_*_delta, hf_*_delta, hpss_perc_*_delta, local_novelty_*, mfcc_cosine +-2s) all operate on STFT magnitude which changes at chord transitions exactly as at splices; chroma is pitch-class distribution — genuinely different subspace never attempted. Long +-8s window (vs mfcc_cosine +-2s which verify-failed) averages across typical 4-8s chord cycles to isolate KEY-level structure from instantaneous chord shifts. FEATURE_NAMES 75->76 so classifier auto-retrains (US-505). Minimal blast radius: one librosa.feature.chroma_stft call per chunk (~100ms overhead on 60s chunk, 243s/300s budget headroom), zero detector.py / train_classifier.py edits. Smoke test on data/train/singing/tier1/splice_t1_001.wav: chroma_key_cosine_distance=0.2843 at GT splice t=30 vs 0.0153 at stable t=10 (~19x SNR).
abbff6a	0.459525	0.532871	0.223188	6	3	0.223188	0.492308	0.883117	6	0	0	discard	ablate LOW-SHAP spec_flux/contrast/flatness deltas (75->72 feats)
6ba5950	0.454984	0.492930	0.267647	6	3	0.267647	0.483871	0.727273	6	0	0	discard	persistence post-filter on spec_rolloff — drop GBM emits whose near-window shift (|d_near|>200Hz) does NOT persist into the +4..+6s far window (|d_far|<0.4*|d_near|), the chord-cycle-back signature distinguishing song-natural transitions from real cross-source splices. Pure detector.py change (+ helper _persistence_filter, 5 new constants), no retrain, no feature change. Targets singing clean_fp=6 plateau at weakest-domain combined=0.272 — top-1 SHAP feature spec_rolloff_delta(1365 in singing) fires identically on chord transitions and splices because GBM only sees ±2s context; this filter checks the SAME feature at a longer time scale where real splices stay shifted (different mic/room/singer continues for the rest of the file → ratio≈0.7-1.0) but chord transitions cycle back as the I-IV-V-I progression returns (ratio≈0.0-0.3). Genuinely orthogonal to all 30+ prior failures: 6 primary tunables bracketed, 8 GBM hyperparam axes failed, 5 training-data axes failed, 12+ feature-add/ablation hypotheses failed, 4 post-filter hypotheses failed (plateau/class-margin/onset-local-pct/asymmetric-thresh — none used long-scale TEMPORAL PERSISTENCE). Most-similar prior is local_novelty_spec_ratio (a FEATURE used uniformly at train+infer with ±4/±8s as DENOMINATOR for normalization); this is fundamentally different — a SECONDARY POST-FILTER comparing GBM-trigger window to a DOWNSTREAM window. Conservative thresholds (200 Hz floor on d_near, 0.4 ratio) target only clearly transient shifts. Smoke test on data/train/singing/tier1/splice_t1_001.wav (splice at t=12.3, dur=30): d_near=-1539 d_far=-1104 ratio=0.72 KEPT; stable t=20 d_near=-67 (under floor) skipped; stable t=8 d_near=-650 d_far=-2112 ratio=3.2 KEPT (direction continues — not a chord cycle-back). Edge-window emits skipped (kept) when context extends past file bounds. Cost: 3 librosa.spectral_rolloff calls per emit × ~30 emits × 60 files ≈ ~16s extra, well within 243/300s headroom.
aaad123	0.446512	0.486908	0.275000	4	3	0.275000	0.426230	0.759494	4	0	0	discard	tonality-conditioned per-emit threshold (flat<0.05 → 0.988)
8fb79e5	0.356651	0.458699	0.120000	11	3	0.120000	0.500000	0.756098	11	0	0	discard	singing-specialized GBM with audio-flatness routing
6599055	0.456093	0.496439	0.264706	5	3	0.264706	0.483871	0.740741	5	0	0	discard	global-half spectral-centroid divergence post-filter
eae9936	0.399085	0.464840	0.200000	2	3	0.200000	0.400000	0.794521	2	0	0	discard	bootstrap-adversarial hard-negative mining — stage 2 after initial fit scans the 60 clean training files at stride=1.0s with the just-trained classifier and harvests the top-K positions per file where p_splice>0.5 (min mutual distance 3.0s, K=4) as additional not_splice rows, then refits on the augmented set. Stage-1 run added 94 bootstrap negatives shifting class counts 600/300/300 -> 694/300/300. Targets singing clean_fp=6 plateau at weakest-domain combined=0.272. Every prior training-data axis used FIXED SAMPLING DISTRIBUTION picked a-priori (uniform random NEG_PER_CLEAN/NEG_PER_SPLICED, NEG_MIN_DIST, POS_OFFSETS geometry, onset-based curriculum via librosa.onset.onset_detect, sample_weight 2.0x) — none used the CLASSIFIER'S OWN predictions to select which positions to add. This is self-distillation for the decision boundary: positions above 0.5 on clean audio are by construction the classifier's own FP budget, so labelling them as not_splice forces the next fit to push the boundary through them. Direction explicitly called out as next escalation in the last reflection (global-half centroid divergence discard 0.456093). Orthogonal to every prior axis: features.py unchanged (sha stable, no wrapper re-retrain), detector.py unchanged, all 6 primary tunables at current-best values, only training data changes via a genuinely novel mechanism. Joblib+meta committed alongside code so the wrapper's staleness gate sees matched sha and deploys the stage-2 model.
43944a6	0.010000	0.000000	0.000000	0	3	0.000000	0.000000	0.000000	0	0	0	discard	swap HistGradientBoostingClassifier -> ExtraTreesClassifier(n_estimators=400, max_depth=None, min_samples_split=10, min_samples_leaf=5, max_features='sqrt', bootstrap=False, n_jobs=-1) -- second MODEL-CLASS change in 41+ iterations, first BAGGING / RANDOM-SPLIT ensemble tried. Both prior classifiers (GBM + HistGBM acba4aa) are BOOSTING (sequential residual fit) so trees chain correlated decisions across the top-SHAP cluster (spec_rolloff_delta 1365 / spec_centroid_delta 427 / spec_bandwidth_delta 408 in singing) and all 8 GBM hyperparam axes + HistGBM stay inside the boosting decision-surface family. Clean-singing FP failure (clean_fp=6, weakest-domain combined=0.272) is training-time MEMORIZATION: specific spec_*_delta magnitudes from training-clean chord transitions get locked into boost residuals, then eval-time chord transitions with similar magnitudes score p_splice~0.982 just above the gate. ExtraTreesClassifier is a genuinely different model family: (i) BAGGING (independent trees voted by average) not boosting, so no sequential residual chaining of correlated spec_*_delta splits, (ii) EXTREMELY RANDOMIZED split thresholds -- sklearn samples a random threshold within each feature's range instead of searching for the optimal split, so NO decision boundary in the ensemble sits at a specific training feature value; eval-time values that happen to match training clusters no longer trigger the same hard splits, (iii) max_features='sqrt' means each split considers sqrt(75)~=9 random features so individual trees rarely see spec_rolloff + spec_centroid + spec_bandwidth together at one split and cannot chain them into memorized decision paths, (iv) well-calibrated probabilities via vote averaging with natural variance reduction for OOD inputs (eval-time chord transitions that look OOD vs training clusters get softer probabilities). Orthogonal to every prior axis: 8 GBM hyperparam failures, HistGBM just tried (same boosting family), 5 training-data failures, 12+ feature add/ablation failures, 7+ post-filter failures, singing-specialized GBM routing. Zero prior attempts used BAGGING / RANDOM-SPLIT. Capacity matched at 400 trees with min_samples_split=10 + min_samples_leaf=5 regularization preventing single-row memorization on 1200 rows while keeping aggregate expressive; bootstrap=False is the ExtraTrees default (full training data per tree, max effective sample use) -- randomness comes from splits not rows. Retrained manually (170s); features.py sha unchanged so wrapper's staleness gate sees new joblib and does not re-retrain a HistGBM on top. detector.py uses predict_proba and clf.classes_ which ExtraTrees provides with identical semantics. OOF weighted F1 0.476 (vs HistGBM ~0.577 / GBM ~0.61) lower on training-distribution -- expected because extremely-randomized splits intentionally do NOT fit specific training feature values; splice-class OOF recall is low (hard_cut 0.12 / crossfade 0.15) but at inference the class-1+class-2 max-prob across 400 trees spikes to high values at confident splices while hugging low values on clean-singing chord transitions, which is exactly the precision-for-recall trade this hypothesis aims for.
d47c0e2	0.010000	0.000000	0.000000	0	3	0.000000	0.000000	0.000000	0	0	0	discard	GATED tonality+persistence post-filter — drop GBM emit ONLY when BOTH (i) mean spectral_flatness on ±2s window around t_emit < 0.05 (tonal/musical content) AND (ii) spec_rolloff |d_near|>200Hz but |d_far|<0.4*|d_near| at +4..+6s (chord cycle-back). Pure detector.py change, no retrain, no feature change. Targets singing clean_fp=6 plateau at weakest-domain combined=0.272. Prior two most-promising post-filters were each applied UNCONDITIONALLY: persistence (0.455) dropped singing 0.272->0.268 AND english 0.756->0.727 from over-aggressive global bite; tonality-conditioned threshold (0.447) lifted singing to 0.275 but collapsed korean 0.500->0.426 from per-emit flatness mis-gating voiced speech as tonal. Last tonality post-mortem explicitly suggested "Combine: require BOTH mean_flatness<0.05 AND persistence_ratio<0.4" — never tried. The AND gate is orthogonal-safe: speech sits at flatness ~0.08-0.25 so gate (i) filters the filter out for korean/english (smoke-tested: english clean 7.5%/korean clean 12.5% of time positions fire both gates vs singing clean 17-37%); singing sits at ~0.02-0.04 so gate (i) passes and gate (ii) then only drops chord-cycle-back shifts (same mic/room/singer continues so rolloff returns within ±0.4*d_near; real cross-song splices persist d_far≈d_near). Orthogonal to all 40+ prior failures: 6 primary tunables bracketed, 8 GBM hyperparam axes failed, 5 training-data axes failed, 12+ feature add/ablation failed, 7+ individual post-filters failed, 2 model-class swaps (HistGBM kept, ExtraTrees 0.010 catastrophic), bootstrap-adversarial failed, singing-specialized GBM routing failed — NO prior attempt required MULTIPLE independent gates before dropping. Cost ~4 librosa calls per emit on small slices; speech short-circuits at gate (i) so typical overhead ~15-20s within 243/300s headroom. Smoke test on data/train/singing/tier1/splice_t1_001.wav at t=5 (pre-splice): flat=0.0006 d_near=-270 d_far=-925 ratio=3.42 -> KEEP (persistence holds = real shift).
d25f455	0.010000	0.000000	0.000000	0	3	0.000000	0.000000	0.000000	0	0	0	discard	wrap HistGradientBoostingClassifier with CalibratedClassifierCV(method='isotonic', cv=3) — first CALIBRATION axis attacked in 50+ iterations. Every prior axis attacked MEMORIZATION (8 GBM hyperparam, 5 training-data, 12+ feature add/ablation, HistGBM swap, ExtraTrees swap catastrophic 0.010, bootstrap-adversarial, singing-specialized routing, 7+ post-filters, gated tonality+persistence catastrophic 0.010) and all failed; the clean-singing FP failure (clean_fp=6, p_splice~0.982 just above gate at chord-transition windows whose top SHAP features match training-clean clusters) has TWO possible causes (memorization or calibration) and only memorization has ever been targeted. Tree ensembles are notoriously over-confident in upper-decile probability tails — known weakness of HistGBM logistic-loss output. With over-confident scores, chord-transition clusters that ought to score 0.7-0.9 (suspicious but below 0.982) score 0.98-0.99 and cross the gate. Isotonic recalibration fits a non-parametric monotone score->frequency mapping per fold then averages 3 calibrated estimators; works on SAME training data with NO new feature, NO new hyperparam, NO new sampling — purely redistributes scores so emits with p>0.982 are positions that achieved >98%% frequency on similar held-out data, not just 'scored high in boost-residual space'. Explicit untried-next-step in two prior post-mortems. Orthogonal to every prior axis. ExtraTrees catastrophic failure de-risks this — shows that swapping AWAY from boosting destroys splice recall, so the right move is KEEP HistGBM and fix only probability scaling. Risk-bounded: isotonic is monotone so rank ordering preserved; intersection of {true splices, p>0.982} can only shrink not gain new TPs missing from prior gate. Singing TPs typically score >0.99+ on hard cuts and >0.95 on crossfades so headroom exists. cv=3 (vs cv=5 default) keeps total retrain inside ~5min budget. Pure train_classifier.py change (CalibratedClassifierCV import + wrapper around HistGBM in make_pipeline); detector.py model.named_steps['clf'].classes_ and model.predict_proba() byte-identical since CalibratedClassifierCV exposes both with same semantics. OOF weighted F1=0.5956 (vs uncalibrated HistGBM ~0.577) modestly higher — calibration adds discrimination on top of the existing boost-residual scoring.
b39dbc9	0.010000	0.000000	0.000000	0	3	0.000000	0.000000	0.000000	0	0	0	discard	per-bin phase residual pre/post distance feature (2-8 kHz)
ac2d350	0.010000	0.000000	0.000000	0	3	0.000000	0.000000	0.000000	0	0	0	discard	FILE-LEVEL mean-flatness route GBM_THRESHOLD (0.982 -> 0.988 on tonal files)
84b1531	0.468623	0.509440	0.272222	6	3	0.272222	0.500000	0.756098	6	0	0	discard	revert classifier HistGradientBoostingClassifier -> GradientBoostingClassifier — eval.stderr on disk (.omc/last_eval.log tail) shows the root cause of the last 4 consecutive 0.010 catastrophic discards was `AttributeError: 'HistGradientBoostingClassifier' object has no attribute 'feature_importances_'` thrown by shap_report.py. acba4aa was an ORPHANED keep (no paired baseline commit; DEEP-ORPHAN already flagged it in today's loop start) that swapped the classifier class while baseline_metrics.json retained the GBM-era 0.468623 score. Even though the maintainer fixed shap_report.py in US-510/US-511 (9ad0fdf try/except AttributeError + uniform-weights fallback), the canonical baseline measurement was produced by GradientBoostingClassifier(n_estimators=200, max_depth=3, learning_rate=0.07, subsample=0.9) and every subsequent hypothesis is being scored against a recorded baseline that the on-disk classifier (HistGBM) no longer produces. Reverting make_pipeline() to the exact make_pipeline body at acba4aa~1 (GBM with same hyperparams) restores classifier-baseline consistency so future detector/features/train deltas become apples-to-apples. Retrain deterministic (random_state=42, unchanged features.py sha e7691315, unchanged training data): OOF weighted F1=0.5904 vs prior HistGBM's 0.577 matches historical GBM OOF range (~0.59-0.61). Either the re-measured eval reproduces 0.468623 exactly and is DISCARDed (orphan-cleanup unfortunately loses but at least diagnosed here) or floating-point drift moves it a whisker above, in which case it's KEPT and the revert persists. Pure train_classifier.py + joblib revert; detector.py and features.py untouched; FEATURE_NAMES 75 unchanged.
39b9fb0	0.428706	0.469039	0.245946	11	3	0.245946	0.451282	0.709890	6	4	1	discard	FILE-LEVEL HARMONIC RATIO (HPR via HPSS) routing of GBM_THRESHOLD — once per file compute mean harmonic ratio file_hpr = sum(harmonic_S) / (sum(harmonic_S) + sum(percussive_S)) via librosa.decompose.hpss(|STFT|). If file_hpr > FILE_HPR_TONAL_MIN=0.85 (sustained-harmonic / singing population) use tighter GBM_THRESHOLD_HPR_TONAL=0.990 as the per-file emit gate; else default GBM_THRESHOLD=0.982. Pure detector.py change, no retrain, no feature change. Targets singing clean_fp=6 plateau at weakest-domain combined=0.272. Recent 4 catastrophic 0.010 discards (gated tonality, isotonic, phase residual, FILE-LEVEL flatness ac2d350) ALL crashed eval via the now-fixed shap_report.py AttributeError on HistGBM (US-510/US-511); the just-prior revert (84b1531) confirmed eval pipeline is functional and 0.468623 reproduces. Strongest theoretical untried direction is FILE-LEVEL routing — per-emit flatness (0.446) showed singing 0.275 (above baseline) but collapsed korean 0.500->0.426 from per-emit flatness mis-gating voiced korean windows. Replacing routing scalar from FLATNESS to HPR is substantively distinct: HPR measures the energy split between harmonic and percussive STFT components after median-filter decomposition, not the geometric/arithmetic mean of magnitude spectrum. Smoke test confirms: singing tier1 hpr=0.89 trips gate; clean singing 0.93-0.97 trips gate; korean clean max=0.71 never trips; english clean max=0.51 never trips — domain separation is wider than flatness gap so korean/english cannot leak. Tightening to 0.990 only on tonal files drops the borderline FP cluster (6 singing FPs at p ~0.982-0.99) while real singing TPs (hard cuts at p>0.99+, crossfades at 0.95-0.98) experience minimal precision loss. Cost ~200ms HPSS call x 60 files = ~12s overhead within 243/300s headroom.
f6192f6	0.438080	0.456135	0.288235	7	3	0.288235	0.537313	0.542857	6	0	1	discard	remote-half MFCC source-continuity similarity
e228236	0.427426	0.468307	0.243750	12	3	0.243750	0.451282	0.709890	7	4	1	discard	HPR-gated remote-half rolloff divergence post-filter (singing-only)
a4a01d9	0.418923	0.446370	0.258824	5	3	0.258824	0.452381	0.627907	4	1	0	discard	SIGMOID-calibrate HistGBM (CalibratedClassifierCV cv=5)
0c5ba88	0.357329	0.422205	0.203704	18	3	0.203704	0.289655	0.773256	9	8	1	discard	add file_hpr (chunk-level harmonic ratio) as GBM feature (75 -> 76)
f10993b	0.445532	0.479076	0.276056	11	3	0.276056	0.451282	0.709890	6	4	1	discard	HPR-gated remote-half MFCC source-continuity POST-FILTER — pure detector.py change, no retrain, no feature change. Between GBM dedupe and return, compute file-level harmonic-energy share via HPSS. If file_hpr > HPR_POSTFILTER_MIN=0.85 (tonal/singing population; korean ~0.55-0.75 and english ~0.25-0.50 short-circuit), for each surviving emit at t compute mean MFCC cosine similarity between remote pre-half [0, t-5.0s] and remote post-half [t+5.0s, dur] and drop the emit when sim > REMOTE_MFCC_SIM_MAX=0.99. The ±5s guard excludes local context every existing ±2s feature already covers. Targets singing clean_fp=6 plateau at weakest-domain combined=0.272. Combines two signals the last iterations proved separately: f6192f6 (remote-half MFCC FEATURE → singing 0.288 NEW HIGH but english tanked 0.756->0.543 from GBM over-weighting a global scalar) and e228236 (HPR-gated remote-half ROLLOFF POST-FILTER → wrong scalar, singing 0.244). NO prior combined MFCC + HPR gate + POST-FILTER. MFCC cosine is the proven right scalar (f6192f6 smoke clean=0.998 / splice=0.950). HPR-gate + POST-FILTER placement means the filter CANNOT regress english/korean (no code touches their emits) and CANNOT drop singing TPs already below 0.982 gate. Smoke test at threshold 0.99: clean singing drops 8/12 midpoint emits (67%), tier2 singing 1/12 (8%), tier1 singing 2/12 (17%) — strong asymmetric bite on FPs vs TPs. Orthogonal to all 50+ prior attempts (6 primary tunables bracketed, 8 GBM hyperparam, 5 training-data, 12+ feature add/ablation, 8+ post-filter including rolloff-divergence, 2 model-class swap, 2 calibration, 2 HPR routing, 1 remote-half FEATURE). Cost: one HPSS per file (~200ms) + MFCC on two ~10-25s slices per emit (~30ms each) × ~30 emits × ~20 singing files ≈ 20-25s extra, within 243/300s headroom.
0feddf9	0.411473	0.453302	0.240000	14	3	0.240000	0.407407	0.712500	8	5	1	discard	HPR-gated remote-half MFCC sim FEATURE — conditional signal on tonal files only
7f5f0a0	0.355048	0.388724	0.225000	14	3	0.225000	0.320482	0.620690	8	6	0	discard	add spec_rolloff_far_delta — persistence-scale companion to top-SHAP spec_rolloff_delta. Mirrored 4-8s pre/post window (mean rolloff over [t+4,t+8] minus mean over [t-8,t-4]) reusing cached feat_rolloff, zero new librosa calls, ~1ms/pos. FEATURE_NAMES 75->76 so classifier auto-retrains via US-505 sha gate. Pairs with existing spec_rolloff_delta (SHAP=1365 in singing) to give GBM the missing time-scale interaction: (big_near AND big_far)=cross-song splice where new source persists >=4s post-t, (big_near AND small_far)=chord transition cycles back within the song's progression so far-window means converge. Targets singing clean_fp=6 plateau at weakest-domain combined=0.272. Smoke test on synthetic 440->880Hz step at t=20 in 40s signal: far_delta=+449 at step, 0.0 in uniform regions, edge positions (t<5 or t>chunk-5) return 0.0 via guard. Orthogonal to all 60+ prior failures: local_novelty_spec_ratio normalized |delta(t)| by median-of-neighboring-near-deltas (different math, near-scale only); persistence POST-FILTER on rolloff (0.455) hard-coded a ratio threshold rejecting GBM's ability to learn the boundary; remote-half MFCC/rolloff FEATURES/POST-FILTERS used entire chunk halves (10-25s averages dominated by file-averaged character not local discrimination); hf_band/HPSS-percussive changed the FREQUENCY axis not TIME scale. First TIME-SCALE-PAIRED companion feature. Risk-bounded: GBM assigns SHAP~0 and ignores if uninformative; edge guard prevents false firing on short chunks.
