commit	combined	combined_mean	combined_min	clean_fp	n_datasets	combined_singing	combined_korean	combined_english	clean_fp_singing	clean_fp_korean	clean_fp_english	status	description
79317c7	0.493616	0.535274	0.301613	6	3	0.301613	0.489394	0.814815	3	3	0	discard	drop HistGBM learning_rate 0.07 -> 0.05 (pure train_classifier.py hyperparameter change, no feature or detector edit) -- FIRST learning_rate tweak in post-HistGBM classifier history; genuinely untouched axis. 99081f5 noted prior lr experiments (9f66d66 lr 0.1->0.05) were in OLD GradientBoostingClassifier pre-acba4aa HistGBM swap; post-swap lr stood at 0.07 through 40+ classifier iterations unchanged. THEORETICAL PAIRING with d1be6c3 keep: d1be6c3 bumped max_iter 200->300 (1.5x) but kept lr at 0.07. Canonical GBM trade-off is lr x max_iter ~= constant for equivalent total fit; natural co-tune 0.07 x 200/300 ~= 0.0467 ~= 0.05. lr=0.05 completes the capacity-plus-compensation arc that 4b1575e l2 1.0->2.0 (kept) started. ORTHOGONAL to every other knob: l2 shrinks leaf output log-odds (4b1575e kept, f1e91ec 3.0 discard); min_samples_leaf is tree-GEOMETRY leaf-size-floor (fcb8f4e 20->40); max_depth/max_leaf_nodes/max_iter are tree-STRUCTURE capacity; sample_weight is loss-gradient bias (e4a9c18 catastrophic); SINGING_AUG is training-data diversity (4e2941b kept, 7b49d40 discard). lr is the per-TREE CONTRIBUTION scalar -- fundamentally different regularization mechanism. Mechanism on 3 surviving singing chord-cycle FPs: each of 300 trees contributes log-odds*0.07 currently; marginal FPs at p_splice ~0.983 (log-odds ~4.06) built by ~60-80 trees voting positively. Lowering lr to 0.05 (28.6%% reduction per tree) smooths log-odds landscape: chord-cycle-edge trees contribute proportionally less, while TP-voting trees compound across 300 iterations via law of large numbers so aggregate remains robust. Marginal FPs drop below 0.982; confident TPs (p_splice >=0.99, log-odds >=4.6) retain clearance via higher per-tree margin x many-tree support. DIFFERENT geometry than l2 (hits small-hessian leaves specifically) and DIFFERENT from min_samples_leaf (disallows small-leaf carve-outs structurally). Speech english 0.889 / korean 0.667 sit at log-odds well above threshold; multi-feature signatures with many-tree agreement keep speech predictions well above 0.982 even with 28.6%% per-tree shrinkage. Why 0.05 specifically: d1be6c3 1.5x max_iter pairs with lr/1.5=0.047, 0.05 nearest clean decimal; standard sklearn HistGBM progression {0.01, 0.05, 0.1}; bisection room to 0.06 if too aggressive or 0.03 if unchanged. Not 0.03 (too aggressive, drops TPs); not 0.06 (too small step to shift marginal FPs). Orthogonal: NOT fcb8f4e min_samples_leaf (leaf-size-floor); NOT 4b1575e/f1e91ec l2 (leaf log-odds); NOT d1be6c3 max_depth/max_leaf_nodes/max_iter (tree structure and ensemble size); NOT e4a9c18 sample_weight (loss-gradient bias); NOT 4e2941b/7b49d40 augmentation; NOT any features.py addition (FEATURE_NAMES stable 80, features.py sha unchanged); NOT any detector.py/DSP-gate/post-filter. FIRST post-HistGBM learning_rate experiment. Blast radius: 1 float literal in make_pipeline(). Training runtime: lr change alone doesn't affect per-tree cost; max_iter=300 fixed cap. Inference cost unchanged (same 300 trees). US-505b train_classifier.py sha gate auto-retrains from scratch. Smoke-verified: AST parse OK 460 lines, make_pipeline() constructs Pipeline with learning_rate=0.05 confirmed via named_steps[clf].learning_rate, other hyperparameters stable (max_iter=300 max_depth=5 max_leaf_nodes=32 l2_regularization=2.0 min_samples_leaf=40), FEATURE_NAMES stable at 80.
055285f	0.455793	0.502494	0.290909	10	3	0.290909	0.397297	0.819277	4	6	0	discard	drop HistGBM max_bins 255 -> 127 (pure train_classifier.py hyperparameter change, no feature or detector edit) -- EXPLICIT CITED FALLBACK from 79317c7(c)(3) after lr 0.07->0.05 discard: 'pivot to max_bins 255 -> 127 (histogram granularity, fundamentally different regularization axis: input-quantization rather than prediction-shrinkage)'. FIRST max_bins experiment in post-HistGBM classifier history; FIRST input-quantization regularization axis. Since fcb8f4e keep (min_samples_leaf 20->40), 7 consecutive discards on 7 different axes (a23ab28 music-gate, 1cded37 cluster-count, e4a9c18 sample_weight, 7b49d40 time-stretch, ca2aa2f HPSS, 425f6d6 voicing-gated threshold, f1e91ec l2 3.0, 79317c7 lr 0.05) -- structural pivots saturated, fallback axis is genuinely untouched. max_bins is INPUT QUANTIZATION: HistGBM discretizes every feature into <=max_bins bins before learning; each tree split chooses between these pre-computed bin boundaries. Default 255 gives sub-percentile granularity. Halving to 127 forces COARSER split thresholds on every feature simultaneously. Tight carve-out leaves that currently capture 3 singing chord-cycle FPs at specific sub-bins (e.g., voiced_chroma_cosine_dist bin 137 vs bin 138 ~0.4%% of feature range) disappear when bins 137-138 merge. DIFFERENT from l2 (shrinks log-odds but keeps tight split locations) and DIFFERENT from min_samples_leaf (requires larger leaf population but still at fine bin resolution). Mechanism on 3 surviving singing chord-cycle FPs: marginal above 0.982 on tight feature-space pockets; bin coarsening merges adjacent sub-bins where FP signatures live -> splits that separated 3 FPs from nearby not_splice rows no longer exist at bin-127 granularity -> GBM relies on coarser more generalizable thresholds -> marginal FPs drop below 0.982. Confident TPs (p_splice >=0.99) have much larger feature-value margin relative to bin width so survive coarsening. Speech english 0.889 / korean 0.667 carry multi-feature signatures with wide per-feature margins; halving bins barely shifts them. Why 127 specifically: sklearn HistGBM default 255, 127=2^7-1 clean half-step, standard progression {63,127,255}, bisection room to 191 if too aggressive or 63 if unchanged. Halving mirrors productive fcb8f4e min_samples_leaf 20->40 (2x) and 4b1575e l2 1.0->2.0 (2x) -- consistent regularization doubling on complementary axis. Orthogonal: NOT any features.py (FEATURE_NAMES stable 80, features.py sha unchanged); NOT detector.py (no DSP gate/threshold/post-filter); NOT max_iter/max_depth/max_leaf_nodes (tree structure stable); NOT learning_rate (per-tree contribution 0.07 stable); NOT l2_regularization (output shrinkage 2.0 stable); NOT min_samples_leaf (leaf size 40 stable); NOT sample_weight (loss-gradient); NOT SINGING_AUG (training-data diversity). Blast radius: 1 kwarg added in make_pipeline(). Training runtime slightly faster (fewer candidate split thresholds per node). Inference cost unchanged (same 300 trees). US-505b train_classifier.py sha gate auto-retrains from scratch. Smoke-verified: AST parse OK 461 lines, make_pipeline() constructs Pipeline with max_bins=127 confirmed via named_steps[clf].max_bins, other hyperparameters stable (max_iter=300 max_depth=5 max_leaf_nodes=32 learning_rate=0.07 l2_regularization=2.0 min_samples_leaf=40), FEATURE_NAMES stable at 80.
f6e05a7	0.443084	0.476121	0.300000	9	3	0.300000	0.395833	0.732530	3	5	1	discard	enable HistGBM early_stopping=True validation_fraction=0.15 n_iter_no_change=15 tol=1e-4 (pure train_classifier.py hyperparameter change, no feature or detector edit) -- EXPLICIT CITED FALLBACK from 055285f(c)(3) after max_bins 127 discard: 'pivot to early_stopping + validation_fraction (genuinely untouched classifier axis: built-in overfitting guard rather than direct regularization)'. FIRST automatic-overfit-guard experiment in post-HistGBM classifier history. Since fcb8f4e min_samples_leaf 20->40 keep, 9 consecutive discards on 9 different axes (a23ab28 music-gate, 1cded37 cluster-count, e4a9c18 sample_weight, 7b49d40 time-stretch, ca2aa2f HPSS, 425f6d6 voicing-gated threshold, f1e91ec l2 3.0, 79317c7 lr 0.05, 055285f max_bins 127) -- every direct-regularization classifier-hyperparameter knob explored. Default HistGBM early_stopping='auto' disables when samples <10k (our ~2000 rows qualify) so currently GBM always trains all 300 iterations regardless of validation divergence. Forcing early_stopping=True with tol=1e-4 (default 1e-7 effectively never triggers) adds AUTOMATIC overfit guard picking iteration count data-driven rather than hard-capping at 300. Mechanism on 3 surviving singing chord-cycle FPs: GBM likely overfits to chord-cycle-specific feature-space pockets in later iterations (past ~150-200 boosting rounds), carving tight leaves separating 3 FPs from nearby not_splice training rows via bin-level splits. Validation loss on held-out 15%% split plateaus earlier than training loss (classic overfitting signature). Early stopping at n_iter_no_change=15 tol=1e-4 cuts training at knee ~150-220 iter BEFORE GBM carves overfit leaves. Marginal FPs at p_splice ~0.983 drop toward baseline GBM at shallower boosting depth. Confident TPs (p_splice >=0.99) decided by first ~50-100 trees where strongest discriminators compound -- val loss still improving there so those trees preserved. Fundamentally different from l2 (leaf log-odds shrinkage ALL leaves uniformly); min_samples_leaf (structural leaf-size floor globally); max_bins (input quantization globally); lr (per-tree contribution scalar uniformly). early_stopping TERMINATES training adaptively based on data-observed divergence rather than globally reshaping decision surface. Why 0.15/15/1e-4: validation_fraction=0.15 over default 0.1 because training set small (~2000 rows) -- 0.15 gives ~300-row val statistically meaningful but leaves ~1700 training; n_iter_no_change=15 slightly more permissive than default 10 to avoid premature stopping from noisy per-iter val loss; tol=1e-4 empirical regime (default 1e-7 effectively never triggers within 300 iter); three values jointly produce genuine operational early stopping not no-op. Orthogonal: NOT features.py (FEATURE_NAMES stable 80, features.py sha unchanged); NOT detector.py (no DSP gate/threshold/post-filter); NOT any prior hyperparameter tweak -- early_stopping/validation_fraction/n_iter_no_change/tol GENUINELY untouched knobs in classifier history. Blast radius: 4 new kwargs in HistGradientBoostingClassifier() constructor. Training runtime slightly faster on stopping (typically ~200 iter instead of 300). Inference cost lower (smaller forest if triggered) or unchanged (300 iter if not triggered). US-505b train_classifier.py sha gate auto-retrains from scratch. Smoke-verified: make_pipeline() constructs Pipeline with early_stopping=True validation_fraction=0.15 n_iter_no_change=15 tol=0.0001 confirmed via named_steps[clf] introspection, other hyperparameters stable (max_iter=300 max_depth=5 max_leaf_nodes=32 learning_rate=0.07 l2_regularization=2.0 min_samples_leaf=40), FEATURE_NAMES stable at 80.
c7ff141	0.485147	0.524951	0.301613	7	3	0.301613	0.473239	0.800000	3	4	0	discard	add HistGBM class_weight={0: 1.3, 1: 1.0, 2: 1.0} (pure train_classifier.py hyperparameter change, no feature or detector edit) -- FIRST class_weight experiment in classifier history; FIRST per-CLASS loss-gradient weighting. Since fcb8f4e keep (min_samples_leaf 20->40), 10 consecutive discards on 10 different axes (a23ab28 music-gate, 1cded37 cluster-count, e4a9c18 per-DATASET sample_weight catastrophic, 7b49d40 time-stretch, ca2aa2f HPSS, 425f6d6 voicing-gated threshold, f1e91ec l2 3.0, 79317c7 lr 0.05, 055285f max_bins 127, f6e05a7 early_stopping) -- every direct-regularization classifier-hyperparameter knob (l2/lr/max_bins/min_samples_leaf/early_stopping/max_depth/max_iter) AND every feature.py/detector.py axis explored. sklearn HistGradientBoostingClassifier class_weight parameter (added in sklearn 1.2) has NEVER been explored. DIFFERENT from e4a9c18 per-DATASET sample_weight (weighted rows by DOMAIN: singing 2x catastrophic) -- this weights rows by CLASS LABEL (not_splice 1.3x, hard_cut + crossfade 1.0x). class_weight is the ONE untouched loss-gradient axis that specifically targets the FP-vs-TP trade-off by class rather than by domain. Cited f6e05a7(c)(3) RobustScaler fallback is effectively no-op for HistGBM (bin-based, quantile-binning invariant to monotonic scaling transforms). Mechanism on 3 surviving singing chord-cycle FPs: upweight not_splice class 1.3x in loss -> GBM pushes harder to correctly classify negatives -> positive log-odds lowered globally. Marginal singing chord-cycle FPs at p_splice ~0.983 (log-odds ~4.06) lose ~20-30%% log-odds from class-loss weighting (1.3x weight compounds across 300 trees via class-imbalance adjusted loss gradient) -> drop below 0.982 threshold -> 3 singing FPs drop. Confident TPs (p_splice >0.99, log-odds >4.6) retain comfortable margin even after the class-loss penalty. Speech english 0.889 / korean 0.667 TPs sit at log-odds well above threshold with multi-feature tree support; 1.3x nudge on negatives minimally shifts them. Why 1.3 specifically: e4a9c18 used 2.0 per-dataset catastrophic, 1.3 is moderate conservative first step mirroring 4b1575e l2 1.0->2.0 (2x) and fcb8f4e min_samples_leaf 20->40 (2x) productive-keep magnitudes but smaller (class_weight acts more directly on loss gradient so smaller bump appropriate); bisection room to 1.2 if too aggressive or 1.5 if unchanged; class_weight='balanced' as automatic fallback. Orthogonal: NOT any features.py addition (FEATURE_NAMES stable 80, features.py sha unchanged); NOT detector.py (no DSP gate/threshold/post-filter); NOT e4a9c18 per-dataset sample_weight (different axis: by DOMAIN not by CLASS); NOT any l2/lr/max_bins/min_samples_leaf/max_depth/max_iter/early_stopping/augmentation. Blast radius: 1 new kwarg in make_pipeline(). Training runtime unchanged (class_weight is per-row loss scalar, negligible). Inference cost unchanged (same 300 trees). US-505b train_classifier.py sha gate auto-retrains from scratch. Smoke-verified: AST parse OK 462 lines, make_pipeline() constructs Pipeline with class_weight={0: 1.3, 1: 1.0, 2: 1.0} confirmed via named_steps[clf].class_weight, other hyperparameters stable (max_iter=300 max_depth=5 max_leaf_nodes=32 learning_rate=0.07 l2_regularization=2.0 min_samples_leaf=40), FEATURE_NAMES stable at 80, sklearn 1.7.2 accepts class_weight param end-to-end (fit + predict_proba working on synthetic 3-class X/y).
4f94f3e	0.459090	0.513272	0.250000	7	3	0.250000	0.475000	0.814815	4	3	0	discard	add HistGBM interaction_cst='pairwise' (pure train_classifier.py hyperparameter change, no feature or detector edit) -- FIRST interaction_cst experiment in classifier history; FIRST feature-interaction-combinatorial regularization axis. Since fcb8f4e min_samples_leaf 20->40 keep, 11 consecutive discards on 11 different axes (a23ab28 music-gate, 1cded37 cluster-count, e4a9c18 per-DATASET sample_weight, 7b49d40 time-stretch, ca2aa2f HPSS, 425f6d6 voicing-gated threshold, f1e91ec l2 3.0, 79317c7 lr 0.05, 055285f max_bins 127, f6e05a7 early_stopping, c7ff141 class_weight) -- every MAGNITUDE-tuning classifier knob exhausted (l2/lr/max_bins/min_samples_leaf/max_iter/max_depth/max_leaf_nodes/class_weight/sample_weight/early_stopping). interaction_cst is STRUCTURAL-combinatorial rather than magnitude: constrains WHICH feature combinations trees may learn, not HOW MUCH they weight them. 'pairwise' restricts every tree to at most 2 features (GAM-like 2-way decomposition). Cited as natural multiclass replacement for c7ff141(c)(3) monotonic_cst fallback (sklearn raises ValueError for monotonic_cst on multiclass; interaction_cst supports multiclass -- smoke-verified fits 3-class synthetic data returns shape (200,3)). Mechanism on 3 surviving singing chord-cycle FPs: current max_depth=5/max_leaf_nodes=32 lets trees carve 5-feature conjunctions like 'voicing=0.4 AND chord_dist=0.1 AND mfcc_delta=0.2 AND tempo=110 AND onset=0.3 -> high p_splice' memorizing specific FP positions (unfindable as single 2-feature signal per 60+ failed features.py attempts). 'pairwise' makes such high-order conjunctions impossible -> FP-specific leaves disappear -> marginal FP p_splice ~0.983 drops below 0.982. Real TPs have SIMPLE 2-feature strong signals (DSP phase+t2+cpe pairs, voiced_unvoiced_mfcc_asymmetry + spec_contrast) -- 300 ensembled pairwise-trees compound these via law of large numbers, TPs retain strength. Speech english 0.889 / korean 0.667 multi-feature signatures decomposable to 2-feature ensembles retain clearance. Why 'pairwise' not 'no_interactions': no_interactions=decision stumps (1-feature) too aggressive dropping TP compounding; pairwise is conservative first step mirroring 4b1575e l2 1.0->2.0 and fcb8f4e min_samples_leaf 20->40 productive-first-step magnitudes. Bisection: 'no_interactions' if unchanged (stronger constraint); revert to None if regresses. Orthogonal: NOT any prior magnitude knob (l2/lr/max_bins/min_samples_leaf/max_depth/max_leaf_nodes/max_iter/class_weight/sample_weight/early_stopping -- all MAGNITUDE or STOPPING criteria); interaction_cst is COMBINATORIAL (restricts tree-topology space). NOT any features.py addition (FEATURE_NAMES stable 80, features.py sha unchanged); NOT detector.py (no DSP gate/threshold/post-filter); NOT augmentation axis (4e2941b/7b49d40). Blast radius: 1 new kwarg in make_pipeline(). Training runtime slightly faster (pairwise search cheaper per split than unrestricted). Inference cost unchanged (same 300 trees). US-505b train_classifier.py sha gate auto-retrains from scratch. Smoke-verified: AST parse OK 461 lines, make_pipeline() constructs Pipeline with interaction_cst='pairwise' confirmed via named_steps[clf].interaction_cst, other hyperparameters stable (max_iter=300 max_depth=5 max_leaf_nodes=32 learning_rate=0.07 l2_regularization=2.0 min_samples_leaf=40), FEATURE_NAMES stable at 80, sklearn accepts interaction_cst='pairwise' end-to-end (fit + predict_proba on synthetic 3-class X/y returns shape (300,3)).
3061196	0.491287	0.524443	0.350794	8	3	0.350794	0.422535	0.800000	3	5	0	discard	raise HistGBM min_samples_leaf 40 -> 80 (linear continuation of fcb8f4e keep 20->40)
5de4e19	0.455854	0.497908	0.313846	8	3	0.313846	0.375000	0.804878	3	5	0	discard	wrap HistGBM in BaggingClassifier(n_estimators=5, bootstrap=True)
4fe3877	0.077430	0.145712	0.000000	0	3	0.000000	0.181818	0.255319	0	0	0	discard	wrap HistGBM in CalibratedClassifierCV(sigmoid, cv=5, ensemble=False)
