commit	combined	combined_mean	combined_min	clean_fp	n_datasets	combined_singing	combined_korean	combined_english	clean_fp_singing	clean_fp_korean	clean_fp_english	status	description
29c06cf	0.493815	0.516283	0.360000	6	3	0.360000	0.457143	0.731707	2	4	0	keep	tighten DSP_SUM_MIN 4.5 -> 5.0 (direct cited escalation of 865d92f keep). Pure detector.py change, no retrain, no feature change. 865d92f kept the SUM-based DSP floor (sum of dsp_phase_z + dsp_t2_z + dsp_cpe_z >= 4.5 stacked on max>=2.0), lifting combined 0.479 -> 0.488 and recovering english 2 FPs. Remaining 2 singing + 4 korean clean FPs surviving SUM>=4.5 by construction sit in [4.5, ~5.5] — chord transitions with T^2=3 + partial support (sum 4.5-5.2), speech phoneme shifts with T^2=2.5 + CPE=1.0 (sum 4.5-5.5). Bumping to 5.0 bites this borderline band specifically. Real splices disrupt multiple physical signals so comfortably score sum 6-12 (median median margin >=1 above 5.0). Cited option 2 from 865d92f(c)(2) 'RAISE the SUM threshold to 5.0 if FPs persist'. Orthogonal within the DSP-post-filter axis (5.0 outside only prior tried 4.5) and to every other axis: not GBM_THRESHOLD (7255ec6 failed), not class-specific routing (d256901 failed), not MAX-floor tuning, not audio mutation/classifier/calibration/features. Risk-bounded by stacking: can only DROP emits past MAX, never create TPs; drops require single-channel/low-cumulative pattern. Per-emit cost unchanged (same sum+compare path). Blast radius: detector.py only, 1-line constant + comment refresh, feature_names unchanged so classifier sha stable (no retrain). Smoke: constant loads cleanly, DSP_SUM_MIN=5.0 read by existing gate logic at line 303.
eb8984e	0.479988	0.500534	0.360000	6	3	0.360000	0.434286	0.707317	2	4	0	discard	class-conditioned SUM threshold (hard_cut=5.0, crossfade=4.5) — add DSP_SUM_MIN_CROSSFADE=4.5 and move label_id argmax BEFORE the DSP gate so SUM threshold routes by predicted class. Pure detector.py change, no retrain, no feature change. Targets 29c06cf's singing 0.384->0.360 regression (now weakest domain at 0.360) caused by uniform SUM tightening 4.5->5.0 — korean (0.428->0.457) and english (0.707->0.732) gained from the tightening via precision on spliced files, but singing lost crossfade TPs whose DSP profile is T^2=2.5-3.5 (strong) with phase/CPE ~0.5-1.5 (singing sustained tones don't phase-break / complex prediction handles harmonic continuations), summing 3.5-5.2 — exactly the band 5.0 culls. Hard cuts produce phase+T^2+CPE simultaneously so sum 6-12 regardless of class-route, meaning keeping hard_cut at 5.0 preserves the korean/english precision wins. Explicit option (1) from 29c06cf(c): 'CLASS-CONDITION the SUM threshold: hard_cut->5.0, crossfade->4.5. Preserves crossfade recall while tightening on hard_cut where multi-channel confirmation is physically robust.' Orthogonal to d256901 (class-specific CHANNEL routing: phase>=2.0 for hard_cut / T^2>=2.0 for crossfade on top of MAX>=2.0 — failed 0.449 because it required a single specific channel to be strong); class-routed SUM still requires MULTI-CHANNEL cumulative support, just with class-appropriate magnitude. Orthogonal within the SUM-axis (only uniform thresholds tried: 4.5 kept 0.488, 5.0 kept 0.494). Risk-bounded: stacks on MAX>=2.0 gate AND GBM_THRESHOLD=0.982 so only admits additional emits where class is crossfade AND max DSP>=2.0. Worst case: korean/english crossfade-labeled FPs (speech phoneme shifts may label as crossfade at p~0.982-0.99 with sum ~4.6-4.9) reappear, dropping korean/english back toward 865d92f levels 0.428/0.707 — still above baseline because singing recovers. Blast radius: detector.py only, 1 constant + 3-line loop reorder, features.py sha stable (no retrain). Smoke: constants load cleanly, DSP_SUM_MIN=5.0 / DSP_SUM_MIN_CROSSFADE=4.5 / DSP_CONFIRMATION_MIN=2.0.
55b21e6	0.493815	0.516283	0.360000	6	3	0.360000	0.457143	0.731707	2	4	0	discard	HPR-gated SUM threshold — tonal files (file_hpr>0.85) relax DSP SUM floor 5.0->4.5, speech-dominant files keep 5.0. Pure detector.py change, no retrain, no feature change. Adds _file_hpr(audio,sr) helper (HPSS on middle 30s, ~100ms/file, graceful fallback to 0.0 on error) + constants DSP_SUM_MIN_TONAL=4.5 / FILE_HPR_TONAL_MIN=0.85 stacked on top of existing DSP_SUM_MIN=5.0 + DSP_CONFIRMATION_MIN=2.0 gates. Targets 29c06cf's singing 0.384->0.360 regression (now WEAKEST domain at 0.360) from uniform SUM tightening — class-routing (eb8984e failed 0.480, singing stuck 0.360) proved the lost TPs are hard_cut labeled not crossfade, so class-axis is wrong; explicit cited next-step from eb8984e(c)(2) is domain-routing via HPR. Mechanism: singing hard_cut TPs can sum [4.5,5.0] because sustained harmonic continuity keeps phase_z modest (2-3) while T2/CPE carry the signal; speech splices have sharper consonant phase discontinuity summing 6-12. HPR separates domains cleanly (428706 smoke: singing 0.85-0.97, korean <=0.71, english <=0.51) so relaxation is singing-only. Smoke-verified: sine 440Hz HPR=0.993 (triggers 4.5), white noise HPR=0.500 (stays 5.0). Orthogonal: 428706 HPR-gated GBM_THRESHOLD routed tighter on singing (opposite direction, failed 0.429); 427426/445532/411473 HPR-gated on remote-half features (different scalar); NO prior HPR-gated SUM threshold. Orthogonal within SUM axis (uniform 4.5 keep, 5.0 keep, class-routed fail). Risk-bounded: only RELAXES a strictly-subset gate on tonal files -> can only ADD emits relative to 29c06cf baseline on singing; cannot drop existing TPs. Worst case: singing FPs creep back (2 current + any [4.5,5.0] sum FPs), combined falls. Blast radius: detector.py only, ~25 lines (helper + constants + 1-line gate), features.py sha stable (no retrain), per-file cost ~100ms HPSS within 243/300s budget.
6b28235	0.448740	0.474336	0.351852	4	3	0.351852	0.362295	0.708861	1	3	0	discard	add dsp_cpe_z >= 1.0 channel-specific floor (stacked on MAX>=2.0 + SUM>=5.0) — cited untried from 29c06cf(c)(2) and 865d92f(c)(2). Pure detector.py change, no retrain, no feature change. DSP_CPE_MIN=1.0 added as third condition in the existing DSP gate at line 305, stacked on top of max>=2.0 and sum>=5.0. Targets 29c06cf's singing 0.360 (weakest domain) where 2 clean FPs survive — chord-transition FPs have smooth harmonic continuation so CPE typically 0.5-1.0 (complex prediction handles chord progressions well); a CPE>=1.0 floor surgically bites them. Real splices break cross-source prediction catastrophically so CPE=1.5-3 comfortably above the floor (0.5+ safety margin). Speech phoneme-shift FPs (korean mode) have CPE 0.8-1.5 so floor bites bottom half — partial win on a non-weakest domain. Orthogonal within the DSP-post-filter axis: 3 prior DSP variants (MAX at 2.0 kept, class-routed channel phase/T² at 2.0 failed, SUM at 4.5/5.0 kept, SUM-class-routed failed, SUM-HPR-routed dead) — ZERO prior CPE-specific channel floor. Orthogonal to d256901 (class-routed primary-channel at 2.0) because CPE is the THIRD channel never gated, and threshold 1.0 is BELOW MAX floor 2.0 so acts as secondary backstop not primary. Orthogonal to every other axis: 8 GBM hyperparam, 5 training-data SAMPLING, 12+ feature add/ablate, 2 model-class swap, 2 calibration, 2 HPR routing, 6 audio MUTATION, 1 ensemble. Risk-bounded: can only DROP emits past MAX+SUM, never create TPs; drop requires dsp_vals[2] (cpe_z column, index verified as 2 matching DSP_CONFIRMATION_CHANNELS order) < 1.0. Per-emit cost: one extra float compare past the stacked gate, negligible. Blast radius: detector.py only, 1 constant (+7 line comment block) + 1 new condition in 3-line gate, features.py sha stable (no retrain). Smoke: constants resolve DSP_CONFIRMATION_MIN=2.0 DSP_SUM_MIN=5.0 DSP_CPE_MIN=1.0; DSP_CONFIRMATION_CHANNELS.index('dsp_cpe_z')=2 confirming dsp_vals[2] is cpe_z column.
3e4e996	0.490259	0.508403	0.383607	6	3	0.383607	0.434286	0.707317	2	4	0	discard	pairwise-proximity-confirmed relaxation of DSP SUM gate (1.5 -> 4.5)
3b365fe	0.488272	0.504132	0.393750	6	3	0.393750	0.428169	0.690476	2	4	0	discard	additive pairwise-proximity DSP gate (eff_sum = sum+min(pw,2.0) >= 5.5)
634cdd2	0.488272	0.504132	0.393750	6	3	0.393750	0.428169	0.690476	2	4	0	verify-fail	add chroma_cosine_dist feature (FEATURE_NAMES 75->76)
9fe41d1	0.493815	0.516283	0.360000	6	3	0.360000	0.457143	0.731707	2	4	0	discard	chroma persistence_far post-filter (drop emits where pre/far chroma cosine dist <0.10 on tonal content) — cited next-step from 634cdd2(c)(3). Pure detector.py change, no retrain. Compute librosa.feature.chroma_stft once per chunk in _build_chunk_context (~50ms/60s chunk, norm=None). After existing MAX>=2.0 + SUM>=5.0 DSP gate, for each surviving emit at t compute mean chroma over pre [t-2, t] and far_post [t+4, t+8]. Per-emit tonality gate: max(pre_chroma)/mean(pre_chroma) > CHROMA_TONALITY_MIN=3.0 (intrinsically routes filter away from speech — speech windows have flat chroma ratio 1.0-1.5; smoke-verified white-noise=1.11). When tonal, drop emit if cosine distance < CHROMA_FAR_DIST_MIN=0.10. Edge guard: skip gate when t<2 or t+8>chunk_dur. Targets 29c06cf's singing 0.360 (weakest domain) where 2 chord-transition FPs survive — chord progressions cycle back to root key within 4-8s in pop/rock so far_dist ~0.02-0.10; real cross-source splices land in different key/scale that PERSISTS far after cut so far_dist 0.30-0.70. Smoke-verified: pure 440Hz sine pre-tonality=8.44, far_dist=2e-6 (would drop, correct). 440->622Hz tritone shift pre-tonality=8.47, far_dist=1.0 (would keep, correct). White-noise far_dist not evaluated because tonality 1.11 < 3.0 short-circuits gate. Orthogonal to every prior axis: not DSP z-score (chroma is harmonic-class-12 PCP); not class-routed; not file-HPR-routed (per-emit local tonality, not file-level); not the 634cdd2 chroma_cosine_dist FEATURE (different time scale FAR vs LOCAL ±2s, different mechanism POST-FILTER vs learned GBM feature, different normalization norm=None vs default 'inf'); not pairwise (chroma is harmonic-content, pairwise is segment-distance block-structure). Risk-bounded by stacking on MAX+SUM gates and tonality pre-gate: can only DROP emits past DSP that have tonal content AND chord-cycle pattern; cannot create TPs. Cannot regress english (FP=0; the only risk is dropping a TP, but english files are speech with chroma tonality <2.0 so gate never fires). Per-emit cost: 12-dim mean + cosine, sub-ms. Per-chunk cost: ~50ms chroma_stft x ~3 chunks/file x 60 files = ~9s within 243/300s budget. Blast radius: detector.py only, ~80 lines (helpers + 6 constants + ctx field + emit-loop integration); features.py sha stable so classifier byte-identical (no retrain).
68004ca	0.493815	0.516283	0.360000	6	3	0.360000	0.457143	0.731707	2	4	0	verify-fail	add tonality-gated chroma_local_dist_tonal feature (75->76)
49bd0b1	0.505589	0.548083	0.310345	4	3	0.310345	0.498462	0.835443	2	2	0	keep	add voiced_mfcc_cosine_dist feature (FEATURE_NAMES 75->76) — voiced-frame-only MFCC cosine distance between pre[t-2,t] and post[t,t+2]. Reuses cached feat_mfcc + feat_vp; per-t cost is two slices + masked mean + cosine, sub-ms. Sentinel 0.0 when either window has zero voiced frames. Targets 29c06cf's singing 0.360 weakest-domain plateau where 9 consecutive DSP-post-filter variants since 29c06cf failed (3 reproducing exact 0.493815) and CLAUDE.md mandates structural change after 5+ same-axis failures. Mechanism: existing mfcc_delta_NN averages over ALL frames so chord-transition spectral envelope shifts trigger it on FPs; restricting to voiced frames isolates vocal-tract / instrument timbre — same singer across a chord boundary keeps voiced MFCC similar (cosine_dist ~0.05), real cross-source splice shifts it (~0.30+). On speech, voiced=vowels and pre/post may have different vowels regardless of splice → high-variance noise; GBM learns low SHAP per-domain via tree splits so feature is functionally invisible on english/korean. Self-gates via voiced flag requirement so won't regress speech (the 634cdd2/68004ca chroma verify-fail mode required external tonality-gate which lacked clean signal). Orthogonal to every prior axis: not DSP, not spectral delta, not chroma (cepstral not pitch-class), not pairwise, NOT remote-half MFCC (438080/411473 used long half-chunk averages dominated by file-mean character; this uses LOCAL +-2s VOICED-RESTRICTED mean), NOT raw mfcc_delta (different masking — voiced-only vs all-frames). Pure features.py change; FEATURE_NAMES count gate triggers wrapper auto-retrain via US-505. Smoke: import + assert len(FEATURE_NAMES)==76 + last name 'voiced_mfcc_cosine_dist'.
32cac36	0.532261	0.569013	0.341379	3	3	0.341379	0.526154	0.839506	2	1	0	keep	add voiced_chroma_cosine_dist feature (FEATURE_NAMES 76->77) — voiced-frame-only chroma (pitch-class profile) cosine distance between pre[t-2,t] and post[t,t+2]. Reuses cached feat_vp plus a new per-chunk feat_chroma (one librosa.feature.chroma_stft call, hop/fft same as MFCC). Per-t cost is two slices + voiced-mask mean + cosine, sub-ms. Sentinel 0.0 when either window has zero voiced frames, matching 49bd0b1 pattern. Targets singing 0.310 weakest-domain regression caused by the just-kept voiced_mfcc_cosine_dist (49bd0b1 lifted english 0.732->0.835 and korean 0.457->0.498 via SPEAKER/INSTRUMENT-timbre continuity signal but dropped singing 0.360->0.310 because same-singer chord transitions keep voiced MFCC stable and the feature lowers p_splice on real crossfade TPs too). Mechanism: chroma is the canonical MIR pitch-class profile — within a song's key chord transitions share 3-5 of 12 pitch classes so voiced-chroma cosine distance is small (0.05-0.20), cross-song splices change key entirely giving 0.30-0.70. 634cdd2 proved ungated chroma_cosine_dist lifts singing 0.360->0.394 — the signal is real — but raw chroma regressed english/korean because GBM globally over-weighted a feature that is per-vowel prosodic noise on speech. Voicing-mask self-gating mirrors 49bd0b1: on speech voiced=vowels whose chroma swings with prosody regardless of splice -> high-variance noise -> GBM assigns low per-domain SHAP via tree splits, feature functionally invisible. On singing voiced=sustained sung notes whose pitch class IS the key signature -> GBM learns a clean discriminator. Orthogonal to every prior axis: NOT 634cdd2 (no mask), NOT 68004ca tonality-gated chroma (external max/mean ratio, verify-fail), NOT 9fe41d1 chroma persistence_far (post-filter, 4-8s window), NOT 49bd0b1 voiced_mfcc (cepstral not pitch-class — smoke confirms on 440Hz->C-chord: chroma dist=0.865 vs mfcc dist=0.014, orthogonal signals). Pure features.py change; FEATURE_NAMES count gate triggers wrapper auto-retrain via US-505. Smoke: import + assert len(FEATURE_NAMES)==77 + last name 'voiced_chroma_cosine_dist' + synthetic chord-shift yields dist=0.865.
ff65865	0.490508	0.509177	0.348333	3	3	0.348333	0.495652	0.683544	1	2	0	discard	add voiced_chroma_far_cosine_dist feature (FEATURE_NAMES 77->78) — FAR-window companion to 32cac36's voiced_chroma_cosine_dist. Same mechanism (voiced-mask restricted mean 12-dim chroma + cosine distance) but pre=[t-2,t] vs post_far=[t+4,t+8] so GBM sees the (near, far) TIME-SCALE JOINT. Reuses cached feat_chroma + feat_vp — zero new librosa calls. Edge guard: t+8 > chunk_dur returns sentinel 0.0 (matches 9fe41d1 pattern). Sentinel 0.0 also on zero-voiced-frame windows and zero-norm vectors, matching 49bd0b1/32cac36 safety pattern. Pure features.py change; FEATURE_NAMES count bump triggers wrapper auto-retrain via US-505 sha gate. Targets 32cac36 current-keep (combined=0.532) where singing remains weakest at 0.341. Mechanism: chord cycle-backs within a song's 4-bar progression (I-vi-IV-V etc.) produce high NEAR chroma distance (near feature fires ~0.3-0.5 at each chord transition) BUT the progression returns to the root chord within 4-8s so FAR-window chroma comes back to the same key signature (far_dist ~0.05-0.15). Real cross-song splices land in a different key/mode that PERSISTS 4-8s after the cut (far_dist ~0.3-0.7). GBM with only the near feature cannot distinguish these; with the (near, far) joint, tree splits learn "near>0.25 AND far<0.15 -> chord cycle (NOT splice)" vs "near>0.25 AND far>0.25 -> real cross-song (splice)". Voicing-mask self-gating mirrors 49bd0b1/32cac36: on speech voiced=vowels whose far-window chroma swings with prosody regardless of splice -> high-variance noise -> GBM assigns low per-domain SHAP, feature functionally invisible on english/korean. On singing voiced=sustained sung notes whose pitch class IS the key signature -> clean discriminator. Cited option (2) from 32cac36(c)(2): "add a second feature voiced_chroma_dist_far (pre=[t-2,t] vs far=[t+4,t+8]) so GBM sees a joint (near, far) signature". Orthogonal to every prior axis: NOT 634cdd2 (no mask, +/-2s local), NOT 68004ca (external tonality-ratio gate, +/-2s local), NOT 9fe41d1 (POST-FILTER not feature, no voicing mask, default-norm chroma with tonality pre-gate), NOT 32cac36 (+/-2s LOCAL window, same mechanism DIFFERENT TIME SCALE), NOT 49bd0b1 (cepstral not pitch-class), NOT spec_rolloff_far_delta (spectral not pitch-class). First time-scale-paired companion feature in the voiced-chroma axis. Blast radius: features.py only — one new block + FEATURE_NAMES append. Per-t cost: 2 slices + voiced-mask mean + cosine on 12-dim vectors, sub-ms. Risk-bounded: edge-guard sentinel + voiced-empty sentinel + zero-norm sentinel prevent NaN; self-gating via voicing mask reproduces the 32cac36 safety on speech domains. Smoke: len(FEATURE_NAMES)==78, last name 'voiced_chroma_far_cosine_dist', tritone-shift chroma yields dist=1.0, chord-cycle-back yields dist=0.0, t+8>chunk_dur edge guard returns 0.0, unvoiced windows return 0.0.
308aa5a	0.522259	0.560763	0.341379	4	3	0.341379	0.490909	0.850000	2	2	0	discard	add voiced_tonnetz_cosine_dist feature (FEATURE_NAMES 77->78) — voiced-frame-only tonnetz (6-dim tonal-centroid projection of chroma) cosine distance between pre[t-2,t] and post[t,t+2]. Reuses cached feat_chroma (32cac36); adds one feat_tonnetz cache via librosa.feature.tonnetz(chroma=feat_chroma) — a ~0.4ms 6x12 matmul, zero new librosa STFT calls. Per-t cost is 2 slices + voiced-mask mean + cosine on 6-dim vectors, sub-ms. Sentinel 0.0 when either window has zero voiced frames, matching 49bd0b1/32cac36 safety pattern. Targets 32cac36's singing 0.341 weakest-domain plateau: 32cac36 proved voiced-chroma near-window works but singing still drags; ff65865 tried FAR-window voiced chroma and regressed english 0.840->0.684 (far-window speech-vowel chroma is noisy, breaks self-gating), ruling out time-scale companions on the voiced-chroma axis. Tonnetz is a 6-dim LINEAR projection of chroma onto perfect-fifths / major-thirds / minor-thirds axes — measures HARMONIC RELATIONSHIP not raw pitch-class overlap. Within a song's key chord progressions (I-IV-V-I) stay tight in tonnetz space; cross-song splices to a different key move across it. Smoke-verified on synthetic sine chords: C->G (in-key fifth) tonnetz_dist=0.95 vs chroma_dist=0.52; C->F# (out-of-key tritone) tonnetz_dist=1.82 vs chroma_dist=0.68. Tonnetz has ~50%% better in-key-vs-out-of-key discrimination ratio (1.92x vs chroma's 1.30x). GBM max_depth=3 cannot learn the 12->6 linear projection itself; providing tonnetz as an explicit feature gives the geometric embedding directly. Near window (+/-2s) preserves 32cac36 self-gating on speech: voiced=vowels whose per-vowel tonnetz swings with prosody -> high-variance noise -> GBM assigns low per-domain SHAP on english/korean, feature functionally invisible; on singing voiced=sustained notes whose tonnetz IS the key signature -> clean discriminator. Orthogonal to every prior axis: NOT 634cdd2 (raw chroma no mask), NOT 68004ca (external tonality-ratio gate, verify-fail), NOT 9fe41d1 (chroma persistence_far POST-FILTER 4-8s), NOT 32cac36 (voiced chroma — pitch-class not tonal-centroid; tonnetz geometrically distinct from 12-dim PCP), NOT ff65865 (far window), NOT 49bd0b1 (cepstral). Pure features.py change; FEATURE_NAMES count gate triggers wrapper auto-retrain via US-505. Smoke: len(FEATURE_NAMES)==78, last name 'voiced_tonnetz_cosine_dist', synthetic tritone-shift at t=4s yields dist=1.82, synthetic noise yields sentinel 0.0.
