commit	combined	combined_mean	combined_min	clean_fp	n_datasets	combined_singing	combined_korean	combined_english	clean_fp_singing	clean_fp_korean	clean_fp_english	status	description
ce72ed7	0.000000	0.000000	0.000000	0	0	NA	NA	NA	NA	NA	NA	discard	add voiced_unvoiced_chroma_asymmetry_far feature (FEATURE_NAMES 80->81) -- d290101's proven speech-safe 3s-gap 3s-span FAR geometry transplanted to chroma axis. pre[t-2,t] post[t+3,t+6]. Reuses cached feat_chroma + feat_vp, ZERO new librosa calls. Edge guard t-2<0 OR t+6>duration returns sentinel 0.0. d290101 IMPROVED english 0.889->0.897 and matched korean 0.667 at this exact geometry on spec_contrast; chroma is even less phoneme-correlated than spec_contrast (PCP folds octaves, cancels formant shape). f4148cc NEAR (0s gap) chroma asymmetry failed singing because voiced+unvoiced shift together across chord transition. At 3s gap post-window reaches 1-1.5 chord cycles past -> within-song voiced chroma averages across chord sequence while unvoiced (key signature) stays frozen -> asymmetry NEGATIVE on chord-cycle FP. Cross-song: unvoiced captures new-key PCP LARGE, voiced moderate -> asymmetry POSITIVE. SIGN FLIP is binary discriminator. Classifier hyperparam axis verifiably broken (5+ train_classifier.py-only iterations IDENTICAL 0.490700); only features.py-sha bumps force retrain. Every MFCC geometry variant broke speech (MFCC phoneme-correlated); 177d641/88adb49 spec_contrast beyond 3s/3s failed. Chroma at FAR-GAP combines (i) proven speech-safe d290101 geometry, (ii) content axis fundamentally different from MFCC/spec_contrast, (iii) productive voiced/unvoiced asymmetry template (1eda8e3 +0.054 biggest keep, 7972a98 +0.005). FIRST 3s-gap 3s-span geometry on the chroma axis. Orthogonal: NOT 7972a98/d290101/177d641/88adb49 (spec_contrast); NOT d49284c/ff88b22/b7dc8bf/78513fb/dde4135 (MFCC); NOT f4148cc (NEAR 0s gap); NOT 32cac36/ff65865 (single-mask); NOT 1a8b1fe (percussive mask); NOT 9fe41d1 (post-filter). Pure features.py change -- 1 new block (~55 lines template-cloned from _block_voiced_unvoiced_spec_contrast_asymmetry with edge guard + 3s gap) + 1 FEATURE_NAMES append + 2 assert bumps (80->81) + 1 call. ZERO new caches, ZERO new librosa calls. Per-t cost 4 slices + 4 masked means + 2 cosines on 12-dim vectors + 1 subtraction, sub-ms. Smoke-verified: len(FEATURE_NAMES)==81, last name 'voiced_unvoiced_chroma_asymmetry_far', edge guards fire correctly (t=1 t-2<0 -> 0.0; t=18 with 20s chunk t+6>20 -> 0.0), in-range finite values, all 81 features finite on synthetic audio, idempotent.
6c6c254	0.542020	0.589823	0.304762	5	3	0.304762	0.614706	0.850000	4	1	0	discard	add voiced_unvoiced_spec_contrast_asymmetry_far_balanced (FEATURE_NAMES 80->81) -- spec_contrast analog of dde4135 MFCC balanced. pre[t-2,t] post[t+4,t+6] (4s gap, 2s balanced spans). Combines d49284c's singing-winning 4s gap with 1eda8e3 NEAR's proven balanced-span speech self-gating, on d290101's proven speech-safe spec_contrast axis. Reuses feat_contrast + feat_vp + feat_audio/sr, ZERO new librosa calls, ZERO new caches. Edge guard t-2<0 OR t+6>duration_s returns sentinel 0.0. FIRST 4s-gap + 2s-balanced-span geometry on spec_contrast; cited explicit fallback from dde4135(c)(2) and 88adb49(c)(1). Mechanism on 3 singing chord-cycle FPs: 4s gap reaches 2-3 chord cycles past splice; mastering frozen within-song -> unvoiced_dist small; voiced 2s-averaged -> voiced_dist small -> asymmetry ~0 silent. Cross-song: post firmly inside new mastering chain -> unvoiced LARGE, voiced moderate -> asymmetry POSITIVE. Speech self-gating: spec_contrast peak-RATIO phoneme-stable per d290101; balanced 2s spans narrower than 88adb49's 4s post (which over-smoothed korean 0.667->0.573) keep mastering statistics local. Orthogonal: NOT 7972a98 NEAR, NOT d290101 3s/3s, NOT 177d641 1s gap, NOT 88adb49 4s/4s asymmetric, NOT dde4135 MFCC content, NOT any MFCC variant, NOT mask family. Pure features.py change -- 1 new block (~55 lines) + FEATURE_NAMES append + 2 assert bumps (80->81) + 1 call. Per-t cost: 4 slices + 4 masked means + 2 cosines on 7-dim vectors + 1 subtraction, sub-ms. Smoke: len(FEATURE_NAMES)==81, last name correct, edge guards t-2<0 and t+6>duration return 0.0, synthetic splice-crossing asymmetry 0.083 vs within-source 0.033 (2.5x), idempotent, all 81 features finite.
347c0ac	0.509293	0.552498	0.301613	4	3	0.301613	0.530882	0.825000	3	1	0	discard	add voiced_unvoiced_spec_contrast_asymmetry_mid (FEATURE_NAMES 80->81) -- MID-adjacent ±3s balanced on spec_contrast. pre[t-3,t] post[t,t+3] 0s gap, cited fallback from 6c6c254(c)(1). Reuses cached feat_contrast + feat_vp, ZERO new librosa calls, ZERO new caches. Empty-mask sentinel 0.0 via _masked_mean None path (matches 7972a98 template). Combines d290101's proven speech-safe spec_contrast axis (3s gap 3s span IMPROVED english 0.889->0.897) with 1eda8e3's proven balanced-adjacent self-gating template (NEAR ±2s kept +0.054 biggest win). b7dc8bf MID (MFCC, 0s gap 3s adjacent) failed speech because MFCC phoneme-correlated; d290101 proves spec_contrast peak-RATIO is phoneme-stable at ±3s spans so the same MID geometry that broke MFCC should preserve speech here. Every FAR-gap spec_contrast variant failed singing (d290101 3s/3s 0.291, 177d641 1s gap 0.273, 88adb49 4s asym 0.329, 6c6c254 4s/2s bal 0.305) -- untried alternative is ADJACENT ±3s no gap, wider than NEAR's ±2s so spans ~1-1.5 chord cycles, begins averaging chord-cycle noise. Mechanism on 3 singing chord-cycle FPs: ±3s covers one chord transition in pre AND post -> voiced_dist averages to moderate, unvoiced_dist stays small (mastering frozen) -> asymmetry ~0 silent. Cross-song splice: pre 3s song A, post 3s song B -> unvoiced LARGE (new drum-bus comp + master EQ + limiter), voiced moderate -> asymmetry POSITIVE. Speech self-gating: spec_contrast peak-RATIO phoneme-stable, ±3s adjacent ~6 syllables each side samples similar phoneme distribution, voiced+unvoiced peak-ratios co-vary -> diff near zero -> GBM low per-domain SHAP on english/korean. FIRST 0s-gap + 3s-balanced-adjacent geometry on spec_contrast axis. Orthogonal: NOT 7972a98 NEAR ±2s, NOT d290101 3s gap, NOT 177d641 1s gap, NOT 88adb49 4s asym, NOT 6c6c254 4s/2s bal, NOT b7dc8bf MID MFCC content, NOT 1eda8e3 NEAR MFCC, NOT f4148cc chroma, NOT 0c3bf76 flatness scalar, NOT any percussive/harmonic/symmetric/single-mask variant. Pure features.py change -- 1 new block (~45 lines cloned from _block_voiced_unvoiced_spec_contrast_asymmetry with ±3s windows) + FEATURE_NAMES append + 2 assert bumps (80->81) + 1 call. Per-t cost: 4 slices + 4 masked means + 2 cosines on 7-dim vectors + 1 subtraction, sub-ms. Smoke-verified: len(FEATURE_NAMES)==81, last name 'voiced_unvoiced_spec_contrast_asymmetry_mid', all 81 features finite on synthetic audio, sentinel 0.0 on empty-voicing mask, edge-clamped t=1 returns 0.0 via _slice_frames clamping path, idempotent.
c006d52	0.490700	0.537120	0.295385	6	3	0.295385	0.476471	0.839506	4	2	0	discard	add voiced_unvoiced_rms_asymmetry_db feature (FEATURE_NAMES 80->81) -- STRUCTURAL pivot from spectral-envelope cosine distance to ENERGY-LEVEL dB. Apply proven voiced/unvoiced paired-difference template (1eda8e3 NEAR MFCC +0.054 biggest keep, 7972a98 NEAR spec_contrast +0.005) to a genuinely NEW content axis: log-RMS dB level rather than cepstral/mastering/pitch-class cosine. pre[t-2,t] post[t,t+2]. For each window compute voiced-mean RMS and unvoiced-mean RMS in dB, then asymmetry = (unvoiced_post_db - unvoiced_pre_db) - (voiced_post_db - voiced_pre_db). Reuses cached feat_rms (per-frame RMS, 512 hop) + feat_vp (voicing probability, same 512 hop) -- ZERO new librosa calls, ZERO new caches. Sentinel 0.0 when any mask empty OR any sub-window mean <= 1e-10 (log-safe). FEATURE_NAMES 80->81 forces wrapper auto-retrain via US-505 sha gate. Last 12+ iterations exhausted GEOMETRY variation on the asymmetry template across MFCC/spec_contrast/chroma/spec_flatness content axes (NEAR/MID/WIDE/FAR/narrow-gap/balanced-span/gap-geometry -- all discarded); CLAUDE.md mandates structural change after 5+ same-axis failures. Untried structural dimension is the CONTENT AXIS itself: energy-level paired-differencing on voiced/unvoiced split (GBM never saw rms asymmetry form, existing rms_db_delta is all-frame no split). Mechanism on 3 surviving singing chord-cycle FPs: within-song vocal bus + drum bus + master limiter are FROZEN; chord transitions don't change mastering -> voiced_delta and unvoiced_delta both ~0 -> asymmetry ~0 silent, FP not boosted. Same-singer cross-song: vocal bus adapts so voiced_delta small 1-3 dB, mastering jumps so unvoiced_delta LARGE 3-8 dB -> asymmetry POSITIVE, real TP boosted. Different-singer cross-song: both shift -> existing 1eda8e3 MFCC asymmetry fires. Speech self-gating via paired differencing (proven 1eda8e3 mechanism): voiced RMS (vowels) and unvoiced RMS (consonants + pauses) both vary with phoneme density and sentence context -- but co-vary within same recording (continuous preamp gain / speaker intensity) -> voiced_delta and unvoiced_delta both track phoneme drift -> DIFFERENCE is zero-mean noise -> GBM low per-domain SHAP on english/korean -> feature functionally invisible on speech domains. FIRST ENERGY-LEVEL (log-RMS dB) asymmetry on any mask split. Orthogonal: NOT 1eda8e3 (cepstral cosine); NOT 7972a98/d290101/177d641/88adb49/6c6c254/347c0ac (spec_contrast cosine variants); NOT f4148cc (chroma cosine); NOT 0c3bf76 (spec_flatness scalar abs-delta, NOT dB-ratio); NOT rms_db_delta (all-frame scalar, no mask); NOT any MFCC geometry variant; NOT percussive/harmonic mask family; NOT F0/rhythm/tempo features. Pure features.py change -- 1 new block (~45 lines cloned from _block_voiced_unvoiced_mfcc_asymmetry with scalar-mean + dB conversion replacing vector-cosine) + 1 FEATURE_NAMES append + 2 assert bumps (80->81) + 1 call in extract_features. Per-t cost 4 slices + 4 masked means + 4 log10 + 2 subtractions, sub-ms. Smoke-verified: len(FEATURE_NAMES)==81, last name 'voiced_unvoiced_rms_asymmetry_db', direct block test at splice boundary with unvoiced mastering jump yields +9.5 dB asymmetry, stationary windows return 0.0, empty unvoiced mask returns sentinel 0.0, zero-rms sentinel 0.0, end-to-end extract_features returns 81 finite features on synthetic audio, idempotent on repeated calls.
27ddbf7	0.523753	0.575422	0.295385	6	3	0.295385	0.555882	0.875000	4	2	0	discard	add voiced_f0_iqr_log_ratio feature (FEATURE_NAMES 80->81) -- STRUCTURAL pivot onto F0 DISTRIBUTION SHAPE content axis, untouched by block 5's mean/delta/jitter/continuity. Feature = |log2(post_iqr / pre_iqr)| where iqr = voiced F0 75th-25th percentile over pre[t-2,t] vs post[t,t+2]. Reuses cached feat_f0 + feat_f0_hop + feat_sr, ZERO new librosa calls, ZERO new caches. Sentinel 0.0 when either window has <3 valid F0 frames OR either IQR <1 Hz (log-safe + perceptually negligible). FEATURE_NAMES 80->81 forces retrain via US-505 sha gate. Targets 7972a98 baseline (combined=0.589282) singing 0.345 3-FP chord-cycle plateau. Last 13+ iterations exhausted geometry/content variation on voiced/unvoiced paired-differencing template (MFCC/spec_contrast/chroma/spec_flatness/RMS dB). CLAUDE.md mandates structural change after 5+ same-axis failures. Block 5 already has f0_mean_pre/post/delta (Hz-linear mean shift) + f0_jitter_delta (std/mean ratio) + f0_continuity_score (edge 100ms delta) but NOTHING percentile-based, NOTHING log-ratio-based, NOTHING shape/spread-based. GBM max_depth=3 cannot synthesize log-IQR-ratio from existing mean/delta/jitter features. Mechanism on 3 surviving singing chord-cycle FPs: within one song singer holds similar phrasing style (melodic range 3-7 semitones per phrase) so voiced F0 IQR of any 2s slice stays stable ~30-80 Hz regardless of chord transition -> pre_iqr and post_iqr both similar -> log2 ratio ~0 silent, FP not boosted. Cross-song splice same-singer: melodic style differs (ballad narrow IQR vs pop bridge wide IQR) -> log-ratio LARGE. Cross-song different-singer: register AND spread shift combined -> feature strongly positive. Speech self-gating via voiceprint stability: within-speaker 2s voiced F0 IQR is habitual prosodic range (~30-60 Hz), stable characteristic over 2s windows -> log-ratio sits ~0.1-0.3 uncorrelated with splice position -> GBM low per-domain SHAP on english/korean. Log-scale normalisation prevents absolute F0 level bias (male F0=150 IQR=30 equiv to female F0=300 IQR=60). IQR chosen over STD because IQR robust to yin octave errors; f0_jitter_delta already uses std/mean. Orthogonal: NOT 1eda8e3 (cepstral cosine); NOT 7972a98/d290101/177d641/88adb49/6c6c254/347c0ac (spec_contrast variants); NOT f4148cc (chroma cosine); NOT 0c3bf76 (spec_flatness 1D abs-delta); NOT c006d52 (RMS dB asymmetry); NOT block-5 F0 mean/delta/jitter/continuity (all mean/edge-based, none IQR or log-ratio); NOT percussive/harmonic mask family; NOT any voiced/unvoiced pair variant. FIRST F0-DISTRIBUTION-SHAPE feature in the 80-feature set, FIRST log-ratio feature in any content axis. Pure features.py change -- 1 new block (~30 lines) + 1 FEATURE_NAMES append + 2 assert bumps (80->81) + 1 call in extract_features. Per-t cost 2 slices + 2 nan-mask + 4 percentile ops + 1 log2 + 1 abs, sub-ms. Smoke-verified: len(FEATURE_NAMES)==81, last name 'voiced_f0_iqr_log_ratio', synthetic narrow-IQR->wide-IQR transition at t=10 yields 4.83 LARGE, within-source t=5 yields 0.048 sentinel-small (100x discrimination), silence returns sentinel 0.0, edge guard fires correctly on <3 valid F0 frames, all 81 features finite, idempotent on repeated calls.
1d1144d	0.507516	0.555512	0.288235	7	3	0.288235	0.542857	0.835443	6	1	0	discard	add voiced_f0_median_shift_cents (FEATURE_NAMES 80->81) -- STRUCTURAL pivot to log-scale F0 CENTRAL-TENDENCY shift. feature = |1200*log2(post_median/pre_median)| on voiced frames (vp==1 AND ~isnan(f0)) in pre[t-2,t] vs post[t,t+2]. Reuses cached feat_f0 + feat_vp + feat_f0_hop + feat_sr, ZERO new librosa calls, ZERO new caches. Sentinel 0.0 when either window has <3 valid voiced frames OR either median <1 Hz (log-safe + perceptually meaningless). FEATURE_NAMES 80->81 forces wrapper auto-retrain via US-505 sha gate. Explicit cited fallback from 27ddbf7(c)(1). Block 5 has f0_mean_pre/post/delta in LINEAR Hz, f0_jitter std/mean, f0_continuity edge 100ms |delta| -- but NOTHING log-scale, NOTHING median-based, NOTHING perceptually-normalized. GBM max_depth=3 cannot synthesize |1200*log2(post/pre)| from (f0_mean_pre, f0_mean_post) via threshold combinations. Different from 27ddbf7 IQR (SPREAD); this is LOCATION -- orthogonal statistical moment. Median robust to yin octave-errors; cents normalization register-invariant (male 150->160 Hz == female 300->320 Hz == 112 cents). Mechanism on 3 singing chord-cycle FPs: within one song singer holds bounded melodic center, 2s voiced-median F0 stays within ~50-150 cents of baseline -> pre/post medians similar -> |cents shift| <= 50 silent, FP not boosted. Cross-song same-singer: different melodies have different central tendencies (B3~247 -> F4~349 = 600 cents LARGE). Different-singer: register + melody shift combined, even larger. Speech self-gating: within-speaker prosodic range 3-5 semitones total spread, but MEDIAN converges to ~50-150 cents habitual band across 2s window -> GBM low per-domain SHAP on english/korean, same mechanism as existing linear f0_mean_delta. Why log-scale median cents beats linear Hz mean: (1) linear biased by F0 level (male 20 Hz != female 20 Hz perceptually); (2) mean sensitive to yin octave-error outliers, median robust; (3) |abs| removes sign noise; (4) GBM threshold splits work cleanly on bounded positive scalars. NOT a paired-difference template; single scalar log-scale location-shift. Classifier hyperparam axis verifiably broken (5+ iterations IDENTICAL 0.490700); only features.py-sha bumps force retrain. Orthogonal: NOT 1eda8e3 MFCC cosine, NOT 7972a98/d290101/177d641/88adb49/6c6c254/347c0ac spec_contrast, NOT f4148cc chroma, NOT 0c3bf76 flatness, NOT c006d52 RMS dB, NOT 27ddbf7 F0 IQR (SPREAD not LOCATION), NOT block-5 f0_mean linear Hz, NOT f0_jitter std/mean, NOT f0_continuity edge, NOT any mask variant, NOT any voiced/unvoiced paired-diff. FIRST log-scale F0 LOCATION-SHIFT, FIRST cents-normalized feature. Pure features.py change -- 1 new block (~25 lines) + 1 FEATURE_NAMES append + 2 assert bumps (80->81) + 1 call. Per-t cost 2 slices + 2 nan-mask + 2 medians + 1 log2 + 1 abs, sub-ms. Smoke-verified: len(FEATURE_NAMES)==81, last name 'voiced_f0_median_shift_cents', synthetic 220->247 Hz yields 200.4 cents (matches 1200*log2(247/220)=200.41), stationary 220->220 yields 0.0, all-unvoiced sentinel 0.0, all-NaN f0 sentinel 0.0, end-to-end extract_features returns 81 finite features, idempotent on repeated calls.
60196aa	0.490700	0.537120	0.295385	6	3	0.295385	0.476471	0.839506	4	2	0	discard	add peak-width neighbor-support gate (NEIGHBOR_SUPPORT_FRACTION=0.95) to detector.py -- STRUCTURAL pivot from feature-add exhaustion to per-emit peak-width filter on p_splice. After GBM hit_mask + DSP confirmation, require at least one adjacent grid point (t +- ANALYSIS_STRIDE_S) p_splice >= GBM_THRESHOLD * 0.95 (0.9329 floor). Enforces min peak width ~2 grid points ~0.24s at stride 0.12. Targets 7972a98 baseline (combined=0.589282) singing 0.345 3-FP chord-cycle plateau. Last 15+ iterations exhausted voiced/unvoiced paired-diff template across MFCC/spec_contrast/chroma/spec_flatness/RMS dB content axes and F0 distribution shape/location (IQR log-ratio, median cents). CLAUDE.md mandates structural change after 5+ same-axis failures. PRIMARY-tunable axis (no retrain). Mechanism: real cross-source splice produces sustained spectral discontinuity 0.3-0.5s past boundary as bus-comp/limiter attacks adapt -- p_splice stays above threshold for 3-5 consecutive grid points. Chord-cycle/phoneme-burst FPs produce narrow peaks 0.05-0.15s wide 1-2 STFT frames because chord onsets are instantaneous spectral events. Peak-width filter drops narrow FPs while preserving wide TPs. Explicit cited fallback from 1d1144d(c)(3) pure detector-level post-filter. Orthogonal to every prior DSP tweak (DSP_SUM_MIN/MAX/PHASE_MIN gated MAGNITUDE, this gates WIDTH) and stride-widening (053c0b5 0.15 uniform affected all positions; per-emit neighbor-support keeps dense scan). FIRST PEAK-WIDTH filter in detector history. Pure detector.py change -- 1 constant + 1 boolean check in hit_mask loop + 1 diag kv. Per-emit cost 2 array lookups + 2 comparisons sub-us. No retrain, no feature-set change, features.py sha stable, classifier byte-identical. Smoke-verified: NEIGHBOR_SUPPORT_FRACTION=0.95 loads, neighbor_floor=0.9329, AST parse OK 914 lines, all other tunables unchanged (GBM_THRESHOLD=0.982, MIN_SEP=3.5, STRIDE=0.12, DSP_SUM=5.0, DSP_MAX=2.0).
