commit	combined	combined_mean	combined_min	clean_fp	n_datasets	combined_singing	combined_korean	combined_english	clean_fp_singing	clean_fp_korean	clean_fp_english	status	description
d290101	0.558329	0.618337	0.290909	4	3	0.290909	0.666667	0.897436	4	0	0	discard	add voiced_unvoiced_spec_contrast_asymmetry_far feature (FEATURE_NAMES 80->81) — FAR-gap companion to 7972a98 NEAR spec_contrast asymmetry (kept +0.005), pre[t-2,t] post[t+3,t+6] (3s gap, 3s span). Reuses cached feat_contrast + feat_vp + feat_audio for duration check, ZERO new librosa calls, ZERO new caches. Edge guard t-2<0 OR t+6>duration_s returns sentinel 0.0. d49284c voiced_unvoiced_mfcc_asymmetry_far ([t+4,t+8]) was the ONLY recent feature to LIFT singing 0.345->0.354 proving FAR-gap mechanism is real for chord-cycle vs cross-song discrimination, but speech regressed sharply (korean 0.667->0.537, english 0.889->0.825) because MFCC heavily phoneme-correlated. ff88b22 WIDE-adjacent ±4s no-gap failed singing 0.295 confirming gap-FAR is the structure that works for singing. Spec_contrast = per-band peak-to-valley ratio is a MASTERING/COMPRESSOR/EQ fingerprint, less phoneme-correlated than MFCC because peak-RATIO is more stable across phoneme content than absolute cepstral envelope. Mechanism on 3 surviving singing FPs: cross-song splice voiced_far_dist low (similar singer formants), unvoiced_far_dist HIGH (drum-bus + master EQ + limiter shift) -> asymmetry POSITIVE; intra-song chord cycle voiced_far_dist moderate (vowel formants vary across t+3..t+6), unvoiced_far_dist small (mastering frozen, drum kit identical) -> asymmetry NEGATIVE; sign-flip is binary discriminator chord cycle cannot mimic. Speech self-gating: both voiced and unvoiced spec_contrast carry SAME mastering baseline (recording continuous, cancels) plus phoneme-correlated peak/valley variation; spec_contrast peak-RATIO is more phoneme-stable than MFCC cepstral envelope so asymmetry of two phoneme-driven distances is smaller. Post=[t+3,t+6] (3s gap 3s span) is narrower than d49284c [t+4,t+8] (4s/4s) - cited d49284c(c)(2) reduction, less phoneme drift while preserving chord-cycle averaging (chord period in pop ~2-3s so 3s post-window spans ~1-1.5 chords). Total span [t-2,t+6]=8s fits within 30s eval chunks (sentinel rate ~10%% on 30s chunks). Voiced/unvoiced spec_contrast asymmetry family is provably productive (7972a98 NEAR kept +0.005); FAR-gap companion on this content axis is genuinely untried and the natural cited fallback after d49284c proved the FAR-time-scale mechanism. Orthogonal: NOT 7972a98 (NEAR window — same template at FAR time scale); NOT d49284c (MFCC content axis, this is spec_contrast); NOT ff88b22 (WIDE adjacent no gap); NOT 1eda8e3 (NEAR MFCC); NOT f4148cc (chroma asymmetry); NOT 0c3bf76 (1D scalar flatness abs-delta); NOT ff65865 voiced_chroma_far (single-mask no asymmetry); NOT any percussive/harmonic/unvoiced-only mask variant. FIRST FAR-gap asymmetry on the spec_contrast content axis. Pure features.py change — 1 new block (~50 lines, template-cloned from 7972a98 with edge guard + 3s gap) + 1 FEATURE_NAMES append + 2 assert bumps (80->81) + 1 call. Per-t cost: 4 slices + 4 masked means + 2 cosines on 7-dim vectors + 1 subtraction, sub-ms. Smoke-verified: len(FEATURE_NAMES)==81, last name 'voiced_unvoiced_spec_contrast_asymmetry_far', all 81 features finite on synthetic speech-like audio (voiced+unvoiced alternating with formant shift at t=10), edge guard fires correctly (t=18 with post>20s -> 0.0; t=1 with t-2<0 -> 0.0), idempotent on repeated calls, splice probe yields -0.0445 vs within-source +0.0031 (non-trivial discrimination on synthetic).
b7dc8bf	0.503630	0.543675	0.301613	5	3	0.301613	0.529412	0.800000	3	2	0	discard	add voiced_unvoiced_mfcc_asymmetry_mid feature (FEATURE_NAMES 80->81) — MID-adjacent pre[t-3,t] post[t,t+3] companion to 1eda8e3 NEAR +-2s MFCC asymmetry. Same paired-difference template, +-3s adjacent windows, 13-dim cosine. Reuses cached feat_mfcc + feat_vp, ZERO new librosa calls. Edge guard t-3<0 OR t+3>duration_s returns sentinel 0.0. Targets 7972a98 baseline (combined=0.589282) singing 0.345 3-FP chord-cycle plateau. d49284c FAR pre[t-2,t]/post[t+4,t+8] was the ONLY recent feature to LIFT singing (0.345->0.354) but regressed speech (english 0.889->0.825, korean 0.667->0.537) because the 6s gap made pre/post sample different sentences. ff88b22 WIDE +-4s adjacent closed the gap but still regressed speech (english 0.765, korean 0.556) because +-4s is ~12 syllables — wide enough to span sentence content. MID +-3s adjacent is the cited fallback from d49284c(c2)/ff88b22(c1)/d290101(c1) and is the principled interpolation between proven NEAR (+-2s adjacent, kept +0.054 biggest win) and failed WIDE (+-4s adjacent). Mechanism — speech self-gating preserved: +-3s is ~6 syllables adjacent, narrower than WIDE's 12-syllable span and broader than NEAR's 3 syllables; adjacent windows share speaker/recording baseline with no sentence drift so voiced+unvoiced MFCC shifts co-vary with phoneme context -> diff near zero -> low per-domain SHAP on english/korean. Singing discrimination: +-3s spans ~1-1.5 chord cycles (chord period ~2-3s in pop), begins averaging chord-cycle noise where NEAR doesn't bite the 3 FPs, but doesn't over-average like WIDE. Cross-song splice: pre=3s of song A mastering, post=3s of song B — unvoiced distance HIGH (different drums/mastering), voiced distance moderate (same/different singer) -> asymmetry positive. Chord-cycle FP: voiced+unvoiced both shift with chord progression -> asymmetry ~0 (non-discriminating). GBM cannot synthesize MID from NEAR alone; providing explicit time-scale companion surfaces the chord-averaging pattern. First MID window on any asymmetry axis. Classifier hyperparam axis verifiably broken (5 train_classifier.py-only iterations produced IDENTICAL combined=0.490700 -> US-505 does not auto-retrain on hyperparam edits); only features.py-sha bumps force retrain. Every primary tunable saturated both directions; voiced/unvoiced NEAR and FAR-gap exhausted; percussive/harmonic mask family monotonically failed; 1D scalar abs-delta (0c3bf76) failed. Voiced/unvoiced asymmetry family is provably the most productive axis: 1eda8e3 +0.054 (biggest win) and 7972a98 +0.005. Time-scale MID on this template is the genuinely untried principled fallback. Orthogonal: NOT 1eda8e3 (NEAR +-2s — same template at 1.5x time scale); NOT d49284c (FAR has 4s gap — MID is adjacent); NOT ff88b22 (WIDE +-4s — MID is 25%% narrower preserving speech gating); NOT 7972a98 (spec_contrast not cepstral); NOT f4148cc (chroma asymmetry NEAR); NOT 0c3bf76 (1D scalar abs-delta flatness); NOT d290101 (spec_contrast FAR-gap); NOT any percussive/harmonic/unvoiced-only/symmetry/far-single-mask variant. FIRST MID-ADJACENT window on any content axis. Pure features.py change — 1 new block (~50 lines, template-cloned from 1eda8e3 with edge guard) + 1 FEATURE_NAMES append + 2 assert bumps (80->81) + 1 call in extract_features. ZERO new librosa calls, ZERO new caches. Per-t cost: 4 slices + 4 masked means + 2 cosines on 13-dim vectors + 1 subtraction, sub-ms. Smoke-verified: len(FEATURE_NAMES)==81, last name 'voiced_unvoiced_mfcc_asymmetry_mid', edge guard fires correctly (t=2 with t-3<0 -> 0.0; t=18 with t+3>20 -> 0.0), in-range t=10 yields finite value 0.0004, all 81 features finite on synthetic audio, idempotent on repeated calls.
177d641	0.489666	0.542183	0.272727	7	3	0.272727	0.510448	0.843373	5	2	0	discard	add voiced_unvoiced_spec_contrast_asymmetry_narrow_gap feature (FEATURE_NAMES 80->81) -- NARROW-GAP FAR companion to 7972a98 NEAR voiced_unvoiced_spec_contrast_asymmetry (kept +0.005). pre[t-2,t] post[t+1,t+4] (1s gap, 3s span). Reuses cached feat_contrast + feat_vp, ZERO new librosa calls, ZERO new caches. Edge guard t-2<0 OR t+4>duration_s returns sentinel 0.0. FEATURE_NAMES 80->81 forces wrapper auto-retrain via US-505 sha gate. Combines two cited fallbacks: b7dc8bf(c)(2) NARROW-GAP FAR geometry (1s gap 3s span) + spec_contrast axis (d290101 proved speech-safe: english 0.889->0.897 IMPROVED, korean matched 0.667, only singing regressed because 3s gap let voiced formants diverge on different-chord content). 1s gap on spec_contrast keeps voiced spec_contrast small on BOTH chord-cycle AND cross-song cases while UNVOICED (mastering) shifts only on cross-song. Cross-song -> POSITIVE asymmetry (new drum bus + new master EQ + new limiter); chord-cycle FP -> ~0 (frozen mastering, non-discriminating, feature silent). Speech self-gating preserved: 1s gap keeps phoneme-distribution similar (2-3 syllables adjacent) and spec_contrast peak-RATIO is phoneme-stable per d290101 at 3s gap. Narrower than d290101's 3s gap so even safer for speech. Why NARROW-GAP FAR on spec_contrast over alternatives: MID/WIDE adjacent (ff88b22 WIDE and b7dc8bf MID) lack the gap signal that discriminates chord-cycle from cross-song; 3s gap (d290101) regressed singing; 4s gap (d49284c MFCC) broke speech; spec_flatness axis (0c3bf76 NEAR) has weaker baseline than spec_contrast. Classifier hyperparam axis verifiably broken (5 train_classifier.py-only iterations all produced IDENTICAL combined=0.490700 -> US-505 does not auto-retrain on hyperparam edits). Only features.py-sha bumps force retrain. Voiced/unvoiced spec_contrast asymmetry family is proven productive (7972a98 NEAR kept +0.005); narrow-gap companion on this content axis is genuinely untried and the principled interpolation between NEAR (0s gap) and d290101 (3s gap). Orthogonal: NOT 7972a98 (NEAR 0s gap, same template at narrow gap); NOT d290101 (3s gap, 3s span -- this is 1s gap); NOT d49284c (MFCC content, 4s gap, 4s span); NOT ff88b22 (MFCC WIDE adjacent no gap); NOT b7dc8bf (MFCC MID adjacent no gap); NOT 1eda8e3 (NEAR MFCC); NOT f4148cc (chroma NEAR asym); NOT 0c3bf76 (spec_flatness 1D scalar); NOT any percussive/harmonic/tonnetz/symmetric/single-mask variant. FIRST NARROW-GAP FAR geometry on any content axis, FIRST 1s-gap geometry on spec_contrast. Pure features.py change -- 1 new block (~70 lines, template-cloned from _block_voiced_unvoiced_spec_contrast_asymmetry with 1s gap + edge guard) + 1 FEATURE_NAMES append + 2 assert bumps (80->81) + 1 call in extract_features. ZERO new caches, ZERO new librosa calls. Per-t cost: 4 slices + 4 masked means + 2 cosines on 7-dim vectors + 1 subtraction, sub-ms. Smoke-verified: len(FEATURE_NAMES)==81, last name 'voiced_unvoiced_spec_contrast_asymmetry_narrow_gap', synthetic voiced+unvoiced splice at t=8 yields narrow_gap_asym=+0.1255 (positive, discriminative of splice) vs +0.0026 at within-source t=10 (sentinel-small), edge guard t-2<0 returns 0.0, edge guard t+4>duration returns 0.0, idempotent on repeated calls, all 81 features finite on synthetic audio.
78513fb	0.546214	0.593827	0.300000	4	3	0.300000	0.666667	0.814815	4	0	0	discard	add voiced_unvoiced_mfcc_asymmetry_far_narrow (FEATURE_NAMES 80->81) -- NARROW-GAP-FAR companion to 1eda8e3 NEAR MFCC asymmetry (kept +0.054 biggest win) and d49284c FAR-gap (singing +0.009 lift but speech regressed via wide phoneme drift). pre[t-2,t] post[t+3,t+6] (3s gap, 3s span). Reuses cached feat_mfcc + feat_vp + feat_audio/sr for duration, ZERO new librosa calls, ZERO new caches. Edge guard t-2<0 OR t+6>duration_s returns sentinel 0.0. Explicit cited fallback from d49284c(c)(2): 'shrink the far offset to [t+3, t+6] (less dense but still beats NEARs chord-cycle blind spot)'. Genuinely untried on MFCC content axis. Interpolates structurally between d49284c (4s gap 4s span -- broke speech) and proven NEAR (0s gap 2s span -- kept), and between b7dc8bf MID adjacent 0s gap (failed singing, no gap signal) and d49284c. Mechanism on 3 surviving singing FPs: post sub-window 3-6s past splice = ~1-1.5 chord cycles past (pop chord period 2-3s) -- voiced averaging partially washes within-song chord state, unvoiced stays small (mastering frozen) -> asymmetry near zero, non-discriminating. Cross-song splice: post samples song B 3-6s in (mastering fully consolidated), unvoiced_dist HIGH, voiced_dist moderate -> asymmetry POSITIVE. Speech self-gating preserved by narrower geometry: 3s post span samples 4-6 syllables (vs d49284cs 6-8), 3s gap (vs d49284cs 4s), total pre-to-post-mean separation 5.5s (vs d49284cs 6s), less phoneme-mix drift -> voiced+unvoiced MFCC co-vary more closely with phoneme context -> diff closer to zero-mean noise -> GBM low per-domain SHAP on english/korean. Halfway between NEAR (clean self-gating) and d49284c FAR (broken self-gating). d290101 proved 3s-gap 3s-span geometry is speech-safe on spec_contrast (english 0.889->0.897 improved, korean matched 0.667); transplanting this geometry to MFCC content axis where the mechanism actually discriminates chord-cycle from cross-song. Classifier hyperparam axis verifiably broken (5 train_classifier.py-only iterations produced IDENTICAL combined=0.490700 -> US-505 does not auto-retrain on hyperparam edits); only features.py-sha bumps force retrain. Every primary tunable saturated both directions; percussive/harmonic mask family monotonically failed; 1D scalar abs-delta (0c3bf76) failed; all other voiced/unvoiced asymmetry time-scales exhausted (NEAR kept 1eda8e3/7972a98, MID b7dc8bf failed, WIDE ff88b22 failed, FAR d49284c singing-only, FAR-spec_contrast variants failed on singing). NARROW-GAP-FAR on MFCC is the cited remaining middle-ground. Orthogonal: NOT 1eda8e3 (NEAR 0s gap -- same template different time scale); NOT d49284c (FAR 4s gap 4s span -- this is 3s gap 3s span); NOT ff88b22 (WIDE no gap); NOT b7dc8bf (MID no gap); NOT d290101 (spec_contrast content axis); NOT 177d641 (spec_contrast 1s gap); NOT f4148cc (chroma NEAR); NOT 0c3bf76 (1D scalar flatness abs-delta); NOT ff65865 (single-mask far chroma); NOT any percussive/harmonic/tonnetz/symmetric variant. FIRST 3s-gap + 3s-span geometry on the MFCC axis. Pure features.py change -- 1 new block (~60 lines template-cloned from _block_voiced_unvoiced_mfcc_asymmetry with edge guard + 3s gap) + 1 FEATURE_NAMES append + 2 assert bumps (80->81) + 1 call in extract_features. ZERO new librosa calls, ZERO new caches. Per-t cost: 4 slices + 4 masked means + 2 cosines on 13-dim vectors + 1 subtraction, sub-ms. Smoke-verified: len(FEATURE_NAMES)==81, last name 'voiced_unvoiced_mfcc_asymmetry_far_narrow', edge guard t=1 (t-2<0) returns 0.0, edge guard t=15 with 20s chunk (t+6>20) returns 0.0, in-range t=10 yields +0.091 (finite, non-trivial on synthetic voiced/unvoiced splice), idempotent on repeated calls, all 81 features finite on synthetic audio.
dde4135	0.534196	0.586138	0.290909	5	3	0.290909	0.613846	0.853659	4	1	0	discard	add voiced_unvoiced_mfcc_asymmetry_far_balanced feature (FEATURE_NAMES 80->81) -- balanced-span FAR-gap MFCC asymmetry companion to 1eda8e3 NEAR (+0.054 kept biggest win). pre[t-2,t] post[t+4,t+6] (4s gap, 2s spans balanced). Keeps d49284c's 4s-gap chord-cycle averaging (only recent feature to LIFT singing 0.345->0.354) while shrinking post span from 4s to 2s to match pre exactly -- restores NEAR-style balanced phoneme coverage that made paired-differencing self-gate on speech. Asymmetric spans (d49284c 2s pre + 4s post) let post sample broader sentence content than pre, breaking voiced+unvoiced MFCC co-variation that underlies speech self-gating. Balanced 2s spans pre and post means ~3 syllables of same-speaker continuous audio on each side -> voiced+unvoiced MFCC shifts co-vary with phoneme context -> diff near zero -> GBM low per-domain SHAP on english/korean (same mechanism that kept 1eda8e3 NEAR). Reuses cached feat_mfcc + feat_vp + feat_audio for duration check, ZERO new librosa calls, ZERO new caches. Edge guard t-2<0 OR t+6>duration_s returns sentinel 0.0. FEATURE_NAMES 80->81 forces wrapper auto-retrain via US-505 sha gate (only forcing function since 5+ train_classifier.py-only iterations produced IDENTICAL combined=0.490700 confirming US-505 doesn't retrain on hyperparam edits). Mechanism on 3 surviving singing FPs (chord cycle): 4s past splice = ~2 chord cycles past (pop period ~2s), post[t+4,t+6] samples chord that cycled back toward pre chord OR new harmonic position sharing voiced formants -> voiced_dist moderate, unvoiced_dist small (mastering frozen) -> asymmetry near zero, feature silent, FP not boosted. Cross-song splice: pre 2s song A, post[t+4,t+6] firmly inside song B -> unvoiced_dist LARGE (new drums/mastering), voiced moderate -> asymmetry POSITIVE, real TP boosted. First BALANCED-SPAN FAR-gap geometry on any asymmetry axis. Orthogonal: NOT 1eda8e3 (NEAR, same spans no gap); NOT d49284c (4s gap + 4s asymmetric span); NOT 78513fb (3s gap 3s span); NOT ff88b22 (WIDE no gap 4s span); NOT b7dc8bf (MID no gap 3s span); NOT d290101/177d641 (spec_contrast content); NOT any mask/percussive/harmonic/tonnetz/symmetric variant. Pure features.py change -- 1 new block (~55 lines template-cloned from 1eda8e3 with edge guard + 4s gap) + 1 FEATURE_NAMES append + 2 assert bumps (80->81) + 1 call. Per-t cost 4 slices + 4 masked means + 2 cosines on 13-dim vectors + 1 subtraction, sub-ms. Smoke-verified: len(FEATURE_NAMES)==81, last name 'voiced_unvoiced_mfcc_asymmetry_far_balanced', synthetic splice at t=13 (far window captures post-splice) yields asymmetry=1.927 LARGE, within-source t=5 yields 0.080 sentinel-small (24x discrimination), NEAR comparison t=13=0.026 shows feature surfaces signal NEAR can't see, edge guard t=1 (t-2<0) returns 0.0, edge guard t=25 (t+6>30) returns 0.0, all 81 features finite, idempotent.
88adb49	0.551338	0.596979	0.329032	4	3	0.329032	0.573016	0.888889	3	1	0	discard	add voiced_unvoiced_spec_contrast_asymmetry_far_wide feature (FEATURE_NAMES 80->81) -- d49284c's exact 4s-gap + 4s-span FAR geometry transplanted to spec_contrast content axis. pre[t-2,t] post[t+4,t+8]. Reuses cached feat_contrast + feat_vp + feat_audio/sr, ZERO new librosa calls, ZERO new caches. Edge guard t-2<0 OR t+8>duration_s returns sentinel 0.0. Targets 7972a98 baseline (combined=0.589282) singing 0.345 chord-cycle plateau. d49284c MFCC 4s/4s was THE ONLY recent feature to LIFT singing (0.345->0.354) but broke speech (english 0.889->0.825) because MFCC phoneme-correlated. d290101 spec_contrast 3s gap 3s span proved spec_contrast is speech-safe WITH a gap (english 0.889->0.897 IMPROVED!) but 3s/3s didn't capture enough chord-cycle averaging on singing (0.291). 177d641 spec_contrast 1s gap failed singing 0.273 too. Proposed 4s/4s geometry combines d49284c's singing-winning gap+span with d290101's proven speech-safe content axis -- wider gap (4s vs 3s) for more chord-cycle averaging, wider post span (4s vs 3s) for statistically robust song-B mastering mean. Mechanism on 3 surviving singing FPs: chord cycle voiced_dist moderate (formants average across 2 chord cycles) + unvoiced_dist small (mastering frozen) -> asymmetry near zero, feature silent. Cross-song splice: pre 2s song A baseline, post 4s song B mastering, unvoiced_dist LARGE (different drum-bus compression/EQ/limiter), voiced moderate -> asymmetry POSITIVE, TP boosted. Speech self-gating: spec_contrast peak-RATIO is phoneme-stable per d290101; voiced+unvoiced distances co-vary tightly even at 4s gap -> asymmetry near zero -> GBM low per-domain SHAP on english/korean. Classifier hyperparam axis verifiably broken (5 train_classifier.py-only iterations produced IDENTICAL combined=0.490700); only features.py-sha bumps force retrain. Every primary tunable saturated both directions; mask family failed; voiced/unvoiced asymmetry time-scales mostly exhausted. FIRST 4s-gap + 4s-span geometry on spec_contrast axis. Orthogonal: NOT d290101 (3s gap 3s span); NOT 177d641 (1s gap); NOT 7972a98 (NEAR); NOT d49284c (MFCC content axis); NOT ff88b22/b7dc8bf/78513fb/dde4135 (MFCC variants); NOT f4148cc/0c3bf76/any mask/tonnetz/symmetric variant. Pure features.py change -- 1 new block (~55 lines template-cloned from _block_voiced_unvoiced_spec_contrast_asymmetry with edge guard + 4s gap + 4s span) + 1 FEATURE_NAMES append + 2 assert bumps (80->81) + 1 call in extract_features. Per-t cost 4 slices + 4 masked means + 2 cosines on 7-dim vectors + 1 subtraction, sub-ms. Smoke-verified: len(FEATURE_NAMES)==81, last name 'voiced_unvoiced_spec_contrast_asymmetry_far_wide', synthetic splice-crossing t=8 yields asym=+0.1286 vs within-source t=4 asym=-0.0119 (~10x discrimination), edge guard t=1 (t-2<0) returns 0.0, edge guard t=15 with 20s chunk (t+8>20) returns 0.0, idempotent on repeated calls, all 81 features finite on synthetic audio.
