commit	combined	combined_mean	combined_min	clean_fp	n_datasets	combined_singing	combined_korean	combined_english	clean_fp_singing	clean_fp_korean	clean_fp_english	status	description
1cded37	0.410922	0.421722	0.309677	6	3	0.309677	0.413115	0.542373	4	2	0	discard	add NEAR-PEAK cluster-count filter (detector.py, pure primary tunable, no retrain) -- drop emits whose +-12s p_splice neighborhood (excluding +-1.5s) contains >=2 OTHER grid points with p_splice > GBM_THRESHOLD. STRUCTURAL pivot off 60+ iterations of features/DSP-gate/retrospective-match failures on 3 singing chord-cycle FPs onto p_splice TIME-SERIES STRUCTURE across a wide neighborhood. Chord cycles are PERIODIC: chord transitions recur at 2-3s intervals so p_splice shows 4-6 other elevated peaks per +-12s window on chord-cycle FPs. Real cross-source splices are ISOLATED (1 splice per file in ground truth) so p_splice is locally peaked and nearby grid points sit well below 0.982 -> count=0 pass. Mechanism on 3 singing chord-cycle FPs: each chord transition in the 2-3s cycle produces p_splice>GBM_THRESHOLD, excluding +-1.5s around emit expect 4-6 other hits -> count>=2 reject FPs drop. Real singing TP cross-song splice: post and pre different songs no within-song periodicity either side -> count~0 pass. Speech: korean/english clean_fp=0 already so filter only acts on speech real-splice files which are also isolated (1 speaker change per file) count~0 -> TPs pass. Orthogonal: NOT 60196aa peak-width neighbor-support (required >=1 NEAR neighbor within +-stride to SUPPORT the peak -- OPPOSITE direction 'wide peak=real'), NOT d4d35b1 p_splice local-background-margin (margin-based on local mean catastrophic 0.287). Mine counts DISCRETE OTHER CANDIDATES in a WIDER neighborhood with EXCLUSION of emit's own vicinity -- neither margin nor peak-width; explicit cluster-count semantics. NOT any DSP gate (applies AFTER DSP), NOT feature addition, NOT GBM_THRESHOLD/GBM_MIN_SEP_S/ANALYSIS_STRIDE_S. FIRST wide-window cluster-count filter using p_splice time-series repetition structure in detector history. Filter only DROPS emits -- can never create new FPs or TPs. Pure detector.py change: 3 new constants + 7-line check inserted after DSP confirm + 1 new kv in diag.gbm.chunk_scan_done. Feature set unchanged (len(FEATURE_NAMES)=80 stable), classifier byte-identical, no retrain. Per-emit cost: 2 np slices on hit_mask + 2 sums, sub-us. Edge guard: skip when lookback_n<=exclude_n (short chunks). Smoke-verified: AST parse OK 915 lines, NEAR_PEAK_LOOKBACK_S=12.0 NEAR_PEAK_EXCLUDE_S=1.5 MAX_NEAR_PEAKS=2, other tunables unchanged (GBM_THRESHOLD=0.982 DSP_SUM_MIN=5.0 DSP_CONFIRMATION_MIN=2.0 GBM_MIN_SEP_S=3.5 ANALYSIS_STRIDE_S=0.12), FEATURE_NAMES stable at 80.
e4a9c18	0.496163	0.545580	0.267647	8	3	0.267647	0.573913	0.795181	6	2	0	discard	add DATASET_SAMPLE_WEIGHT={singing:2.0, korean:1.0, english:1.0} to HistGBM fit (pure classifier-training change, no feature or detector edit) -- weights each singing training row 2.0x via Pipeline clf__sample_weight routing in both GroupKFold folds and final fit. STRUCTURAL pivot off 60+ iterations of features.py / detector.py tweak exhaustion (every content axis 1st+2nd order paired-diff / variance / persistence / trajectory / corr-matrix / histogram / retrospective-match 7 variants / music-gate, every DSP-gate MAX/SUM/SECOND-HIGHEST/PHASE, every detector post-filter peak-width/margin/cluster-count) onto the classifier-training axis. 1cded37 NEAR-PEAK cluster-count catastrophically broke english 0.889->0.542 proving detector post-filter axis is exhausted. Classifier-training axis has NOT been explored since 2025-Q4 pitch-shift augmentation lifted singing 0.272->baseline. sample_weight directly reshapes the GBM loss gradient -- genuinely orthogonal to features.py / detector.py. Singing splice_f1=0.406 (computed 0.345/0.85 clean_score) means BOTH precision and recall are low in spliced singing; upweight biases GBM's split capacity toward singing-discriminative thresholds GBM has learned to underuse (voiced_chroma_cosine_dist carries singing signal a6cf49d=0.377 highest-ever; voiced_unvoiced_mfcc_asymmetry=0.054 biggest keep). Speech at 0.667/0.889 has margin; 1.0x retains that signal. Factor 2.0 is moderate. Orthogonal: NOT any features.py addition (no feature change, FEATURE_NAMES stable 80); NOT any DSP gate or threshold; NOT any detector post-filter; NOT any GBM hyperparameter (max_depth/max_iter/learning_rate/subsample unchanged); NOT pitch-shift augmentation change (SINGING_AUG_SHIFTS_SEMITONES unchanged). FIRST per-dataset sample-weight tweak in classifier history; FIRST direct loss-gradient bias by domain. Pure train_classifier.py change -- 1 constant + 1 per-manifest sample_weight array + 2 fit calls with clf__sample_weight routing + 2 print lines for row counts. US-505b sha gate auto-retrains from scratch; wrapper runs train_classifier.py and then evaluate.py. Smoke-verified: AST parse OK 478 lines, DATASET_SAMPLE_WEIGHT constant present, clf__sample_weight= routing present in both fold and final fits, Pipeline clf__sample_weight routing works end-to-end on synthetic X/y/sw, FEATURE_NAMES still 80.
7b49d40	0.465942	0.512351	0.296825	8	3	0.296825	0.410959	0.829268	3	5	0	discard	add SINGING_AUG_TIME_STRETCH_RATES=(0.95, 1.05) -- SECOND training-data augmentation axis alongside existing SINGING_AUG_SHIFTS_SEMITONES (pitch-shift). Pure train_classifier.py change, no feature or detector edit. For each clean singing chunk, emit 2 additional augmented copies at librosa.effects.time_stretch rates 0.95 (5% slower, chord cycle 2-3s dilates to 2.1-3.15s) and 1.05 (5% faster, contracts to 1.9-2.85s). chunk-duration-aware sampling: aug_dur_s=len(aug_chunk)/sr since time_stretch changes length (unlike pitch_shift which preserves). EXPLICIT CITED FALLBACK from 4e2941b(c)(2): 'pivot to TIME-STRETCH augmentation via librosa.effects.time_stretch for tempo-invariance'. STRUCTURAL pivot on training-DATA-DIVERSITY axis orthogonal to 4e2941b pitch-shift expansion (FREQUENCY axis) / d1be6c3 GBM max_depth 4->5/max_iter 200->300 (capacity axis discard) / e4a9c18 DATASET_SAMPLE_WEIGHT=2.0 (loss-gradient bias, catastrophic). 3 surviving singing chord-cycle FPs are PERIODIC at 2-3s -- a TEMPORAL signature. Pitch-shift gives GBM same chord-cycle pattern at different pitch levels (frequency); time-stretch gives same pattern at different tempo rates (time). Combined cover both axes so GBM learns rate-invariant AND pitch-invariant discriminators. Mechanism on 3 singing chord-cycle FPs: within-song chord cycle at specific tempo currently maps to one region of feature space; time-stretched clean copies at 0.95x/1.05x populate adjacent regions labeled not_splice, widening not_splice boundary precisely in time-sensitive features (mfcc_delta_*, persistence, trajectory-velocity, voicing_transition_rate_delta) that spurious-fire on chord-cycle periodicity. Speech untouched: ds_id=='singing' gate ensures english/korean rows byte-identical, 0.667/0.889 margins preserved (same safeguard that protected speech across bba6dbe/4e2941b pitch-shift augmentations). Why 0.95/1.05 specifically: phase-vocoder time-stretch is artifact-free within +-5% rate envelope (pitch preserved, transients not smeared audibly); 10%+ introduces phasey artifacts on vocal transients GBM could treat as splice signature. Starts with 2 rates (conservative, matching bba6dbe 2-shift cardinality that lifted singing 0.272->baseline); expandable to (0.9, 0.95, 1.05, 1.1) 4-rate matching pitch-shift cardinality if keeps. Orthogonal: NOT 4e2941b SINGING_AUG_SHIFTS_SEMITONES (frequency axis, complementary template not duplicate); NOT d1be6c3 (GBM capacity knob); NOT e4a9c18 (loss-gradient bias); NOT any features.py addition (FEATURE_NAMES stable 80, features.py sha unchanged); NOT any DSP gate (MAX/SUM/SECOND-HIGHEST/PHASE) or detector post-filter (peak-width/margin/cluster-count); NOT GBM_THRESHOLD/GBM_MIN_SEP_S/ANALYSIS_STRIDE_S. FIRST time-domain training-data augmentation in classifier history; FIRST use of librosa.effects.time_stretch in training pipeline. Blast radius: 1 new tuple constant + 1 new augmentation block (~40 lines cloning pitch-shift template with rate= replacing n_steps= and aug_dur_s=len(aug_chunk)/sr replacing chunk_dur_s for duration-change handling). Feature set unchanged. Detector byte-identical. Retrain cost: ~20 clean singing files x 2 rates = ~40 new rows, time_stretch ~0.5s/chunk + feature extraction, total ~60s training-time bump well inside budget. No inference cost. US-505b train_classifier.py sha gate auto-retrains from scratch. Smoke-verified: AST parse OK 511 lines, SINGING_AUG_SHIFTS_SEMITONES=(+1,-1,+2,-2) stable, SINGING_AUG_TIME_STRETCH_RATES=(0.95, 1.05) len=2, make_pipeline() constructs Pipeline OK with inherited d1be6c3 capacity (max_iter=300 max_depth=5 max_leaf=32 l2=1.0 min_samples_leaf=20), FEATURE_NAMES stable at 80, librosa.effects.time_stretch(rate=0.95) maps 60.000s->63.158s and rate=1.05 maps 60.000s->57.143s on synthetic chunk as expected.
ca2aa2f	0.440030	0.485773	0.258065	8	3	0.258065	0.428169	0.771084	4	4	0	discard	add percussive_mfcc_cosine_dist (FEATURE_NAMES 80->81) -- FIRST HPSS (harmonic-percussive source separation) preprocessing axis feature in the 80-set. Decompose audio once per chunk via librosa.effects.hpss, compute MFCC on the percussive component, cache as ctx['feat_percussive_mfcc']. Feature = cos_dist(mean(perc_mfcc[t-2,t]), mean(perc_mfcc[t,t+2])). STRUCTURAL pivot off 60+ exhausted features.py content-axis experiments (1st+2nd order paired-diff / variance / persistence / cross-scale / trajectory / corr-matrix / histogram / retrospective-match 7 variants / music-gate) AND exhausted classifier-training axis (e4a9c18 sample_weight catastrophic; d1be6c3 capacity stayed unchanged; 4e2941b pitch-shift expansion; 7b49d40 time-stretch discarded; 4b1575e l2_reg 1.0->2.0 stayed). Baseline still 0.589 / singing 0.345 / 3 chord-cycle FPs. All 80 existing features computed on ORIGINAL audio's STFT/MFCC/chroma/contrast. HPSS is the genuinely untried PREPROCESSING axis: median-filter separation in the TF plane isolates percussive (drums/transients/plosive residue) from harmonic (voice/pads/strings). Explicit cited fallback from 8593da7(c)(3): 'pivot to harmonic-percussive-separated percussive retrospective match via librosa.effects.hpss'. Mechanism on 3 singing chord-cycle FPs: within one song drum kit + mastering + limiter + master EQ frozen so percussive MFCC at any two within-song windows near-identical (cos_dist ~0.001 validated on real clean_001.wav at 6 positions: 0.0002-0.0008) -> feature SILENT -> FP not boosted. Chord transitions DO NOT change drums. Cross-song splice (singing TP): different drum kit + mix + mastering -> percussive MFCC shifts -> cos_dist LARGE -> fires. Same mechanism 1eda8e3 voiced_unvoiced_MFCC_asymmetry exploited (+0.054 biggest keep) but HPSS is structurally cleaner source-separation than voicing-mask because median-filter operates in full TF plane rather than tagging whole time frames. Speech self-gating: HPSS strips harmonic vocals so percussive on speech is very quiet plosive+noise signature; within one recording mic+preamp+codec+room frozen -> pre/post similar (measured 0.004-0.013 on english clean) -> small magnitude, GBM low per-domain SHAP. Cross-speaker splice TP: different mic + different plosive physics -> cos_dist moderate/large -> TP helpful. Why all-frame cosine (not voicing-masked, not asymmetric): unvoiced masking on HPSS percussive would double-separate the same axis and lose drums-during-vocals signal; asymmetric is explicit fallback(c)(1) variant; start simple. Orthogonal: NOT any of the 80 existing features (all on original-audio STFT); NOT 1eda8e3 voiced_unvoiced_mfcc_asymmetry (voicing-mask on original MFCC not HPSS percussive); NOT 49bd0b1 voiced_mfcc; NOT any retrospective-match (single-boundary here not past-history bank); NOT any DSP gate or detector post-filter. FIRST HPSS-based feature; FIRST source-separation preprocessing axis. GBM max_depth=5 cannot synthesize HPSS decomposition from threshold splits on full-mix MFCC deltas. Pure features.py change: ~18-line HPSS+percussive-MFCC computation in _ensure_feat_cache with try/except sentinel falling back to zeros on exception; 1 ctx cache key 'feat_percussive_mfcc'; 1 new block _block_percussive_mfcc (~30 lines); 1 FEATURE_NAMES append; 2 assert bumps (80->81); 1 call in extract_features; self-test assert bump. Per-chunk HPSS cost ~200ms amortized once; eval ~180 chunks ~36s one-time; per-t cost 2 slices + 2 means on 13-dim + 1 cosine, sub-ms (measured 0.43 ms/call). Eval well under 300s budget. Smoke-verified: len(FEATURE_NAMES)==81 last-name 'percussive_mfcc_cosine_dist'; real singing clean_001.wav 6 within-song positions perc_mfcc_cos=0.0002-0.0008 confirming mechanism (drums frozen within-song); real english clean_001 perc_mfcc_cos=0.004-0.013 (small magnitude on speech as expected from HPSS stripping harmonic vocals); synthetic A(440Hz+low drum)/B(880Hz+noise drum) splice at t=20 yields 0.0022 vs 0.0000 at t=10 within-A (infinite discrimination on synthetic); edge guard t=0.5 returns small-magnitude value via underflow-safe cosine; idempotent on repeated calls; all 81 features finite; 500 calls in 213ms (0.43ms/call). FEATURE_NAMES sha change forces auto-retrain via US-505b gate.
425f6d6	0.463790	0.508513	0.293333	8	3	0.293333	0.417391	0.814815	4	4	0	discard	voicing-gated GBM threshold (music-strict 0.990 / speech-default 0.982) -- pure detector.py change, no retrain, FEATURE_NAMES stable 80, classifier byte-identical. STRUCTURAL pivot off 60+ exhausted axes (features.py 1st+2nd order paired-diff / variance / persistence / cross-scale / trajectory / corr-matrix / histogram / retrospective-match 7 variants / music-gate / HPSS-percussive; classifier-training sample_weight catastrophic e4a9c18 + capacity d1be6c3 + l2_reg 4b1575e + pitch-shift 4e2941b + time-stretch 7b49d40; detector post-filter peak-width 60196aa + margin d4d35b1 catastrophic 0.287 + cluster-count 1cded37 catastrophic english 0.889->0.542; DSP gates MAX/SUM/SECOND/PHASE) onto the genuinely untried PER-DOMAIN-THRESHOLD axis using an intrinsic audio statistic. Global GBM_THRESHOLD tried at 0.980/0.981/0.9825/0.983 (all failed) + 0.982 kept -- SPLIT the threshold by domain via voicing_prob_post rather than globally. MUSIC_GATE_VOICING_MAX=0.55 separates music (post_voicing_fraction 0.30-0.55, validated a23ab28 smoke real singing vp_post 0.40) from speech (0.65-0.85, validated real english vp_post 0.89). At each hit, if voicing_prob_post < 0.55: require p_splice > MUSIC_GBM_THRESHOLD=0.990 else default 0.982. Speech untouched: english 0.889 / korean 0.667 margins fully preserved. Mechanism on 3 singing chord-cycle FPs: vp_post~0.40 gate applies, require p_splice>0.990; marginal FPs at p_splice~0.983 drop (4b1575e cited l2 analysis). Real singing TPs cross-song disrupt multiple DSP signals simultaneously (sum 6-12 per 865d92f) so expected p_splice distribution shifted upward vs within-song chord-cycle FPs at marginal band. Orthogonal: NOT a23ab28 (music-gated FEATURE feeds GBM not gates it); NOT e4a9c18 (per-dataset sample_weight loss-gradient); NOT 60196aa/1cded37/d4d35b1 (p_splice-time-series post-filters no per-candidate domain split); NOT any global GBM_THRESHOLD tweak; NOT DSP_*_MIN tuning; NOT any features.py addition. FIRST per-domain threshold in detector history; FIRST use of intrinsic audio statistic (voicing_prob_post) as GBM-threshold domain-switch rather than arithmetic normalization or feature-input. GBM max_depth=5 cannot synthesize this because decision threshold operates on predict_proba OUTPUT not on features; no post-proba per-domain threshold path exists in existing detector logic. Blast radius: 3 new constants (MUSIC_GATE_FEATURE / MUSIC_GATE_VOICING_MAX / MUSIC_GBM_THRESHOLD) + 1 feature-index lookup (music_gate_idx alongside dsp_confirm_idx) + 3 lines in hit_mask loop (inserted BEFORE DSP gates so music-drop is counted separately) + music_dropped kv in diag.gbm.chunk_scan_done. Feature set unchanged. Classifier byte-identical; no retrain required. Per-emit cost: 1 row index + 1 compare, sub-us. Smoke-verified: AST parse OK 919 lines, MUSIC_GATE_FEATURE='voicing_prob_post' MUSIC_GATE_VOICING_MAX=0.55 MUSIC_GBM_THRESHOLD=0.99, other tunables stable (GBM_THRESHOLD=0.982 DSP_SUM_MIN=5.0 DSP_CONFIRMATION_MIN=2.0 GBM_MIN_SEP_S=3.5 ANALYSIS_STRIDE_S=0.12), FEATURE_NAMES stable at 80, voicing_prob_post index=34 confirmed present in classifier feature vector.
f1e91ec	0.463043	0.505645	0.283333	6	3	0.283333	0.443478	0.790123	3	3	0	discard	raise HistGBM l2_regularization 2.0 -> 3.0 (pure train_classifier.py hyperparameter change, no feature or detector edit) -- LINEAR CONTINUATION of 4b1575e keep (1.0 -> 2.0 kept as current baseline 0.589). Explicit cited next step from 4b1575e: 'common L2 progression {1,2,5,10} with 2.0 conservative first step; if unchanged 3.0-5.0 follows'. Since 4b1575e keep, 6 consecutive discards on 6 different axes: a23ab28 music-gate feature, 1cded37 cluster-count detector post-filter, e4a9c18 per-dataset sample_weight, 7b49d40 time-stretch augmentation, ca2aa2f HPSS percussive MFCC, 425f6d6 voicing-gated GBM threshold -- every structural pivot has regressed. Linear continuation of a PROVEN productive axis is the single most risk-bounded move available. Mechanism on 3 surviving singing chord-cycle FPs: they persist marginally above GBM_THRESHOLD=0.982 even after l2=2.0 (baseline singing 0.345 still 3 FPs). l2 shrinks leaf log-odds by (sum_hess+l2_prev)/(sum_hess+l2_new), disproportionately biting small-hessian edge-case leaves where marginal FPs live. Further 50% l2 bump (2.0 -> 3.0) squeezes leaf log-odds another ratio-step on same small-hessian leaves -- marginal FPs at p_splice ~0.983 drop below 0.982. Real TPs have larger hessian mass (sum_hess dominates ratio, shrinkage factor -> 1) so retain confident predictions. Speech english 0.889 / korean 0.667 predictions well-separated in log-odds -- 1.5x l2 bump should barely shift them. Why 3.0 specifically: 4b1575e went 1.0 -> 2.0 (2x); next doubling 4.0 aggressive; 3.0 is moderate 1.5x further, common {1,2,3,5,10} progression, allows bisection to 2.5 if too aggressive or 5.0 if unchanged. Orthogonal: NOT features.py (FEATURE_NAMES stable 80, features.py sha unchanged); NOT detector.py (no DSP/threshold/post-filter); NOT e4a9c18 (per-dataset sample_weight loss-gradient bias); NOT 7b49d40 (augmentation data-diversity); NOT d1be6c3 (capacity knob max_depth/max_leaf/max_iter stable); SAME axis as 4b1575e but DIFFERENT value -- pure linear continuation. Blast radius: 1 float literal in make_pipeline(). Training runtime unchanged (l2 is per-leaf scalar add, cost negligible). Inference cost unchanged (same forest size). US-505b train_classifier.py sha gate auto-retrains from scratch. Smoke-verified: AST parse OK 460 lines, make_pipeline() constructs Pipeline with l2_regularization=3.0 confirmed via named_steps[clf].l2_regularization, other hyperparameters stable (max_iter=300 max_depth=5 max_leaf_nodes=32 learning_rate=0.07 min_samples_leaf=20), FEATURE_NAMES stable at 80.
