commit	combined	combined_mean	combined_min	clean_fp	n_datasets	combined_singing	combined_korean	combined_english	clean_fp_singing	clean_fp_korean	clean_fp_english	status	description
1a8b1fe	0.503311	0.544909	0.318750	5	3	0.318750	0.476471	0.839506	3	2	0	discard	add voiced_percussive_chroma_asymmetry feature (FEATURE_NAMES 80->81) — signed asymmetry percussive_chroma_cosine_dist minus voiced_chroma_cosine_dist on +-2s pre/post window. Percussive mask = top-40% onset-energy frames (same threshold as fd500b3/aa4f141: onset > median*1.2); voiced mask = feat_vp>0. Cosine distance on 12-dim masked-mean chroma vectors, then subtract. Reuses cached feat_chroma + feat_onset + feat_vp — ZERO new librosa calls, ZERO new caches. FEATURE_NAMES count 80->81 triggers wrapper auto-retrain via US-505 sha gate. Targets 7972a98 current-keep (combined=0.589282) singing 0.345 weakest-domain plateau (3 clean FPs). Every plausible classifier-hyperparam axis saturated (depth/leaf 99081f5+960113c matched baseline byte-identical, LR 17d4aec / min_samples_leaf db59c36 / l2 df0ceec all produced IDENTICAL 0.490700) and every primary tunable saturated in both directions; voiced/unvoiced MFCC/chroma/contrast/flatness variants exhausted. This is the explicit cited untried fallback from 5+ consecutive reflections (0cb551f/c3, 53d3ea0/c3, 67633f2/c3, 17d4aec/c3, db59c36/c3, df0ceec/c2, 0c3bf76). Mechanism: percussive-mean chroma filters OUT drum contribution (drums broadband-noise have ~uniform 12-bin chroma averaging to near-uniform) and leaves pitched-accompaniment transient content (bass/guitar attacks) — reflects accompaniment CHORD signature. Voiced-mean chroma reflects singer's pitch class. Case (i) same-singer cross-song: voiced_chroma_dist small (~0.08) because singer holds similar key, percussive_chroma_dist large (~0.35) because accompaniment changes key -> asymmetry ~+0.27 LARGE. Case (ii) intra-song chord cycle (the 3 singing FPs): voice and accompaniment shift TOGETHER with chord progression -> both distances move in tandem -> asymmetry ~0 — chord-cycle FP cannot mimic positive-asymmetry signature because chord cycle is inherently synchronized. Case (iii) different-singer cross-song: both shift -> asymmetry cancels -> GBM falls back on voiced_mfcc / voiced_unvoiced_mfcc_asymmetry (1eda8e3 +0.054) which already fires. Critical orthogonality: percussive × MFCC previously failed both solo (fd500b3 singing regressed 0.345->0.319 — percussive MFCC is drum-timbre-noisy on speech consonants) and in asymmetry (aa4f141 singing 0.320 — cepstral noise mode persists even with paired differencing because voiced+percussive MFCC both shift with phoneme context). CHROMA is physically different from MFCC: drum chroma is near-flat broadband-noise distribution (averages away in percussive mean), whereas drum MFCC has strong timbre signature (dominates percussive mean). Speech self-gating via paired differencing (reproduces 1eda8e3 pattern): percussive-frame chroma tracks plosive bursts (phoneme-dependent, noise-like), voiced-frame chroma tracks vowel-formant harmonicity (phoneme-dependent, tonal) — both vary with phoneme context UNCORRELATED with splice position, so DIFFERENCE is zero-mean noise across training pairs, GBM assigns low per-domain SHAP on english/korean, feature functionally invisible on speech. Prevents the 634cdd2 raw-chroma and df6fc0a unvoiced_mfcc speech-regression failure mode. Orthogonal to every prior axis: NOT 1eda8e3 voiced_unvoiced_mfcc (cepstral asymmetry, unvoiced mask); NOT 7972a98 voiced_unvoiced_spec_contrast (spec_contrast asymmetry, unvoiced mask); NOT f4148cc voiced_unvoiced_chroma (chroma asymmetry but UNVOICED mask — failed because singer sings new note in new key so voiced shifts as much as unvoiced and asymmetry cancels); NOT aa4f141 voiced_percussive_mfcc (percussive × MFCC asymmetry — cepstral noise mode); NOT fd500b3 percussive_mfcc solo; NOT 32cac36 voiced_chroma solo (single-mask, no pair); NOT 308aa5a voiced_tonnetz; NOT 0c3bf76 voiced_unvoiced_spec_flatness_asymmetry. FIRST percussive × chroma content combination in any form, FIRST percussive mask against a non-cepstral content axis. Self-diagnostic on the IDENTICAL-COMBINED-STREAK concern (5 consecutive iterations at 0.490700 across hyperparam-only changes): features.py count bump 80->81 forces retrain via US-505 sha gate (0c3bf76 featadd produced distinct 0.538510 proving this path is alive) — if my change also lands at 0.490700, that's strong evidence of wrapper bug beyond cache invalidation. Blast radius: features.py only — 1 new block function (~40 lines) + 1 FEATURE_NAMES append + 2 assert bumps (80->81) + 1 call in extract_features. ZERO new caches, ZERO new librosa calls, one lazy scalar feat_perc_threshold cached on ctx (same machinery as aa4f141/fd500b3). Per-t cost: 4 slices + 2 mask applications + 4 masked means + 2 cosines on 12-dim vectors + 1 subtraction, sub-ms. Aggregate per-chunk cost negligible. Smoke-verified: len(FEATURE_NAMES)==81, last name 'voiced_percussive_chroma_asymmetry', extract_features returns 81 finite features on synthetic audio, idempotent on repeated calls, sentinel 0.0 fires correctly on silence (empty voiced mask).
4773d1e	0.482741	0.539526	0.257812	8	3	0.257812	0.517391	0.843373	5	3	0	discard	add percussive_spec_contrast_cosine_dist feature (FEATURE_NAMES 80->81) — single-mask 7-dim spec_contrast cosine distance restricted to percussive frames (top-40%% onset-energy, threshold = median(feat_onset)*1.2 matching fd500b3/aa4f141/1a8b1fe). Pre=[t-2,t] vs post=[t,t+2]. Reuses cached feat_contrast + feat_onset — ZERO new librosa calls, ZERO new caches; one lazy per-chunk feat_perc_threshold scalar. Sentinel 0.0 when mask empty or any sub-norm underflows. FEATURE_NAMES count 80->81 forces wrapper auto-retrain via US-505 sha gate. Targets 7972a98 current-keep (combined=0.589282) singing 0.345 weakest-domain plateau (3 clean FPs surviving DSP gates). Last 10+ iterations exhausted classifier hyperparam axis (99081f5+960113c byte-identical capacity revert; LR 17d4aec / min_samples_leaf db59c36 / l2 df0ceec all produced IDENTICAL combined=0.490700 strongly suggesting US-505 does NOT auto-retrain on train_classifier.py-only edits) and every primary tunable (THRESHOLD/MIN_SEP/STRIDE/DSP_MAX/DSP_SUM/DSP_PHASE all tested both directions). Only path alive is features.py-sha-change (1a8b1fe feature-add produced distinct 0.503311 confirming feature-count bump forces retrain). Genuinely NEW feature-space cell PERCUSSIVE x SPEC_CONTRAST. Prior percussive-mask attempts used only CEPSTRAL (fd500b3 percussive_mfcc solo failed, aa4f141 voiced_percussive_mfcc_asymmetry failed — phoneme-correlated noise mode on speech consonants) or PITCH-CLASS (1a8b1fe voiced_percussive_chroma_asymmetry failed — drum chroma is broadband-flat so percussive-chroma mean averages to uniform burying signal). SPEC_CONTRAST is physically DIFFERENT from both: per-band peak-to-valley amplitude ratio is a compressor/EQ/limiter mastering fingerprint, LESS phoneme-correlated than MFCC (per-band contrast varies with mastering chain not phoneme), and drums have NON-FLAT per-band contrast signature (snare ~200Hz, kick ~60Hz, cymbals 5-10kHz produce distinctive peak/valley profile on percussive frames). Mechanism on singing 3 FPs: within one song mastering chain frozen (drum bus compressor + vocal bus + limiter all constant) so percussive_spec_contrast stays stable across chord transitions (cosine_dist 0.05-0.15 small). Cross-song splice crosses drum-bus processing (different drum kit / different compression / different limiter threshold) — per-band peak/valley shifts (cosine_dist 0.25-0.60 large). Intra-song chord cycle (the 3 singing FPs): drum kit unchanged → feature sentinel-small → real cross-song-splice signature is LOUDER on percussive mask than on voiced/unvoiced split because drum-bus processing is the most album-variable mastering element. On speech: percussive frames are plosive bursts whose per-band contrast varies by phoneme but per-phoneme variance is uncorrelated with splice position → GBM low per-domain SHAP via tree splits → self-gates (same mechanism as voiced_spec_contrast on speech). Why single-mask not asymmetry: voiced_unvoiced_spec_contrast_asymmetry already exists (7972a98 keep +0.005) so spec_contrast axis already split via voiced/unvoiced paired-difference route; an unpaired PERCUSSIVE version hits mastering signal through a different frame population (transient-dominant) providing complementary GBM split ground (trees combine voiced_unvoiced_spec_contrast_asymmetry > T1 AND percussive_spec_contrast_cosine_dist > T2 to specifically discriminate same-singer cross-song splice from intra-song chord cycle). Orthogonal to every prior axis: NOT fd500b3 percussive_mfcc (cepstral); NOT aa4f141 voiced_percussive_mfcc_asymmetry (cepstral pairing); NOT 1a8b1fe voiced_percussive_chroma_asymmetry (pitch-class); NOT e7ca9eb voiced_spec_contrast (voiced mask, different frame population); NOT 7972a98 voiced_unvoiced_spec_contrast_asymmetry (voiced/unvoiced pair); NOT de0be6f spec_contrast_symmetry (pairwise sum); NOT 0c3bf76 spec_flatness_asymmetry (scalar abs-delta formulation). FIRST PERCUSSIVE x SPEC_CONTRAST content combination in any form, FIRST percussive mask against a non-cepstral non-pitch-class content axis. Pure features.py change — 1 new block function (~40 lines) + 1 FEATURE_NAMES append + 2 assert bumps (80->81) + 1 call in extract_features. ZERO new caches, ZERO new librosa calls. Per-t cost: 2 slices + 1 mask compare + 1 masked mean + 1 cosine on 7-dim vectors, sub-ms. Risk-bounded: sentinel 0.0 on empty-mask edge cases; signal physically grounded on singing where drum-bus mastering shifts across cross-song splices. Smoke-verified: len(FEATURE_NAMES)==81, last name 'percussive_spec_contrast_cosine_dist', extract_features returns 81 finite features on synthetic sustained+click audio, idempotent on repeated calls, percussive-mean cosine_dist=0.0024 (small) on stationary within-source signal as expected.
d3ddc9d	0.503051	0.561028	0.270769	6	3	0.270769	0.537313	0.875000	4	2	0	discard	add harmonic_spec_contrast_cosine_dist feature (FEATURE_NAMES 80->81) — sustained-frame mastering signature, COMPLEMENT of failed percussive mask. Harmonic mask = onset < median(onset)*0.8 (clear sustained / non-transient regime, structural complement of fd500b3/aa4f141/1a8b1fe/4773d1e percussive mask onset > median*1.2). 7-dim spec_contrast cosine on harmonic-mean vectors over pre[t-2,t] vs post[t,t+2]. Reuses cached feat_contrast + feat_onset — ZERO new librosa calls, ZERO new caches, one lazy feat_harm_threshold scalar. Sentinel 0.0 on empty mask or zero-norm. FEATURE_NAMES 80->81 forces wrapper auto-retrain via US-505 sha gate. Targets 7972a98 current-keep (combined=0.589282) singing 0.345 weakest-domain plateau (3 clean FPs). Most recent iteration 4773d1e percussive_spec_contrast_cosine_dist failed catastrophically (singing 0.345->0.258) and its explicit cited fallback was harmonic-mask complement. Every prior percussive-mask attempt monotonically bad on singing: fd500b3 (0.319), aa4f141 (0.320), 1a8b1fe (0.319), 4773d1e (0.258) — drum hits add NOISE not signal because drum kits play different fills/patterns within one song so percussive-mean spec_contrast jitters within-song, washing out the cross-song mastering signal. The HARMONIC mask is structurally opposite frame population: sustained vocal notes + bass groove + ringing chords where within-song mastering is FROZEN (vocal bus compressor + master limiter operate identically on sustained content) and cross-song splices cross those mastering chains cleanly. Within-song chord transition: sustained spec_contrast stable (cosine_dist 0.05-0.15). Cross-song splice: vocal preamp / bus compression / mastering EQ shifts -> per-band peak/valley shifts noticeably (cosine_dist 0.25-0.50). Critical asymmetry: drum hits are TRANSIENT events that destabilize percussive-mean spectral statistics within-song; sustained frames are STATISTICALLY STABLE within-song because they're dominated by pitched material whose spectral envelope is mastering-bus-shaped not transient-shaped. Mastering chain has strong continuous effect on sustained content, weak/intermittent on transient content. Speech self-gating: harmonic mask = sustained vowel mid-portions whose spec_contrast captures formant peak/valley structure (speaker/recording-dependent, NOT phoneme-burst-correlated) — same self-gating that worked on e7ca9eb voiced_spec_contrast keep. Why threshold *0.8 (not *1.0): symmetric structural complement of percussive's *1.2; clear sustained-frame regime instead of marginal around-median set. Classifier hyperparam axis verifiably saturated (LR 17d4aec / min_samples_leaf db59c36 / l2 df0ceec all produced IDENTICAL combined=0.490700 — strong evidence US-505 doesn't auto-retrain on train_classifier.py-only edits). Every primary tunable saturated both directions. Only path alive is features.py-sha-change (1a8b1fe/0c3bf76/4773d1e all produced distinct combined values vs the 0.490700 streak). Orthogonal to every prior axis: NOT 4773d1e percussive_spec_contrast (COMPLEMENT mask — physically opposite frame population); NOT e7ca9eb voiced_spec_contrast (voiced=vp>0 mask, harmonic=onset<thr mask, mostly disjoint frame populations on singing); NOT 7972a98 voiced_unvoiced_spec_contrast_asymmetry (paired diff over voiced/unvoiced); NOT de0be6f symmetry; NOT 0c3bf76 spec_flatness asymmetry. FIRST HARMONIC-mask feature in any content axis. Pure features.py change — 1 new block + 1 FEATURE_NAMES append + 2 assert bumps + 1 call. ZERO new caches, ZERO new librosa calls. Per-t cost: 2 slices + 1 mask compare + 1 masked mean + 1 cosine on 7-dim vectors, sub-ms. Smoke-verified: len(FEATURE_NAMES)==81, last name 'harmonic_spec_contrast_cosine_dist', stationary 440Hz sine cos_dist=2e-6 (sustained tone correctly stable), 440->880 synthetic splice cos_dist=0.379 (~190000x discrimination), all 81 features finite on synthetic audio.
d49284c	0.539430	0.572137	0.354098	4	3	0.354098	0.537313	0.825000	2	2	0	discard	add voiced_unvoiced_mfcc_asymmetry_far feature (FEATURE_NAMES 80->81) — FAR-window companion to 1eda8e3 (kept +0.054 biggest win). Same paired-difference template, post=[t+4,t+8] instead of [t,t+2]. Reuses cached feat_mfcc + feat_vp, ZERO new librosa calls. Edge guard t+8>duration_s OR t-2<0 returns sentinel 0.0. Targets 7972a98 baseline (combined=0.589282) singing 0.345 weakest-domain plateau (3 chord-cycle FPs surviving NEAR-window asymmetry which is ~0 on within-song chord cycle). Mechanism: within-song chord cycle voiced_far ~0.20 (different vowels for new lyrics) but unvoiced_far ~0.05 (same drums/mastering across 6s within song) -> asymmetry NEGATIVE -0.15. Same-singer cross-song splice voiced_far ~0.10 (similar vocal tract) but unvoiced_far ~0.30-0.50 (new drums + new mastering) -> asymmetry POSITIVE +0.15 to +0.40. SIGN FLIP between chord-cycle FP (NEG) and cross-song splice (POS) is binary discriminator GBM cannot synthesize from existing NEAR features. Trees split on (near_asym>0.15 AND far_asym>0 -> splice) vs (near_asym~0 AND far_asym<0 -> chord cycle). Speech self-gating: voiced+unvoiced far-window MFCC both co-vary with new sentence content -> diff is zero-mean noise -> GBM low SHAP on english/korean (1eda8e3 proven mechanism). Classifier hyperparam axis verifiably broken (5 train_classifier.py-only iterations all produced IDENTICAL combined=0.490700 -> US-505 doesn't auto-retrain on hyperparam edits); only features.py-sha bumps force retrain (1a8b1fe/0c3bf76/4773d1e/d3ddc9d all distinct values). Last 5 mask experiments all regressed singing catastrophically (4773d1e percussive_spec_contrast 0.345->0.258, d3ddc9d harmonic_spec_contrast 0.270, 1a8b1fe voiced_percussive_chroma 0.319, fd500b3/aa4f141 0.319-0.320). Pivot back to working voiced/unvoiced asymmetry family with new TIME SCALE rather than yet another mask. Orthogonal: NOT 1eda8e3 (NEAR window same template); NOT 7972a98 (spec_contrast not cepstral); NOT f4148cc (chroma asym NEAR); NOT 0c3bf76 (1D scalar abs-delta); NOT ff65865 voiced_chroma_far (single-mask no asymmetry); NOT 32cac36/49bd0b1/308aa5a/percussive/harmonic mask family. FIRST FAR-window asymmetry feature in any content axis. Pure features.py change — 1 new block (~50 lines, template-cloned from 1eda8e3 with edge guard) + 1 FEATURE_NAMES append + 2 assert bumps + 1 call. ZERO new caches, ZERO new librosa calls. Per-t cost 4 slices + 4 masked means + 2 cosines on 13-dim vectors + 1 subtraction, sub-ms. Smoke-verified: len(FEATURE_NAMES)==81, last name 'voiced_unvoiced_mfcc_asymmetry_far', edge guard fires correctly (t=5 with 12s chunk -> 0.0; t=1 with t-2<0 -> 0.0), in-range t=2.5 yields finite value 0.011, all 81 features finite, idempotent on repeated calls.
ff88b22	0.500909	0.538900	0.295385	6	3	0.295385	0.555882	0.765432	4	2	0	discard	add voiced_unvoiced_mfcc_asymmetry_wide feature (FEATURE_NAMES 80->81) — WIDE-ADJACENT-window companion to 1eda8e3 NEAR ±2s (kept +0.054 biggest win) and d49284c FAR ±2s-pre/+4-+8-post (failed because gap broke speech self-gating). Pre=[t-4,t] adjacent post=[t,t+4], same paired-difference template, ZERO new librosa calls. Edge guard t-4<0 OR t+4>duration_s returns sentinel 0.0. Last iteration d49284c LIFTED singing 0.345->0.354 (only recent feature to do so) but speech regressed sharply (korean 0.667->0.537, english 0.889->0.825) because the 6s GAP between pre and post sub-windows on speech caused them to sample different sentences/topics — voiced+unvoiced MFCC shifts no longer co-vary with same phoneme context, breaking paired-difference self-gating. WIDE eliminates the gap while expanding the window 2x over NEAR. Mechanism on 3 surviving singing FPs (within-song chord cycle): NEAR ±2s asymmetry at chord boundary ~0 because both voiced+unvoiced shift together with chord. WIDE ±4s averages OVER multiple chord transitions in pre AND in post — chord-cycle signal averages OUT (mean of multiple chord shifts cancels) -> asymmetry stays near 0 on chord-cycle FP. Real cross-song splice: pre is 4s of song A's mastering, post is 4s of song B's mastering. Unvoiced sub-window (drum/mastering) distance large; voiced sub-window (vocal tract) smaller -> asymmetry strongly positive. Sign separation chord-cycle (~0) vs cross-song (positive) preserved AND CLEANER than NEAR because NEAR's chord-cycle noise gets averaged away. Speech self-gating preserved by adjacency: ADJACENT ±4s windows on speech sample similar broad phoneme distribution (4s ≈ 6-10 syllables, broad enough to span typical phoneme distribution); both voiced and unvoiced sub-windows on each side contain similar mix of vowels and consonants; differences dominated by speaker/recording continuity not phoneme drift -> diff near zero -> low GBM SHAP on english/korean. Same self-gating that worked at NEAR works at WIDE because no gap = same context similarity. Voiced/unvoiced asymmetry family is provably the most productive axis: 1eda8e3 +0.054 (biggest single win) and 7972a98 +0.005 (small but consistent). Time-scale variation on this proven template is the natural next axis after content/mask exhaustion. Last 10+ iterations exhausted: classifier hyperparam axis verifiably broken (5 train_classifier.py-only iterations all produced IDENTICAL combined=0.490700 -> US-505 doesn't auto-retrain on hyperparam edits); every primary tunable saturated both directions; mask experiments (percussive/harmonic) all monotonically failed; 1D-scalar abs-delta (0c3bf76 spec_flatness) failed; all far-window single-mask companions (ff65865 voiced_chroma_far) failed. Only path alive is features.py-sha-change (1a8b1fe/0c3bf76/4773d1e/d3ddc9d/d49284c all produced distinct combined values vs the 0.490700 streak). Orthogonal: NOT 1eda8e3 (NEAR window — same template at 2x time scale); NOT d49284c (FAR window has a gap — WIDE is adjacent); NOT 7972a98 (spec_contrast not cepstral); NOT f4148cc (chroma asymmetry); NOT 0c3bf76 (1D scalar abs-delta); NOT ff65865 (single-mask far). FIRST WIDE-ADJACENT-window asymmetry feature in any content axis. Pure features.py change — 1 new block (~50 lines, template-cloned from 1eda8e3 with edge guard) + 1 FEATURE_NAMES append + 2 assert bumps + 1 call. ZERO new librosa calls, ZERO new caches. Per-t cost: 4 slices + 4 masked means + 2 cosines on 13-dim vectors + 1 subtraction, sub-ms. Smoke-verified: len(FEATURE_NAMES)==81, last name 'voiced_unvoiced_mfcc_asymmetry_wide', edge guard fires correctly (t-4<0 OR t+4>duration_s -> 0.0), synthetic cross-source asymmetry=2.0 large positive, synthetic within-source asymmetry=0.0 sentinel, end-to-end extract_features returns 81 finite features on synthetic audio, idempotent on repeated calls.
