commit	combined	combined_mean	combined_min	clean_fp	n_datasets	combined_singing	combined_korean	combined_english	clean_fp_singing	clean_fp_korean	clean_fp_english	status	description
89e801f	0.423899	0.466003	0.231507	7	3	0.231507	0.477612	0.688889	7	0	0	keep	GBM_THRESHOLD 0.983->0.982 continue accepted loosening direction (0.985->0.983 kept) one fine-grained step, untested intermediate above failed 0.98, targeting borderline TPs to close recall<precision gap (0.82 vs 0.85)
654ce97	0.409270	0.450092	0.228378	8	3	0.228378	0.440580	0.681319	7	1	0	discard	GBM_THRESHOLD 0.982->0.981 continue accepted loosening direction (0.985->0.983->0.982 all kept), untested fine-grained intermediate between kept 0.982 and prior-failed 0.98 (from 0.985 baseline) to recover borderline TPs closing recall<precision gap (0.82 vs 0.85)
8e5b25b	0.436234	0.480524	0.236620	6	3	0.236620	0.492308	0.712644	6	0	0	keep	GBM_MIN_SEP_S 2.75->3.0 untested fine-grained step (between kept 2.75 and failed 4.0 from 2.5 baseline), consolidate adjacent FP emits in clean singing files (clean_fp=7, weakest domain 0.231) since real splices typically separated >3s so TPs preserved
8717fc5947af123726c98de437ba12921b7caa48	0.447035	0.496135	0.240000	6	3	0.240000	0.492308	0.756098	6	0	0	keep	GBM_MIN_SEP_S 3.0->3.25 re-propose orphan-reverted change through verify channel, further consolidate adjacent FP emits in clean singing files (clean_fp=6, weakest domain 0.237) since real splices in 30-120s files typically separated >3.25s so TPs preserved; revert note cites fresh 0.447 eval as suggestive
d14e03c632e52c27eaab140a71a4dc334a08bda7	0.449352	0.498699	0.240000	6	3	0.240000	0.500000	0.756098	6	0	0	keep	GBM_MIN_SEP_S 3.25->3.5 continue accepted fine-grained step in +0.25 streak (2.5->2.75->3.0->3.25 all kept), untested intermediate between kept 3.25 and failed 4.0 from 2.5 baseline, further consolidate adjacent FP emits in clean singing files (clean_fp=6, weakest domain 0.240) since real splices in 30-120s files typically separated >3.5s so TPs preserved
fa250b8	0.448140	0.496667	0.240000	6	3	0.240000	0.500000	0.750000	6	0	0	discard	GBM_MIN_SEP_S 3.5->3.75 continue accepted +0.25 streak (2.5->2.75->3.0->3.25->3.5 all kept), untested fine-grained intermediate between kept 3.5 and prior-failed 4.0 from 2.5 baseline, further consolidate adjacent FP emits in clean singing files (clean_fp=6 plateau across last 2 keeps, weakest domain stuck 0.240) since real splices in 30-120s files typically separated >3.75s so TPs preserved
da5aae1	0.399907	0.444885	0.213889	8	3	0.213889	0.437838	0.682927	6	2	0	discard	ANALYSIS_STRIDE_S 0.12->0.11 continue accepted densification streak (0.2->0.15->0.12 all kept), untested fine-grained intermediate between kept 0.12 and prior-failed 0.10 (from 0.2 baseline), denser peak sampling within 3.5s dedupe window to recover borderline TPs on weakest domain singing (combined=0.240, splice_f1~0.34) since MIN_SEP_S=3.5 consolidates adjacent emits so FP count stays bounded
e54ed4e	0.412952	0.470679	0.227500	10	3	0.227500	0.389189	0.795349	7	2	1	discard	MAX_DEPTH 3->4 retrain GBM with modestly deeper trees — primary tunables (GBM_THRESHOLD 0.982, MIN_SEP_S 3.5, STRIDE 0.12) now bracketed by failures on both sides and classifier hyperparams untouched post-refactor; depth-4 captures higher-order feature interactions (spec_rolloff_delta x spec_centroid_delta x dsp_t2_z are top singing signals) needed to discriminate real splices from song-natural spectral jumps driving singing clean_fp=6 plateau at weakest-domain combined=0.240
5a6b250	0.390323	0.457244	0.187500	6	3	0.187500	0.409231	0.775000	5	1	0	discard	GBM subsample 0.9->0.8 retrain with stronger stochastic GBM regularization (Friedman's subsample) since primary tunables now bracketed by failures on both sides (GBM_THRESHOLD 0.982 bracketed by failed 0.981/0.98, GBM_MIN_SEP_S 3.5 bracketed by failed 3.75/4.0, ANALYSIS_STRIDE_S 0.12 bracketed by failed 0.11/0.10) and max_depth 3->4 already failed, targeting singing clean_fp=6 plateau at weakest combined=0.240 by decorrelating ensemble trees to reduce variance of extreme-probability predictions on hard clean singing segments where spec_rolloff_delta/spec_centroid_delta spikes from song-natural transitions currently push above GBM_THRESHOLD=0.982
4e548de	0.409701	0.446057	0.246154	6	3	0.246154	0.409091	0.682927	4	2	0	discard	GBM min_samples_leaf 1->5 retrain with leaf-level regularization — primary tunables now bracketed by failures on both sides (GBM_THRESHOLD 0.982 bracketed by failed 0.981/0.98, GBM_MIN_SEP_S 3.5 bracketed by failed 3.75/4.0, ANALYSIS_STRIDE_S 0.12 bracketed by failed 0.11/0.10) and prior retrains tried tree-shape (max_depth 3->4 failed) and ensemble-stochastic (subsample 0.9->0.8 failed) axes; min_samples_leaf is an untried orthogonal regularization that prevents narrow single-sample leaves on a modest 1200-row training set (default leaf=1 allows 0.08% leaves), targeting singing clean_fp=6 plateau at weakest combined=0.240 where GBM likely memorizes specific spec_rolloff_delta/spec_centroid_delta patterns from training singing that don't generalize to eval singing's song-natural chord-transition deltas
943afec	0.449352	0.498699	0.240000	6	3	0.240000	0.500000	0.756098	6	0	0	discard	GBM_MIN_SEP_S 3.5->3.6 finer step in nearly-kept direction (3.5->3.75 failed at combined=0.448140, just 0.001 below current best 0.449352) — untested intermediate between kept 3.5 and failed 3.75, further consolidate adjacent FP emits in clean singing files (clean_fp=6 plateau, weakest domain 0.240) since real splices in 30-120s files typically separated >3.6s so TPs preserved; smaller increment should recover the small FP consolidation benefit of 3.75 without its borderline TP loss
85aa77f	0.443440	0.497202	0.232727	4	3	0.232727	0.482759	0.776119	4	0	0	discard	GBM max_features None->'sqrt' retrain with per-split feature subsampling — untried feature-level regularization (prior retrains tried row/tree-shape: max_depth 3->4 failed, subsample 0.9->0.8 failed, min_samples_leaf 1->5 failed) and primary tunables bracketed (GBM_THRESHOLD 0.982 by failed 0.981/0.98, GBM_MIN_SEP_S 3.5 by failed 3.6/3.75/4.0, ANALYSIS_STRIDE_S 0.12 by failed 0.11/0.10); top singing predictors spec_rolloff_delta(962) / spec_centroid_delta(300) / spec_bandwidth_delta(294) / nf_rolloff_delta(174) are highly correlated envelope-driven features that dominate splits, so sampling ~sqrt(75)=9 features per split forces alternative splits onto uncorrelated dsp_t2_z / dsp_pairwise_proximity to reduce memorization of song-natural chord-transition patterns driving singing clean_fp=6 plateau at weakest combined=0.240
050aa49	0.452885	0.506172	0.238028	7	3	0.238028	0.500000	0.780488	7	0	0	keep	ANALYSIS_STEP_S 50.0->40.0 untried primary tunable (chunk-geometry axis, 12 iterations of threshold/min_sep/stride all bracketed, retrains all failed), increase chunk overlap from 17% to 33% so splices landing within 20s of a chunk boundary get two chunk views instead of one with truncated pre/post T²/CPE windows, recover borderline TPs driving singing splice_f1 plateau (~0.34, weakest domain combined=0.240), FP growth bounded by GBM_MIN_SEP_S=3.5 dedupe consolidating redundant emits from overlapping chunks on clean files
2a2e584	0.468623	0.509440	0.272222	6	3	0.272222	0.500000	0.756098	6	0	0	keep	ANALYSIS_STEP_S 40.0->30.0 continue accepted direction from the single keep on chunk-geometry axis (50.0->40.0 gave current best 0.452885), same -10s step size that worked, bump overlap from 33% to 50% so every splice within 30s of a chunk boundary is guaranteed two chunk views (vs 20s at step=40), further recover borderline TPs driving singing splice_f1 plateau (~0.34, weakest domain combined=0.240), matches +0.25 streak pattern on GBM_MIN_SEP_S that held 5 kept steps in a row, FP growth bounded by GBM_MIN_SEP_S=3.5 dedupe consolidating redundant emits from overlapping chunks
c33d51d	0.374619	0.461763	0.145455	12	3	0.145455	0.468750	0.771084	12	0	0	discard	ANALYSIS_STEP_S 30.0->20.0 continue accepted direction on chunk-geometry axis (50.0->40.0 kept at 0.452885, 40.0->30.0 kept at current best 0.468623), same -10s step size that has held 2 kept iterations in a row, bump overlap from 50% to 67% so every splice within 40s of a chunk boundary is guaranteed two chunk views (vs 30s at step=30), further recover borderline TPs driving singing splice_f1 plateau (weakest domain combined=0.272, clean_fp=6), matches +0.25 streak pattern on GBM_MIN_SEP_S that held 5 kept steps in a row, FP growth bounded by GBM_MIN_SEP_S=3.5 dedupe consolidating redundant emits from tripled overlapping chunk views on clean files, eval time budget headroom ample (243s observed vs 300s budget, step=20 increases chunk count ~1.5x from step=30)
e8e6a26	0.352153	0.427500	0.162162	12	3	0.162162	0.349254	0.771084	10	2	0	discard	ANALYSIS_WINDOW_S 60.0->75.0 untested primary tunable on chunk-geometry axis (W never touched while S tuned 50->40->30 for 3 consecutive keeps 0.449->0.453->0.469), increase each chunk's context 25% to stabilize PCA basis and T²/CPE baselines that top singing predictors (spec_rolloff_delta/spec_centroid_delta/spec_bandwidth_delta) are built on, recover borderline TPs and suppress song-natural chord-transition FPs driving weakest-domain singing combined=0.272 with clean_fp=6, overlap fraction grows from 50%% to 60%% (W-S=45 vs 30) so every splice within 45s of a chunk boundary keeps two-chunk coverage, S held at 30 since S=20 failed (0.375) so densification by chunk count has saturated but window-size axis is orthogonal, fewer but longer chunks per file keeps scan_total ~constant within 300s budget, FP growth bounded by GBM_MIN_SEP_S=3.5 dedupe consolidating redundant emits across overlapping longer chunks
280b24f	0.438480	0.492475	0.228378	10	3	0.228378	0.480000	0.769048	7	2	1	discard	introduce ANALYSIS_EDGE_S=1.0 (was hardcoded 0.5) untried primary tunable on chunk-geometry axis (all prior work touched W/S/STRIDE/THRESHOLD/MIN_SEP/retrain), widen the no-emit margin at each chunk boundary where features.py builds pre/post T²/CPE baselines from truncated context (0.5s pre-window is statistically unstable), preferentially suppress singing FPs from song-natural spec_rolloff_delta / spec_centroid_delta / dsp_t2_z spikes at chunk edges (all top singing predictors degrade with truncated pre/post windows, weakest-domain combined=0.272 with clean_fp=6), S=30/W=60 50% overlap guarantees every interior file position is also scanned by an adjacent chunk at local t well past 1.0s (typically mid-chunk full-context) so no interior TP loss, evaluate.py TOLERANCE_S=1.0 means any GT splice within 1.0s of file start/end is already outside matching envelope so first/last-chunk edge widening risks zero additional TP loss, FP growth bounded by GBM_MIN_SEP_S=3.5 dedupe on clean files
dbbbd5f	0.439161	0.493582	0.231507	7	3	0.231507	0.468750	0.780488	7	0	0	discard	ANALYSIS_STEP_S 30.0->25.0 fine-grained intermediate between kept 30.0 (current best 0.468623) and failed 20.0 (0.374619), untested midpoint on chunk-geometry axis that has been winning (50->40 kept, 40->30 kept as -10s steps), bump overlap from 50%% to 58%% so every splice within 35s of a chunk boundary gets two chunk views (vs 30s at step=30, which lost the progression at step=20 density), matches fine-grained intermediate pattern that held repeatedly on GBM_MIN_SEP_S axis (3.0->3.25 kept after 2.5 baseline, 3.25->3.5 kept, step=0.25 dominated after -0.5 step exhausted), further recover borderline TPs driving singing splice_f1~0.34 plateau (weakest domain combined=0.272, clean_fp=6), FP growth bounded by GBM_MIN_SEP_S=3.5 dedupe consolidating redundant emits from moderately denser chunk views on clean files, eval time headroom (243s observed vs 300s budget) accommodates ~1.2x chunk count increase from step=30 vs prior step=20 failure likely due to 1.5x blowup overshooting budget or introducing too many overlapping edge-artifact emits
a38a2ef	0.434679	0.480517	0.267123	7	3	0.267123	0.393939	0.780488	7	0	0	discard	ANALYSIS_STEP_S 30.0->27.5 untested fine-grained intermediate between kept 30 (current best 0.468623) and failed 25 (0.439161, step -5s) / failed 20 (0.374619, step -10s), matches GBM_MIN_SEP_S +0.25 fine-grained intermediate pattern that held 5 keeps in a row (2.5->2.75->3.0->3.25->3.5), -2.5s step is untested smaller version of the failed -5s, bumps overlap from 50% to 54% (W-S=32.5 vs 30), every splice within 32.5s of chunk boundary gets two views (up from 30s), chunk count +9% which is marginal vs the 17% hop at S=25 that overshot consolidation, targets borderline singing TPs at splice_f1~0.39 driving weakest domain combined=0.272 with clean_fp=6, FP growth bounded by GBM_MIN_SEP_S=3.5 dedupe consolidating redundant emits across ~9% more chunks on clean singing files, eval time budget headroom ample (~243s observed vs 300s, 1.09x chunk count stays well inside)
ec579d0	0.425237	0.470960	0.233333	6	3	0.233333	0.454545	0.725000	6	0	0	discard	NEG_MIN_DIST_S 2.0->3.5 align training-time negative sampling distance with detector.GBM_MIN_SEP_S=3.5 dedupe distance — untouched axis (training-data construction never modified since initial commit, all 4 prior failed retrains touched only GBM hyperparams: max_depth, subsample, min_samples_leaf, max_features), removes label noise in 2.0-3.5s post-splice region where features may stay elevated (especially tier-2 crossfades whose splice region commonly spans >2s) but were previously labeled as not_splice while at test time the same positions get deduped by the GT-positive emit anyway, sharpens classifier's understanding of true splice boundaries vs adjacent-but-not-splice, targets singing clean_fp=6 plateau and weakest-domain combined=0.272 by reducing confusion between borderline near-GT samples and true negatives, primary tunables now bracketed (GBM_THRESHOLD 0.982 by failed 0.981/0.98, GBM_MIN_SEP_S 3.5 by failed 3.6/3.75/4.0, ANALYSIS_STRIDE_S 0.12 by failed 0.11/0.10, ANALYSIS_STEP_S 30 by failed 25/27.5/20, ANALYSIS_WINDOW_S 60 by failed 75, ANALYSIS_EDGE_S 0.5 by failed 1.0), class balance shift modest (600 not_splice / 300 hard_cut / 300 crossfade vs prior similar)
7111954	0.458553	0.515410	0.238095	6	3	0.238095	0.502941	0.805195	5	1	0	discard	POS_OFFSETS_S (0.0,±0.3,±0.6)->(0.0,±0.3) remove wide positives — untouched training-data-construction axis (all retrain hyperparams failed: max_depth 4, subsample 0.8, min_samples_leaf 5, max_features sqrt, NEG_MIN_DIST_S 3.5; primary tunables all bracketed), ±0.6s offsets create label noise since crossfades (tier 2) span ~300-500ms so features at GT+0.6 reflect post-crossfade continuous-clip statistics labeled as splice, and for hard cuts (tier 1) with typical delta-feature windows ≤0.6s both pre/post windows fall entirely within one clip-side at ±0.6 offset yielding clean-like deltas mislabeled splice, GBM then learns spec_rolloff_delta/spec_centroid_delta/spec_bandwidth_delta (top singing predictors) "past-splice continuous" pattern which eval-singing song-natural chord-transition deltas happen to match driving singing clean_fp=6 plateau at weakest-domain combined=0.272, tightening positives to ±0.3s keeps offsets well inside both crossfade duration and any reasonable delta window so positive labels align with actual splice signal, class counts shift 600/300/300 -> 600/180/180 (10:3:3 ratio preserves minority weight vs prior 10:5:5), closest positives at 0.0/±0.3 retained so no loss of high-quality splice examples
d5a1e67	0.438441	0.495299	0.226087	8	3	0.226087	0.475000	0.784810	7	1	0	discard	NEG_PER_CLEAN 4->8 double clean-file negatives in training set — untried training-data-composition axis (all prior retrains touched classifier hyperparams: max_depth 4, subsample 0.8, min_samples_leaf 5, max_features sqrt, or splice-adjacent sample geometry: NEG_MIN_DIST_S 3.5, POS_OFFSETS_S narrowed to ±0.3, all failed) and primary tunables all bracketed (GBM_THRESHOLD 0.982 by failed 0.981/0.98, GBM_MIN_SEP_S 3.5 by failed 3.6/3.75/4.0, ANALYSIS_STRIDE_S 0.12 by failed 0.11/0.10, ANALYSIS_STEP_S 30 by failed 25/27.5/20, ANALYSIS_WINDOW_S 60 by failed 75, ANALYSIS_EDGE_S 0.5 by failed 1.0); doubles per-clean-file negatives from 4 to 8 giving GBM ~240 additional clean-audio feature exposures (20 clean files × 4 extra × 3 domains), class counts shift 600/300/300 → 840/300/300 (2.8:1:1 from 2:1:1), directly targets singing clean_fp=6 plateau at weakest-domain combined=0.272 since singing FPs live exclusively on clean files (english/korean clean_fp=0) so the failure mode is specifically 'clean singing patterns escape p_splice>0.982' which more clean negatives should push down, untried axis orthogonal to both tree-shape regularization and splice-adjacent labeling that have been exhausted, class-minority positive counts unchanged preserving splice-example density and recall baseline
399c8d3	0.457300	0.504981	0.266667	4	3	0.266667	0.448276	0.800000	4	0	0	discard	GBM learning_rate 0.07->0.05 retrain with slower shrinkage — untried retrain axis (all prior failed retrains touched tree-shape max_depth 4, ensemble-stochastic subsample 0.8, leaf regularization min_samples_leaf 5, feature-level max_features sqrt, or training-data geometry NEG_MIN_DIST 3.5 / POS_OFFSETS ±0.3 / NEG_PER_CLEAN 8, none touched the learning-rate axis which controls per-tree contribution shrinkage orthogonally to all prior regularizers) and primary tunables all bracketed (GBM_THRESHOLD 0.982 by failed 0.981/0.98, GBM_MIN_SEP_S 3.5 by failed 3.6/3.75/4.0, ANALYSIS_STRIDE_S 0.12 by failed 0.11/0.10, ANALYSIS_STEP_S 30 by failed 25/27.5/20, ANALYSIS_WINDOW_S 60 by failed 75, ANALYSIS_EDGE_S 0.5 by failed 1.0); lower learning_rate at fixed n_estimators=200 reduces each tree's contribution from 0.07 to 0.05 (~29%% shrinkage) forcing the ensemble to rely on smoother, more averaged signal across trees rather than sharp early-tree splits memorizing specific spec_rolloff_delta / spec_centroid_delta / spec_bandwidth_delta patterns from training singing that don't generalize to eval singing's song-natural chord-transition deltas driving singing clean_fp=6 plateau at weakest-domain combined=0.272, training loss will be under-fit relative to prior 0.07 fit but that's the intended tradeoff for the classifier-generalization failure mode not addressed by regularization-axis retrains, keeps ensemble capacity identical (same depth 3, same 200 trees, same subsample 0.9) so only the per-tree shrinkage axis changes
ba46631	0.463218	0.502781	0.276056	6	3	0.276056	0.476190	0.756098	6	0	0	discard	GBM_THRESHOLD 0.982->0.9825 re-tighten after chunk-overlap doubled (step 50->40->30 keeps grew 17%->33%->50% overlap so per-file emit candidates roughly doubled since 0.982 was tuned), untested fine-grained intermediate between current 0.982 and prior-kept-at-old-geometry 0.983 (0.985->0.983->0.982 all kept sequentially before chunk-geometry axis was touched), half the step size (0.0005 vs 0.001) of the failed 0.982->0.981 loosening to test re-tightening direction without overshooting, directly targets singing clean_fp=6 plateau at weakest-domain combined=0.272 since denser chunk overlap produces more redundant borderline emits on clean files which GBM_MIN_SEP_S=3.5 dedupes into single-point FPs at p_splice between 0.9825 and 0.982 (below new threshold but above current), marginal TP loss bounded because real splices typically score >0.99 per hard_cut classification and crossfades are the weaker recall class living at p=0.93-0.98 where 0.0005 tighter bite is negligible
2822de0	0.371486	0.444756	0.170455	13	3	0.170455	0.387342	0.776471	10	3	0	discard	GBM n_estimators 200->300 retrain with untouched ensemble-width axis — untried classifier capacity dial (prior retrains exhausted orthogonal regularization axes: max_depth 3->4 failed, subsample 0.9->0.8 failed, min_samples_leaf 1->5 failed, max_features None->sqrt failed, learning_rate 0.07->0.05 failed, and training-data-geometry NEG_MIN_DIST 2->3.5 / POS_OFFSETS narrowed to ±0.3 / NEG_PER_CLEAN 4->8 all failed) and primary tunables all bracketed (GBM_THRESHOLD 0.982 by failed 0.981/0.9825/0.98, GBM_MIN_SEP_S 3.5 by failed 3.6/3.75/4.0, ANALYSIS_STRIDE_S 0.12 by failed 0.11/0.10, ANALYSIS_STEP_S 30 by failed 25/27.5/20, ANALYSIS_WINDOW_S 60 by failed 75, ANALYSIS_EDGE_S 0.5 by failed 1.0); +50%% trees at fixed learning_rate=0.07 gives the boosting residual-fit process 100 additional iterations to focus on the hardest samples (which in gradient boosting are by construction the borderline classifications late in training), directly targeting the residual misclassification population where clean singing p_splice hovers near 0.982 threshold driving clean_fp=6 plateau at weakest-domain combined=0.272 — unlike learning_rate 0.05 which UNDERFIT by shrinking each tree's contribution at fixed capacity (failed at 0.457), this keeps per-tree signal strong while extending the ensemble's focus on hard samples, capacity axis is orthogonal to all prior regularization retrains so a distinct signal whether singing FPs are a capacity shortage (GBM genuinely lacks iterations to separate song-natural spec_rolloff_delta / spec_centroid_delta / spec_bandwidth_delta jumps from true splices) vs a noise-overfitting problem (regularization axes already failed, suggesting capacity-shortage is the more likely residual), training time modest increase ~1.5x on a ~3min retrain, eval stays instant since GBM inference is O(n_estimators·depth) adding ~50%% to per-candidate scoring which is negligible against scan_total
