commit	combined	combined_mean	combined_min	clean_fp	n_datasets	combined_singing	combined_korean	combined_english	clean_fp_singing	clean_fp_korean	clean_fp_english	status	description
bba6dbe	0.473315	0.488205	0.387692	6	3	0.387692	0.410256	0.666667	2	4	0	keep	pitch-shift audio augmentation of CLEAN SINGING training chunks (±1 semitone) — first training-data MUTATION axis. Adds ~160 synthetic not_splice rows (class counts 600/300/300 -> 760/300/300) by processing 2 pitch-shifted variants per clean singing file via librosa.effects.pitch_shift. Targets singing clean_fp=6 plateau at weakest-domain combined=0.272 by widening the not_splice distribution in top-SHAP spec_rolloff_delta / spec_centroid_delta / spec_bandwidth_delta space — pitch-shifted chord transitions look like chord-transition events (transposed but preserved) in spec_*_delta so GBM learns they are NOT splices. Explicit untried escalation cited in 3 prior post-mortems. Orthogonal to every prior axis: 8 GBM hyperparam failures, 5 training-data SAMPLING failures (NEG counts/distance/curriculum/bootstrap-adversarial all on original audio), 12+ feature add/ablation failures, 8+ post-filter failures, 2 model-class swaps, 2 calibration failures — ZERO prior audio-content mutation. Singing-only + clean-only ensures korean (0.500) and english (0.756) training distributions are byte-identical; vs file_hpr FEATURE 0.357 which tanked korean via global perturbation. Same fid for augmented rows keeps GroupKFold clean. OOF weighted F1=0.6143 (vs baseline 0.5904) / not_splice F1=0.857 (class-level lift). ±1 semitone is gentle to minimize phase-vocoder artifacts vs ±3-6 shifts. Pure train_classifier.py change; features.py sha unchanged so wrapper's staleness gate passive.
f71c526	0.473315	0.488205	0.387692	6	3	0.387692	0.410256	0.666667	2	4	0	discard	extend pitch-shift audio augmentation to CLEAN KOREAN training chunks (±1 semitone) — generalize the bba6dbe singing-only MUTATION axis to the regressed domain. Widens `ds_id == "singing"` gate to `ds_id in ("singing", "korean")` and renames the constant AUG_DOMAINS/AUG_SHIFTS_SEMITONES. Adds ~160 synthetic clean korean not_splice rows via librosa.effects.pitch_shift; class counts shift 760/300/300 -> 920/300/300. Targets korean clean_fp=4 / combined=0.410 regression that the singing-only aug unintentionally caused (korean 0.500->0.410, english 0.756->0.667 — global class-prior shift, not feature leakage). Mechanism transfers cleanly to speech: ±1 semitone = ~6% F0 shift (within normal prosodic variation during emphasis/questions); phase-vocoder smearing concentrates on consonant transients which are minority content in 60s chunks; formant structure + mic/room/speaker identity preserved, so synthetic rows look like intra-file prosodic variations — NOT cross-source splices — in top-SHAP spec_rolloff_delta / spec_centroid_delta / spec_bandwidth_delta space. English intentionally EXCLUDED (clean_fp=0 already so augmenting its negatives can only hurt splice recall). Orthogonal to every korean prior axis: 6 primary tunables bracketed, 8 GBM hyperparam, 5 training-data SAMPLING (NEG counts/dist/curriculum/bootstrap-adversarial all on ORIGINAL korean audio), 12+ feature add/ablation, 8+ post-filter, 2 model-class swap, 2 calibration, 2 HPR routing, 3 remote-half variants — ZERO prior audio MUTATION on korean. Same fid per aug row keeps GroupKFold clean; unique per-shift salt yields distinct negative positions per variant. Pure train_classifier.py change; features.py sha stable so wrapper's auto-retrain gate passive (wrapper will re-invoke train for a fresh joblib).
d5cc597	0.357709	0.379668	0.281928	12	3	0.282609	0.281928	0.574468	5	7	0	discard	class_weight='balanced' on HistGBM to neutralize pitch-shift aug class-prior shift — one-parameter edit (class_weight='balanced') in make_pipeline(). bba6dbe singing aug shifted class counts 600/300/300 -> 760/300/300 producing OOF per-class F1 0.858/0.311/0.301 (splice classes crushed), english 0.756->0.667 and korean 0.500->0.410 from pure recall loss on borderline splices (english clean_fp=0 confirms not precision). HistGBM class_weight='balanced' scales sample weights by n_samples/(n_classes*n_c) so not_splice drops to ~0.60x and each splice class rises to ~1.51x, re-equalizing per-class loss contribution without removing the 1360 aug rows' feature-space coverage of chord-transition events — preserves singing gain, restores english/korean recall. Orthogonal to every prior axis: 8 GBM hyperparam (n_estimators/max_depth/learning_rate/subsample), 5 training-data SAMPLING, 12+ feature add/ablate, 8+ post-filter, 2 model-class swap, 2 calibration, 2 HPR routing, 3 remote-half, 1 audio MUTATION — NO prior class_weight axis. Prior 'sample_weight 2x' UPWEIGHTED one class only; this AUTO-BALANCES all three. Refreshed OOF: weighted F1 0.6206 (vs 0.6143), macro 0.4979 (vs 0.4899), splice-class F1 lifted hard_cut 0.311->0.328 crossfade 0.301->0.305. Manual retrain + joblib/meta/cv_results committed alongside so wrapper uses fresh classifier (f71c526 joblib-skip lesson).
c0d438e	0.435685	0.458379	0.293103	7	3	0.293103	0.438356	0.643678	3	4	0	discard	pitch-shift audio augmentation of SPLICED SINGING training chunks too (±1 semitone) — widen aug gate from `ds_id == "singing" and not info.get("spliced", False)` to `ds_id == "singing"`. Adds ~320 synthetic hard_cut/crossfade rows (class counts 760/300/300 -> 1000/500/500, imbalance 2.53:1 -> 2.00:1) by processing the same 2 pitch-shifted variants per spliced singing file — pitch-shift preserves the splice discontinuity because both sources shift together but their mutual timbre/phase break is pitch-invariant. Targets the english 0.667 (was 0.756) / korean 0.410 (was 0.500) regression that bba6dbe's clean-only aug caused via GLOBAL class-prior shift: HistGBM's multi-class softmax saw 2.5:1 imbalance and pushed ambiguous probabilities toward not_splice, crossing the 0.982 gate the wrong way for borderline splices (english clean_fp=0 confirms not precision). Prior attempts to correct this without touching the aug balance FAILED: f71c526 extend-to-korean (joblib didn't rebuild, axis uninformative), d5cc597 class_weight='balanced' (catastrophic 0.358 — scaled not_splice to 0.60x globally which crushed the aug benefits on singing 0.388->0.283 as much as it tried to help korean/english). The cleaner fix is data-level class balance: also augment spliced singing files so positive rows grow proportionally, matching the clean-singing aug growth. Explicit untried escalation from bba6dbe(c)(2) and d5cc597(c)(3). Orthogonal to every prior axis: 8 GBM hyperparam, 5 training-data SAMPLING, 12+ feature add/ablation, 8+ post-filter, 2 model-class swap, 2 calibration, 2 HPR routing, 3 remote-half variants, 1 class_weight, 1 clean-singing aug, 0 spliced-singing aug. Same fid per aug row keeps GroupKFold clean; unique per-shift salt yields distinct negative positions per variant. Joblib committed alongside code so wrapper's auto-retrain gate cannot silently skip retrain (f71c526 lesson). OOF weighted F1 0.5428 / macro 0.4490 — lower than bba6dbe's 0.6143 because aug-positives are genuinely harder to classify via phase-vocoder artifacts and contaminate the train-side OOF scoring; eval-time behavior on REAL splices is the actual metric.
eabd6b2	0.362039	0.417530	0.205882	12	3	0.205882	0.315000	0.731707	6	6	0	discard	EQ-tilt audio augmentation of CLEAN SINGING training chunks (coef ±0.3) — REPLACE pitch-shift mechanism with librosa.effects.preemphasis first-order IIR spectral tilt (coef=+0.3 brightens -3dB<500Hz/+1.6dB>10kHz; coef=-0.3 mirrors). Same 2-variants-per-file topology so class counts remain 760/300/300 (no new class-prior shift beyond bba6dbe baseline). Targets bba6dbe's singing 0.388 / korean 0.410 / english 0.667 state by eliminating the phase-vocoder artifacts pitch-shift introduces into clean-aug rows while preserving the +0.116 singing gain. Mechanism: pitch-shift is a phase-vocoder transform that introduces sub-frame timing smearing in STFT — those artifacts may look like splice discontinuities to the model, inflating clean p_splice even on transposed copies. EQ-tilt is a deterministic one-pole IIR filter: zero phase-vocoder, preserves all timing; it moves the formant / mastering axis directly — which is exactly the physical signature the top-3 SHAP features (spec_rolloff_delta/spec_centroid_delta/spec_bandwidth_delta) measure. Augmented chunks now look like "same song under a different master EQ / different room tonal balance" — the physical variation production pipelines naturally emit, precisely what GBM needs to learn does NOT indicate a splice. Explicit untried escalation cited in three prior post-mortems: bba6dbe(c)(3), d5cc597(c)(2), c0d438e(c)(2). Orthogonal to every prior axis: 8 GBM hyperparam, 5 training-data SAMPLING, 12+ feature add/ablation, 8+ post-filter, 2 model-class swap, 2 calibration, 2 HPR routing, 3 remote-half variants, 1 class_weight, 3 pitch-shift-aug variants — ZERO prior attempts at EQ-based audio mutation. Smoke-verified: librosa.effects.preemphasis with coef=+0.3 gives -3dB below 500Hz and +1.6dB above 10kHz on white noise (4-5dB total spectral tilt). Manual retrain: OOF weighted F1 0.6103 (vs bba6dbe's 0.6143), class counts 760/300/300 identical, per-class F1 not_splice=0.857 (match) / hard_cut=0.323 (+0.012 vs bba6dbe's 0.311) / crossfade=0.271 (-0.030 vs 0.301) — OOF signal mixed but OOF poorly predicts eval (d5cc597 had higher OOF yet catastrophic eval). features.py sha unchanged so wrapper's auto-retrain gate passive; joblib+meta+cv_results+training_manifest committed alongside so wrapper cannot silently skip retrain (f71c526 joblib-skip lesson).
423014c	0.385591	0.438380	0.256790	11	3	0.290909	0.256790	0.767442	4	7	0	discard	HYBRID pitch-shift + time-stretch aug on clean singing — REPLACE one of the two ±1-semitone pitch-shift variants on clean singing chunks with a time-stretch variant (rate=0.95) so class counts stay at bba6dbe's 760/300/300 (NO new class-prior shift). 1 pitch-shift variant (+1 semitone) + 1 time-stretch variant (rate=0.95, chunk grows 60→63.2s, _sample_candidates uses recomputed aug_dur_s) per clean singing file × 4 NEG_PER_CLEAN × 20 files = 160 aug rows total. Time-stretch is the explicit untried mutation axis cited in 3 prior post-mortems (bba6dbe(c), c0d438e(c)(3), eabd6b2(c)). Mechanism: pitch_shift modifies frequency axis preserving time; time_stretch modifies time axis preserving pitch — same librosa.effects family / same phase-vocoder smearing characteristics, rotated 90° in the time-frequency plane. Augmented chunks now look like 'same song at 5%% slower tempo' — natural performance variation that GBM should learn is NOT a splice. HYBRID addresses both prior failure patterns: keeps half of bba6dbe's proven pitch-axis coverage (avoiding eabd6b2's mechanism-replacement gain loss) AND adds an orthogonal phase-vocoder axis (avoiding f71c526/d5cc597/c0d438e's class-prior shifts). features.py sha unchanged so wrapper's auto-retrain gate is passive; joblib + meta + cv_results + training_manifest committed alongside (f71c526 joblib-skip lesson). OOF weighted F1=0.6202 (vs bba6dbe 0.6143), per-class hard_cut 0.311→0.329 (+0.018) crossfade 0.301→0.316 (+0.015) not_splice 0.857→0.855 (essentially match) — both splice classes lift on disk while not_splice holds, suggesting the time-axis variant gives slightly more diverse not_splice context than the dropped -1 pitch-shift. Orthogonal to every prior axis: 8 GBM hyperparam, 5 training-data SAMPLING, 12+ feature add/ablation, 8+ post-filter, 2 model-class swap, 2 calibration, 2 HPR routing, 3 remote-half variants, 1 class_weight, 4 audio MUTATION variants — ZERO prior time-stretch.
d5484a4	0.473315	0.488205	0.387692	6	3	0.387692	0.410256	0.666667	2	4	0	discard	soft-voting ensemble of 3 HistGBMs (seeds 42/123/456) — variance-reduction in p>0.98 tail. Pure train_classifier.py change: make_pipeline() wraps 3 HGBs with identical hyperparams but different random_state in a VotingClassifier(voting='soft'). All HGB knobs (max_iter=200/max_depth=3/max_leaf_nodes=8/learning_rate=0.07/l2=1.0/min_samples_leaf=20) unchanged. Training data unchanged (bba6dbe pitch-shift aug preserved at 760/300/300). detector.py byte-unchanged because VotingClassifier exposes classes_ and predict_proba with identical semantics. Targets bba6dbe's singing 0.388 / korean 0.410 / english 0.667 plateau by attacking an untried axis: seed-specific residual-fit quirks. HistGBM random_state seeds subsample ordering and split tie-breaking so two HGBs on identical data produce slightly-different decision surfaces in the high-probability tail (p>0.98) where clean FPs (singing 2, korean 4 at p~0.982-0.99) sit. Soft-voting averages the per-seed disagreements out of predict_proba without changing bias — emits that are SEED-SPECIFIC (only seed-42 pushes them over the 0.982 gate) get pulled below by the other two. Real splice TPs typically score p>0.99 on ALL seeds (stable positions) so rarely lose the gate. Orthogonal to every prior axis: 8 GBM hyperparam, 5 training-data SAMPLING, 12+ feature add/ablation, 8+ post-filter, 2 model-class swaps (both changed FAMILY — HistGBM kept, ExtraTrees catastrophic), 2 calibration (isotonic bug-killed, sigmoid 0.419), 2 HPR routing, 3 remote-half, 1 class_weight, 5 audio MUTATION — ZERO prior ensemble of same-family models. Cost: 3x train time (~3min x 3 ≈ 9min absorbed in retrain budget) and 3x inference predict_proba at stride=0.12 dense scan (each call is ~75-dim matmul + tree traversal; VotingClassifier parallelizes via n_jobs=-1 so wall-clock cost sublinear). Eval budget 243/300s leaves ~60s headroom.  Risk-bounded: if seeds agree on all emits, ensemble = single-seed output (worst case reproduces bba6dbe 0.473); class ordering preserved by design of soft-voting; detector.py touches 'classes_' and 'predict_proba' both exposed identically by VotingClassifier.
273b8f5	0.479100	0.496326	0.387692	6	3	0.387692	0.410811	0.690476	2	4	0	keep	DSP-confirmation floor post-filter — drop GBM emits whose strongest DSP z-score (phase/T²/CPE) is below DSP_CONFIRMATION_MIN=2.0, applied BEFORE dedupe so a strong-DSP neighbor can still win a 3.5s cluster. Pure detector.py change, no retrain, no feature change. Targets bba6dbe's singing 0.388 / korean 0.410 / english 0.667 plateau where 8 consecutive post-bba6dbe classifier/training-data discards have failed. Mechanism: top-SHAP features are spec_rolloff_delta/spec_centroid_delta/spec_bandwidth_delta across all domains (400-890 mass in singing, 350-660 in english) but dsp_t2_z shows 83-230 mass across all 3 domains too — GBM already treats T² as a strong auxiliary signal. What GBM doesn't enforce is a REQUIREMENT that at least one DSP channel fires — its softmax can still emit on an overwhelming spectral signal alone (chord transition → big spec_*_delta but smooth phase, modest T², low CPE). Real cross-source splices produce at least one DSP spike (phase_z fires at mic/room mismatch in hard cuts, T² fires at spectral-distribution shift in crossfades, CPE fires at prediction failure). Threshold 2.0 is conservative — 2 std devs above chunk-local MAD z — leaving headroom for real splices (typically z=3-10 on at least one channel). Orthogonal to every prior axis: 8 GBM hyperparam, 5 training-data SAMPLING, 12+ feature add/ablation, 8+ post-filter (persistence/plateau/class-margin/tonality/onset-local-pct/HPR-remote-rolloff/global-half-centroid/mfcc-remote — all operate on spectral or probability-curve signals, NEVER on required-DSP confirmation), 2 model-class swap, 2 calibration, 2 HPR routing, 6 audio MUTATION, 1 ensemble. Blast radius: detector.py only, ~15 lines added, feature_names unchanged so classifier sha stable (no retrain). Per-emit cost: three float reads from already-computed feature vector, negligible. Smoke: detect_splices on 10s noise returns [] without error, DSP_CONFIRMATION_CHANNELS=('dsp_phase_z','dsp_t2_z','dsp_cpe_z') resolves via bundle.feature_names with graceful no-op if any channel missing.
7255ec6	0.474696	0.491406	0.394805	6	3	0.397059	0.394805	0.682353	2	4	0	discard	GBM_THRESHOLD 0.982 -> 0.980 leveraging the just-kept DSP-confirmation floor (273b8f5). One-line primary tunable, no retrain. Prior 0.981 FAILED pre-DSP-filter — failure mode was chord-transition FPs with weak DSP (T² < 2.0, smooth phase, low CPE), exactly the population the 273b8f5 filter now culls pre-dedupe. With that safety net, admitting emits in [0.980, 0.982] is a genuinely new interaction: survivors to dedupe are the ones with strong DSP (real splices), while chord-transition FPs in the same p_splice band get dropped by the DSP floor. 0.980 is OUTSIDE prior tried range [0.981, 0.983] — truly untested. Targets borderline TP recall (subtle crossfades / hard cuts near the decision boundary) where bba6dbe's singing 0.388 / korean 0.411 / english 0.690 plateau is gated by recall not precision (english clean_fp=0, korean/singing clean_fp bounded). Pure detector.py one-constant edit, minimum blast radius, zero retrain cost, features.py sha stable so classifier byte-identical. If TPs don't rise but FPs do, fallback is tighten DSP_CONFIRMATION_MIN 2.0 -> 2.2. If TPs rise asymmetrically across classes, fallback is class-specific DSP channel routing (hard_cut needs phase_z >= 2.0, crossfade needs t2_z >= 2.0).
d256901	0.448578	0.462463	0.348387	3	3	0.348387	0.415625	0.623377	2	1	0	discard	class-specific DSP channel routing stacked on the MAX floor — after the existing max(phase_z,t2_z,cpe_z)>=2.0 filter (273b8f5), drop emits where the predicted class's primary DSP channel is below 2.0: hard_cut (label=1) requires dsp_phase_z>=2.0 (mic/room phase break), crossfade (label=2) requires dsp_t2_z>=2.0 (spectral-distribution shift). Pure detector.py change, no retrain, no feature change. Targets singing 0.388 / korean 0.411 post-273b8f5 plateau where 2 singing + 4 korean clean FPs sit. Mechanism: chord transitions and speech phoneme shifts typically fire T² (smooth spectral-distribution change over chord/phoneme window) but NOT phase_z (no mic/room discontinuity); when GBM predicts hard_cut on such an emit, the current MAX filter keeps it (T²>=2.0 wins the max). Class-specific routing drops hard_cut emits with phase_z<2.0 — exactly the channel-class-mismatch FPs. Real hard-cut TPs have strong phase_z by physical construction (cross-source phase cannot smooth); real crossfade TPs have strong T² (a spectral-distribution shift IS the definition of a crossfade). Explicit untried next-step from 7255ec6(c)(2). Orthogonal to every prior post-filter (persistence/plateau/class-margin/tonality/onset-local-pct/HPR-remote-rolloff/global-half-centroid/mfcc-remote/DSP-MAX-floor all used a single global scalar without class→channel mapping). Risk-bounded because stacked: emit must satisfy BOTH max DSP>=2.0 AND class's primary channel>=2.0, so this can only DROP emits, never create new TPs; drops require the MISMATCH pattern. Per-emit cost: one extra float compare past the MAX gate, negligible. Blast radius: detector.py only, ~10 lines added, feature_names unchanged, classifier sha stable (no retrain). Smoke: detect_splices on 10s noise returns [] without error, DSP_CLASS_CHANNEL={1:'dsp_phase_z',2:'dsp_t2_z'} resolves via bundle.feature_names with graceful no-op if any channel missing.
865d92f	0.487946	0.506364	0.383607	6	3	0.383607	0.428169	0.707317	2	4	0	keep	SUM-based DSP floor companion stacked on MAX (multi-channel confirmation) — add `DSP_SUM_MIN=4.5` after the existing `DSP_CONFIRMATION_MIN=2.0` MAX gate (273b8f5). Drop GBM emits where `sum(dsp_phase_z, dsp_t2_z, dsp_cpe_z) < 4.5` even when MAX passes. Pure detector.py change, no retrain, no feature change. Targets bba6dbe's singing 0.388 / korean 0.411 plateau where 2 singing + 4 korean clean FPs survived 273b8f5's MAX floor — these are single-channel firings (chord transitions: T²=3 with smooth phase / low CPE, sum~3.5-4.5; speech phoneme shifts: T²=2.5 with phase ~0.7 CPE ~1.0, sum~3.5-5). Real cross-source splices disrupt multiple physical signals simultaneously (mic/room mismatch fires phase AND T² AND CPE) yielding sum 6-12. SUM gate demands ~2.5 of cumulative support beyond the MAX floor of 2.0, biting single-channel-firing FPs while preserving multi-channel-confirmed real splices. Explicit untried escalation cited in two prior post-mortems: 7255ec6(c)(3) and d256901(c)(3). Orthogonal to all prior post-filters: 8 GBM hyperparam, 5 training-data SAMPLING, 12+ feature add/ablate, 8+ post-filter (persistence/plateau/class-margin/tonality/onset-local-pct/HPR-remote-rolloff/global-half-centroid/mfcc-remote/DSP-MAX-floor/class-specific-DSP — none used SUM-based multi-channel cumulative confirmation), 2 model-class swap, 2 calibration, 2 HPR routing, 3 remote-half, 1 class_weight, 6 audio MUTATION, 1 ensemble. Risk-bounded by stacking: can only DROP emits passing MAX gate, never create new TPs; drops require single-channel-firing pattern. Per-emit cost: one extra sum + compare past MAX gate, negligible. Blast radius: detector.py only, ~10 lines added, feature_names unchanged so classifier sha stable (no retrain). Smoke: detect_splices on 10s noise returns [] without error, DSP_SUM_MIN=4.5 reads gracefully when DSP_CONFIRMATION_CHANNELS resolve via bundle.feature_names.
