commit	combined	combined_mean	combined_min	clean_fp	n_datasets	combined_singing	combined_korean	combined_english	clean_fp_singing	clean_fp_korean	clean_fp_english	status	description
b5b1a0d	0.556428	0.590631	0.354098	4	3	0.354098	0.582353	0.835443	2	2	0	discard	add mfcc_post_retrospective_match (FEATURE_NAMES 80->81) -- min cos_dist from post[t,t+2] to past pre-context windows [t-k-2,t-k] for k in {3,6,9,12}s. STRUCTURAL pivot off the 60+ PRE-vs-POST-at-single-boundary family onto RETROSPECTIVE CONTEXT MATCHING. Chord-cycle FP: post chord already appeared at some past k -> min small -> silent, FP not boosted. Cross-song splice: post is song B absent from entire pre-history -> min large -> fires. Speech self-gating: within-recording past and post share speaker+mic+room so all distances small -> min small -> feature ~0 on non-splice -> GBM low per-domain SHAP. Reuses cached feat_mfcc; ZERO new librosa calls, ZERO new caches. Edge guard t-14<0 OR t+2>duration -> sentinel 0.0. FEATURE_NAMES 80->81 forces retrain via US-505 sha gate. Orthogonal: NOT any paired-diff/voicing-masked single-boundary feature; NOT 9064eec cross-intra (intra sub-windows on SAME span, no past-history bank, no MIN aggregator); NOT 4e67946 persistence (future horizons); NOT 4314449 cross-scale; NOT 1b4fe7c corr-matrix; NOT 1b3eb06 trajectory velocity; NOT 1e57702 histogram; NOT DSP-gate. FIRST min-over-past-context feature in 80-set, FIRST feature using past pre-history as comparison bank. Smoke-verified: len(FEATURE_NAMES)==81 last-name correct; synthetic chord-cycle A(3s period) + song-B splice at t=30 yields 0.018437 vs within-A chord-cycle t=18 yields 0.000005 (~3700x discrimination); edge guards t-14<0 and t+2>duration both return 0.0 sentinel correctly; real singing train audio 200 calls = 0.82ms/call; all 81 features finite; idempotent on repeated calls.
3d56d52	0.479388	0.504017	0.330000	8	3	0.330000	0.466667	0.715385	2	4	2	discard	add voiced_mfcc_post_retrospective_match (FEATURE_NAMES 80->81) -- VOICING-MASKED retrospective context match. Fuses proven voicing-mask self-gating (1eda8e3 +0.054 biggest keep, 49bd0b1 voiced_mfcc +0.028 keep) onto b5b1a0d's retrospective-match mechanism (all-frame version lifted singing 0.345->0.354 best in 60+ iterations but regressed korean/english). For post[t,t+2] voiced-mean MFCC, compute min cos_dist to voiced-mean MFCC at past windows [t-k-2,t-k] for k in {3,6,9,12}s. Voicing mask excludes mic/room noise-floor variability that drove b5b1a0d speech regression. Mechanism on 3 singing chord-cycle FPs: same singer's repeated vowels match some past k -> min tiny -> silent. Cross-song splice: post voiced differs from all past song-A voiced -> min large -> fires. Speech self-gating: within-recording same-speaker vowel-mean MFCC stable across past k -> min tiny non-splice -> silent. Cross-speaker splice: post voiced differs from all past speaker-A voiced -> min large -> fires. Reuses cached feat_mfcc + feat_vp, ZERO new librosa calls, ZERO new caches. Edge guard t-14<0 OR t+2>duration OR any voiced mask empty -> sentinel 0.0. Orthogonal: NOT b5b1a0d (all-frame no mask); NOT 49bd0b1 voiced_mfcc (single-boundary no past bank no MIN); NOT 4e67946 persistence (future horizon); NOT 9064eec/c5040d7 cross-intra (intra sub-windows on SAME span); NOT 1eda8e3/7972a98 asymmetry (single boundary no past bank). FIRST voicing-masked min-over-past-context feature. Pure features.py change -- 1 new block (~55 lines) + FEATURE_NAMES append + 2 assert bumps (80->81) + 1 call. Per-t cost 5 slices + 5 voiced-masked means on 13-dim + 4 cosines + 1 min, sub-ms. Smoke-verified: len(FEATURE_NAMES)==81, last name correct, synthetic A(220Hz)/B(440Hz) splice at t=30 yields 0.432 vs within-A t=20 yields 0.003 (~160x discrimination), edge guards t=10 (t-14<0) and t=39 (t+2>40s) both return 0.0, all 81 features finite on synthetic audio, idempotent on repeated calls.
a6cf49d	0.522140	0.545202	0.377419	5	3	0.377419	0.492754	0.765432	2	3	0	discard	add voiced_chroma_post_retrospective_match (FEATURE_NAMES 80->81) -- VOICING-MASKED retrospective context match on the CHROMA (pitch-class / key-signature) axis. For post[t,t+2] voiced-mean chroma, compute min cos_dist against voiced-mean chroma at past windows [t-k-2,t-k] for k in {3,6,9,12}s. Cited fallback from 3d56d52(c)(3). b5b1a0d all-frame MFCC retrospective match lifted singing 0.345->0.354 (BEST in 60+ iterations) but regressed korean/english (unvoiced noise-floor heterogeneity); 3d56d52 voicing-masked MFCC variant regressed singing further 0.354->0.330 because drum-onset signal in MFCC cepstrum that drove retrospective match lives in UNVOICED frames. Chroma is structurally different: drums/broadband percussion barely register in chroma (noise-like transients spread roughly uniformly across 12 pitch classes) so voicing mask doesn't strip productive signal. Within one song's key every chord shares 3-5 of 12 pitch classes so voiced-mean chroma over any 2s window converges to key-signature center; past {3,6,9,12}s voiced-chroma windows all sit in same key -> min cos_dist TINY on chord-cycle FP -> silent, FP not boosted. Cross-song splice crosses keys: post voiced chroma song B key, past voiced chroma all song A key -> all distances LARGE -> min LARGE -> fires. Speech self-gating (proven 32cac36 voiced_chroma template): voiced chroma on speech is per-vowel prosodic pitch-class noise that averages to near-uniform over any window >=1s, all past windows have similar uniform chromas -> min small uniform on non-splice speech -> GBM low per-domain SHAP on english/korean. Reuses cached feat_chroma + feat_vp, ZERO new librosa calls, ZERO new caches. Edge guard t-14<0 OR t+2>duration_s OR any voiced mask empty OR any norm underflow -> sentinel 0.0. FEATURE_NAMES 80->81 forces auto-retrain via US-505 sha gate. Orthogonal: NOT b5b1a0d (all-frame MFCC, different axis AND mask); NOT 3d56d52 (voiced MFCC, different axis); NOT 32cac36 voiced_chroma_cosine_dist (single boundary, no past bank, no MIN aggregator); NOT 8170784 voiced_chroma_cross_intra_contrast (intra sub-windows on SAME +-4s span, no past history); NOT f4148cc voiced_unvoiced_chroma_asymmetry (1st-order paired-diff); NOT 9064eec/c5040d7/26a3687 cross-intra; NOT 4e67946 persistence (future horizon); NOT 4314449 cross-scale; NOT 1b4fe7c corr-matrix; NOT any DSP-gate. FIRST voicing-masked min-over-past-context feature on CHROMA axis. Pure features.py change -- 1 new block (~65 lines) + FEATURE_NAMES append + 2 assert bumps (80->81) + 1 call in extract_features + self-test assert bump. Per-t cost 5 slices + 5 voiced-masked means on 12-dim chroma + 4 cosines + 1 min, sub-ms. Smoke-verified: len(FEATURE_NAMES)==81, last name 'voiced_chroma_post_retrospective_match', synthetic A(C-major chord-cycle 3s period)/B(F#-major) splice at t=30 yields 0.612 LARGE vs within-A chord-cycle t=18 yields 0.000021 (~29000x discrimination), edge guards t=10 (t-14<0) and t=39 (t+2>40s) both return 0.0 sentinel correctly, all 81 features finite, idempotent on repeated calls.
32ff893	0.544995	0.587256	0.342857	5	3	0.342857	0.532836	0.886076	2	3	0	discard	add voiced_chroma_self_calibrated_novelty (FEATURE_NAMES 80->81) -- SELF-CALIBRATED retrospective-match on voiced chroma. For post[t,t+2] voiced-mean chroma compute min cos_dist to 4 past voiced-mean chromas at [t-k-2,t-k] for k in {3,6,9,12}s (post_novelty), AND mean cos_dist over all 6 pairwise past-past pairs (past_self_sim); feature = post_novelty - past_self_sim. Reuses cached feat_chroma + feat_vp, ZERO new librosa calls, ZERO new caches. Edge guard t-14<0 OR t+2>duration_s OR any voiced mask empty OR any norm underflow -> sentinel 0.0. FEATURE_NAMES 80->81 forces auto-retrain via US-505 sha gate. Three prior retrospective-match variants: b5b1a0d (all-frame MFCC) singing 0.354 best-in-60+ but speech regressed; 3d56d52 (voiced MFCC) singing further regressed; a6cf49d (voiced chroma) singing 0.377 HIGHEST-in-60+ but speech catastrophic (korean 0.667->0.493 english 0.889->0.765). Pattern: retrospective-match bites chord-cycle FPs on singing but absolute min-over-past fires on non-splice speech because within-recording prosody/phoneme drift makes min non-trivial. STRUCTURAL fix = self-calibration: compare post_to_past novelty against past_to_past self-similarity; within-recording drift cancels, only cross-source novelty survives. Mechanism: chord-cycle FP past_self_sim small AND post_novelty small (post recurs in past) -> feature ~0 silent; real cross-song past_self_sim small AND post_novelty LARGE (song B) -> feature +0.25 to +0.50 fires; speech non-splice past_self_sim moderate AND post_novelty moderate same-drift -> feature ~0 (GBM low per-domain SHAP no new FPs); speech cross-speaker TP past_self_sim moderate AND post_novelty LARGE -> feature positive TP boosted. Chroma axis because a6cf49d gave highest-in-60+ singing 0.377 -- raw signal is there only the aggregator was wrong; drums/percussion barely register in chroma so voicing mask doesn't strip productive signal (killed 3d56d52 voiced MFCC). Orthogonal: NOT a6cf49d (absolute min no self-cal); NOT b5b1a0d/3d56d52 (different axis, no self-cal); NOT 32cac36 single-boundary no past bank; NOT 8170784 cross-intra (same +-4s span no past-history bank no self-calibration); NOT f4148cc 1st-order paired-diff; NOT 9064eec/26a3687/c5040d7 cross-intra; NOT 4e67946 persistence; NOT 4314449 cross-scale; NOT 1b4fe7c corr-matrix; NOT any DSP-gate. FIRST self-calibrated (relative to past-history self-similarity) retrospective-match feature, FIRST feature combining novelty with past-history pair-distance baseline. GBM max_depth=4 cannot synthesize subtraction of two derived scalars from threshold splits. Pure features.py change -- 1 new block (~60 lines) + FEATURE_NAMES append + 2 assert bumps (80->81) + 1 call + self-test assert bump. Per-t cost: 5 voiced-masked-mean 12-dim + 4 post-past cosines + 6 past-past cosines + min + mean + subtract, sub-ms. Smoke-verified: len(FEATURE_NAMES)==81 last-name correct, synthetic chord-cycle C-major cycling 3s period within-song yields t=18 -0.53 / t=22 -0.04 / t=25 -0.06 / t=28 -0.03 ALL NEGATIVE (post recurs in past); A->B splice at t=25 yields t=18 -0.53 / t=22 -0.04 / t=25 +0.26 / t=28 +0.33 SIGN-FLIP at boundary, real singing train 200 calls = 0.89ms/call, edge guards t-14<0 and t+2>duration both return 0.0 sentinel, all 81 features finite, idempotent.
c578d73	0.518572	0.564583	0.318750	6	3	0.318750	0.500000	0.875000	3	3	0	discard	add voiced_chroma_retrospective_match_max_calibrated (FEATURE_NAMES 80->81) -- MAX-CALIBRATED retrospective-match on voiced chroma. For post[t,t+2] voiced-mean chroma compute min cos_dist to 4 past voiced-mean chromas at [t-k-2,t-k] for k in {3,6,9,12}s (post_novelty) AND MAX cos_dist over all 6 pairwise past-past distances (past_self_sim_max); feature = post_novelty - past_self_sim_max. Reuses cached feat_chroma + feat_vp + feat_audio length; ZERO new librosa calls, ZERO new caches. Edge guard t-14<0 OR t+2>duration_s OR any voiced mask empty OR any norm underflow -> sentinel 0.0. FEATURE_NAMES 80->81 forces auto-retrain via US-505 sha gate. Four prior retrospective-match variants: b5b1a0d (all-frame MFCC) singing 0.354; 3d56d52 (voiced MFCC) singing 0.330; a6cf49d (voiced chroma absolute min) singing 0.377 BEST-in-70+ but speech catastrophic 0.767/0.493; 32ff893 (self-cal with MEAN past-pair baseline) speech recovered to 0.886 but singing gave back to 0.343. Pattern: retrospective-match HAS the singing signal (a6cf49d highest-ever) and self-calibration stabilises speech (32ff893), but MEAN baseline absorbs too much cross-song signal because MEAN averages small adjacent-pair distances alongside the few pairs that cross chord-cycle boundaries. MAX baseline captures CEILING of internal novelty: the single largest past-vs-past distance is by definition the biggest novelty the recording itself supports. Mechanism on 3 singing chord-cycle FPs: past at k in {3,6,9,12} samples different phases of chord cycle; at least one past-past pair crosses chord boundary (past_self_sim_max ~0.15-0.20); post_novelty on chord-cycle FP matches cycle at some k so min-distance ~0.10-0.15; feature ~0 to -0.05 SILENT. Cross-song splice: past song A self-consistent past_self_sim_max ~0.08, post song B post_novelty ~0.40-0.60, feature +0.32-0.52 STRONGLY POSITIVE. Speech non-splice (a6cf49d failure class): past_self_sim_max ~0.15-0.20 phoneme-drift ceiling; post_novelty ~0.15 similar drift; feature ~0 GBM low per-domain SHAP on english/korean. Speech cross-speaker TP: past same-speaker max ~0.10, post speaker-B ~0.30, feature +0.18-0.22 fires. Chroma axis because a6cf49d was single highest singing score in 70+ iterations (0.377 vs baseline 0.345); raw signal is there, only aggregator was wrong; drums/percussion barely register in chroma so voicing mask does not strip productive signal. Orthogonal: NOT a6cf49d (absolute min no self-cal); NOT 32ff893 (MEAN baseline -- MAX is different aggregator GBM max_depth=4 cannot synthesize from threshold splits on same 10 cosines); NOT b5b1a0d/3d56d52 (MFCC axis); NOT 32cac36 single-boundary; NOT 8170784 cross-intra same-span; NOT f4148cc 1st-order paired-diff; NOT 9064eec/26a3687/c5040d7 cross-intra; NOT 4e67946 persistence; NOT 4314449 cross-scale; NOT 1b4fe7c corr-matrix; NOT any DSP-gate. FIRST MAX-self-calibrated retrospective-match feature; FIRST use of max-over-past-pairs as novelty ceiling. Pure features.py change -- 1 new block (~80 lines) + FEATURE_NAMES append + 2 assert bumps (80->81) + 1 call + self-test assert bumps. Per-t cost: 5 voiced-masked-means on 12-dim chroma + 4 post-past cosines + 6 past-past cosines + min + max + subtract, sub-ms. Smoke-verified: len(FEATURE_NAMES)==81 last-name correct, synthetic C-major chord-cycle A -> F#-major B splice at t=25 yields +0.575 vs within-A t=25 +0.143 (4x discrimination), within-A t=22 chord transition yields +0.135 (chord-cycle not strongly firing), within-A t=18 yields -0.53 (post recurs in past, feature negative), edge guards t-14<0 and t+2>duration both return 0.0 sentinel, real singing_train_001.wav 500 calls = 307ms (0.61ms/call), idempotent, all 81 features finite.
8593da7	0.521115	0.568758	0.304762	6	3	0.304762	0.537313	0.864198	4	2	0	discard	add unvoiced_spec_contrast_post_retrospective_match (FEATURE_NAMES 80->81) -- UNVOICED-mask retrospective context match on spec_contrast (mastering-signature) axis. For post[t,t+2] unvoiced-mean 7-dim contrast, min cos_dist to unvoiced-mean contrast at past [t-k-2,t-k] for k in {3,6,9,12}s. Reuses cached feat_contrast + feat_vp, ZERO new librosa calls, ZERO new caches. Sentinel 0.0 on t-14<0 OR t+2>duration OR any unvoiced mask empty OR any norm underflow. Five prior retrospective-match variants tried, ALL on voiced/all-frame mask and MFCC/chroma axis: b5b1a0d (all-frame MFCC, singing 0.354 / speech regressed), 3d56d52 (voiced MFCC, singing 0.330 -- drum-onset lives UNVOICED), a6cf49d (voiced chroma absolute min, singing 0.377 BEST-in-70+ / speech catastrophic), 32ff893 (self-cal MEAN) / c578d73 (self-cal MAX) -- both rescued speech but killed singing gain. Retrospective mechanism DOES bite chord-cycle FPs on singing (a6cf49d highest-ever 0.377) but calibration subtracts the signal. NONE of the 5 used UNVOICED mask; NONE used spec_contrast. Unvoiced+spec_contrast is at the intersection of two proven mechanisms: 1eda8e3 voiced_unvoiced_MFCC_asymmetry +0.054 biggest keep (unvoiced captures cross-song mastering signal), 7972a98 voiced_unvoiced_spec_contrast +0.005 keep (spec_contrast axis carries mastering). Mechanism on 3 singing chord-cycle FPs: drum kit + compressor + limiter + EQ frozen within-song so unvoiced spec_contrast recurs across past k -> min TINY -> silent -> FP not boosted. Cross-song splice: different mastering chain -> unvoiced spec_contrast differs -> min LARGE -> fires. Speech self-gating via 1eda8e3 mechanism: mic+preamp+codec frozen within-recording so unvoiced consonants+silence spec_contrast stable across k -> min TINY on non-splice -> GBM low per-domain SHAP on english/korean. Speech cross-speaker TP: mic chain change -> min MODERATE/LARGE -> helps speech TPs. Orthogonal: NOT b5b1a0d (all-frame MFCC); NOT 3d56d52 (voiced MFCC -- OPPOSITE mask different axis); NOT a6cf49d/32ff893/c578d73 (voiced chroma -- OPPOSITE mask different axis); NOT 7972a98 voiced_unvoiced_spec_contrast_asymmetry (single-boundary paired-diff no past bank no MIN aggregator); NOT e7ca9eb voiced_spec_contrast (voiced mask single-boundary); NOT 26a3687 spec_contrast_cross_intra_contrast (intra sub-windows SAME +-4s no past-history bank); NOT any 1st-order paired-diff; NOT any DSP-gate. FIRST unvoiced-mask retrospective match; FIRST spec_contrast retrospective match in 80-set. Pure features.py change -- 1 new block (~55 lines cloning voiced_mfcc_post_retrospective_match template with unvoiced mask replacing voiced + spec_contrast 7-dim replacing MFCC 13-dim) + FEATURE_NAMES append + 2 assert bumps (80->81) + 1 call in extract_features + self-test assert bumps. Per-t cost: 5 slices + 5 unvoiced-masked means on 7-dim + 4 cosines + 1 min, sub-ms. Smoke-verified: len(FEATURE_NAMES)==81 last-name 'unvoiced_spec_contrast_post_retrospective_match', real singing_train clean_001 at 7 within-song probe positions yields small values 0.0000-0.0077 (mechanism-consistent: unvoiced frames stable across past k within-song), 3/7 non-zero (rest return 0.0 sentinel when 2s window lacks unvoiced frames -- vocal-dense positions), edge guards t=5 (t-14<0) and t=29 (t+2>dur) both return 0.0, 300 calls 0.15s (0.52ms/call), all 81 features finite across 15 sampled positions, idempotent on repeated calls.
a23ab28	0.490700	0.537120	0.295385	6	3	0.295385	0.476471	0.839506	4	2	0	discard	add music_gated_voiced_chroma_retro_match (FEATURE_NAMES 80->81) -- voicing-fraction-gated retrospective voiced-chroma match. Combines a6cf49d's productive mechanism (singing 0.377 HIGHEST-in-70+ but speech catastrophic) with a HARD MUSIC GATE on post voicing_fraction: >=0.55 returns 0.0 (speech, gate closed), else min over k in {3,6,9,12}s of cos_dist(voiced_mean_chroma(post[t,t+2]), voiced_mean_chroma([t-k-2,t-k])). Reuses cached feat_chroma + feat_vp + feat_audio; ZERO new librosa calls, ZERO new caches. Edge guard t-14<0 OR t+2>duration OR any voiced mask empty OR norm underflow -> sentinel 0.0. FEATURE_NAMES 80->81 forces auto-retrain via US-505 sha gate. 6 prior retrospective-match variants: b5b1a0d (all-frame MFCC) singing 0.354 speech regressed; 3d56d52 (voiced MFCC) 0.330 drums-in-unvoiced stripped; a6cf49d (voiced chroma abs min) singing 0.377 speech catastrophic; 32ff893 (MEAN self-cal) / c578d73 (MAX self-cal) both rescued speech but subtracted singing gain; 8593da7 (unvoiced spec_contrast) 0.304. Pattern: retrospective-match HAS singing signal (a6cf49d highest-ever) but absolute min-past-dist fires on within-recording speech drift; every arithmetic self-cal via subtraction absorbs singing signal too. Correct lever is HARD DOMAIN GATE via intrinsic audio statistic: singing (vocals+accompaniment) has post voicing_fraction ~0.30-0.55; pure speech 0.65-0.85. Threshold 0.55 separates them. Feature identically 0.0 on speech -> GBM cannot learn any english/korean split on it -> bypasses a6cf49d failure mode rather than cancelling arithmetically. Mechanism on 3 singing chord-cycle FPs: vp_post~0.40 gate opens; post voiced-chroma converges to key centroid (chords share 3-5 of 12 pitch classes); past {3,6,9,12}s windows all in same key -> min TINY silent FP not boosted. Cross-song splice: past song-A-key, post song-B-key -> min LARGE fires. Speech: gate closed feature=0; speech TPs handled by existing 1eda8e3 MFCC asymmetry. Orthogonal: NOT a6cf49d (abs min no gate); NOT 32ff893/c578d73 (subtraction self-cal); NOT b5b1a0d/3d56d52 (MFCC axis); NOT 8593da7 (unvoiced spec_contrast); NOT 32cac36 voiced_chroma (single-boundary); NOT 8170784 voiced_chroma_cross_intra; NOT f4148cc 1st-order paired-diff; NOT any DSP-gate. FIRST voicing-fraction-gated feature in 80-set; FIRST feature using intrinsic audio statistic as hard domain switch rather than arithmetic normalization. GBM max_depth=4 cannot synthesize if-else gate on min-over-past-bank because no past-bank feature exists. Pure features.py change -- 1 new block (~65 lines) + FEATURE_NAMES append + 2 assert bumps (80->81) + 1 call in extract_features + self-test assert bumps. Per-t cost 5 voiced-masked-means on 12-dim chroma + 4 cosines + 1 min, sub-ms. Smoke-verified: len(FEATURE_NAMES)==81 last-name 'music_gated_voiced_chroma_retro_match'; real singing clean_001 t=20 vp_post=0.405 -> feature=0.1849 (gate open, retrospective active), t=25 vp_post=0.740 -> feature=0.0 (gate closed); real english clean_001 t=16/20 vp_post=0.889 -> feature=0.0 (gate closed across speech); edge guards t=10 (t-14<0) and t=29.5 (t+2>30) both return 0.0; all 81 features finite; idempotent.
